"review-details_overallRating__VDxCx","timestamp_reviewDate__wvu2v","review-details_detailsLink__NxIv5","review-details_detailsLink__NxIv5 href","review-details_employee__5iA6v","review-details_employeeDetails__BvAwX","review-details_location__E_Ine","review-details_isCollapsed__Bsg_9","review-details_isCollapsed__Bsg_9 2","expand-button_ExpandButton__FlBlZ","review-details_isExpanded__bLJng","review-details_isExpanded__bLJng 2"
"5.0","26 Apr 2021","Good","https://www.glassdoor.co.in/Reviews/Employee-Review-Hindustan-Aeronautics-RVW46101364.htm","Graduate trainee","Current intern","Nashik","Excellent work place in the nashik","Good training place in the nashik","Show more","",""
"5.0","14 Jul 2021","Review","https://www.glassdoor.co.in/Reviews/Employee-Review-Hindustan-Aeronautics-RVW49770634.htm","Summer intern","Former intern, less than 1 year","","","","","It was good and very helpful in learning a lot","No cons to say about the company"
"4.0","26 Sept 2021","Good Experience for Freshers","https://www.glassdoor.co.in/Reviews/Employee-Review-Hindustan-Aeronautics-RVW53123974.htm","Graduate apprentice trainee (gat)","Former employee","Bengaluru","","","","Can learn directly under the guidance of the Mentor/Manager","Menial work given during initial days"
"3.0","22 Nov 2021","Job at HAL","https://www.glassdoor.co.in/Reviews/Employee-Review-Hindustan-Aeronautics-RVW55699824.htm","Manager","Current employee","Koraput","","","","Good place to learn and apply basixs of engineering","Slow growth rate. Lack of advanced knowledge application."
"4.0","9 Jun 2012","Review of HAL","https://www.glassdoor.co.in/Reviews/Employee-Review-Hindustan-Aeronautics-RVW1575747.htm","Vigilance","Current employee, less than 1 year","Bengaluru","","","","One of the fastest growing PSUs","Highly Technical and demanding sector"
"4.0","2 Nov 2012","Defence org","https://www.glassdoor.co.in/Reviews/Employee-Review-Hindustan-Aeronautics-RVW2103749.htm","Technical","Former employee","Lucknow","To serve for nationality feeling","nothing like H A L","Show more","",""
"1.0","24 Jul 2014","Poor wok culture and partial management","https://www.glassdoor.co.in/Reviews/Employee-Review-Hindustan-Aeronautics-RVW4642171.htm","Design engineer","Current employee, more than 5 years","Bengaluru","government jobs even a donkey will get paid...","poor salary
management behavior is abusive will all 'F' words, shouting, yelling on juniors.
Incentive is not paid ever.
IT infrastructure of company is below zero
NO proper tools and work process
old donkey want to see donkey around...","Show more","",""
"4.0","8 Oct 2015","Good Place","https://www.glassdoor.co.in/Reviews/Employee-Review-Hindustan-Aeronautics-RVW8221739.htm","Intern","Former employee, less than 1 year","Bengaluru","","","","Learn All aspects of Aircraft Manufacturing","No proper goals. Less projects for such a big company"
"2.0","7 Jan 2016","Good Company","https://www.glassdoor.co.in/Reviews/Employee-Review-Hindustan-Aeronautics-RVW9104665.htm","Anonymous employee","Former employee","Calcutta","Good learning  and Good company","poor employer and more worker centric","Show more","",""
"4.0","21 Apr 2017","Great place to Learn","https://www.glassdoor.co.in/Reviews/Employee-Review-Hindustan-Aeronautics-RVW14722624.htm","Anonymous employee","Former employee","Bengaluru","Plenty to Learn as an intern
Availability of guidance","Difficulty in Accessibility by Public Transport","Show more","",""
"5.0","1 Aug 2018","Best Company To work for","https://www.glassdoor.co.in/Reviews/Employee-Review-Hindustan-Aeronautics-RVW21764625.htm","Engineer","Current intern, less than 1 year","Pune","Best Company To work for","Nothing  as such right now","Show more","",""
"5.0","7 Sept 2018","1 month Internship","https://www.glassdoor.co.in/Reviews/Employee-Review-Hindustan-Aeronautics-RVW22358774.htm","Anonymous intern","Current intern","","Nice trainers
Regular lab visits
Supportive staffs","Only vocational training.
Students from all streams are taught together.","Show more","",""
"3.0","22 Mar 2019","Not much satisfaction","https://www.glassdoor.co.in/Reviews/Employee-Review-Hindustan-Aeronautics-RVW25292140.htm","Anonymous employee","Current employee","","","","","high end technology, working for national defence","politics everywhere, no proper transfer policies, work life balance"
"2.0","4 Sept 2019","Intern at HAL","https://www.glassdoor.co.in/Reviews/Employee-Review-Hindustan-Aeronautics-RVW29038323.htm","Anonymous intern","Former intern","","No work pressure.
Shift timings are 7 to 3.","Old and outdated systems.
Interns don't have much to do.","Show more","",""
"3.0","12 Sept 2019","Working at HAL","https://www.glassdoor.co.in/Reviews/Employee-Review-Hindustan-Aeronautics-RVW29183218.htm","Anonymous employee","Current employee","","","","","Good place to learn for someone with passion","No accountability. Have got to be self motivated."
"4.0","14 Sept 2019","Trainee","https://www.glassdoor.co.in/Reviews/Employee-Review-Hindustan-Aeronautics-RVW29232203.htm","Graduate engineer trainee","Current employee","","Good 
Aircraft knowledge 
Great place to learn for aeronautics engineers","Salary low
We want approach employers for study","Show more","",""
"5.0","6 Dec 2020","One of the best organisations.","https://www.glassdoor.co.in/Reviews/Employee-Review-Hindustan-Aeronautics-RVW39128566.htm","Enineering","Current temporary employee","Bengaluru","","","","Good work environment at the workplace","There are no cons for this."
"4.0","14 Feb 2021","Good company culture","https://www.glassdoor.co.in/Reviews/Employee-Review-Hindustan-Aeronautics-RVW42489368.htm","Apprenticeship","Former employee, less than 1 year","Sunabeda","Because of aerospace engineering works","Files movement & help to other officers","Show more","",""
"2.0","24 Feb 2021","lazy work culture,careless attitude","https://www.glassdoor.co.in/Reviews/Employee-Review-Hindustan-Aeronautics-RVW43031011.htm","Anonymous intern","Former intern, less than 1 year","Koraput","","","","less work pressure,no accountability,a lot of personal time","disgusting work culture,inefficient system.low talent employees managable officers"
"3.0","6 Mar 2021","Very good company with a good pay.","https://www.glassdoor.co.in/Reviews/Employee-Review-Hindustan-Aeronautics-RVW43571152.htm","General manager","Former employee, more than 10 years","Bengaluru","","","","Facilities are amazing, amenities, location.","Work hours : extensive work durations, pension."
"4.0","17 Mar 2021","Depends on how you take it","https://www.glassdoor.co.in/Reviews/Employee-Review-Hindustan-Aeronautics-RVW44136386.htm","Manager","Former employee, more than 8 years","Bengaluru","","","","Unique experience, Job security, Learning","Low salary, Office politics, regionalism, mundane schedule"
"5.0","19 Mar 2021","DESIGN TRAINEE","https://www.glassdoor.co.in/Reviews/Employee-Review-Hindustan-Aeronautics-RVW44288462.htm","Design trianee","Current employee","Bengaluru","","","","VERY good enviroment for work","challenging job but intersting one"
"3.0","21 Jul 2021","Typical Gov Job","https://www.glassdoor.co.in/Reviews/Employee-Review-Hindustan-Aeronautics-RVW50085418.htm","Design engineer","Former employee, more than 3 years","Bengaluru","Good for timepass for a day","Bad for career for anyone","Show more","",""
"5.0","1 Oct 2021","Salary","https://www.glassdoor.co.in/Reviews/Employee-Review-Hindustan-Aeronautics-RVW53412354.htm","Assistant general manager","Current employee, more than 10 years","","Govt benefits , pf, hra and house benefits","No cons . A great company .","Show more","",""
"4.0","10 Nov 2021","Good","https://www.glassdoor.co.in/Reviews/Employee-Review-Hindustan-Aeronautics-RVW55206692.htm","Diploma engineer trainee","Current employee, less than 1 year","Balanagar","","","","Good environment .all are knowledgeable persons there","I think there is no down words in the HAL"
"5.0","8 Nov 2021","IMM","https://www.glassdoor.co.in/Reviews/Employee-Review-Hindustan-Aeronautics-RVW55089064.htm","Industrial material management","Former contractor, less than 1 year","Hyderābād","","","","Best Place to learn and gain practical knowledge","Infrastructure should be updated on a regular basis"
"5.0","20 Dec 2021","Good work place","https://www.glassdoor.co.in/Reviews/Employee-Review-Hindustan-Aeronautics-RVW56928520.htm","Diploma engineer trainee","Former intern, less than 1 year","Nashik","","","","learn a lot about aeronautical aspects","No full time work opportunities at the moment"
"4.0","7 Jul 2012","Lots to learn.","https://www.glassdoor.co.in/Reviews/Employee-Review-Hindustan-Aeronautics-RVW1702352.htm","Summer intern","Former intern, less than 1 year","Bengaluru","","","","state of the art technology, good workforce","have to put up with stupid bureaucracy"
"3.0","18 Aug 2015","Management wake up call","https://www.glassdoor.co.in/Reviews/Employee-Review-Hindustan-Aeronautics-RVW7628611.htm","Manager","Current employee, more than 10 years","Bengaluru","Learning, Experts, good work & life, values","Bureaucracy, casual, career growth, compensation","Show more","",""
"5.0","16 Mar 2016","Quality","https://www.glassdoor.co.in/Reviews/Employee-Review-Hindustan-Aeronautics-RVW9943019.htm","Quality analyst intern","Current employee, less than 1 year","Bengaluru","","","","Nice place to learn many things","Nothing actually its really a great place to work"
"3.0","17 Dec 2016","OK Place","https://www.glassdoor.co.in/Reviews/Employee-Review-Hindustan-Aeronautics-RVW13030472.htm","Anonymous employee","Former employee","","","","","Freedom, Stability, No Dead Lines etc . Great Medical Facility","PSUs are PSU. Less challenges ."
"3.0","19 Apr 2017","Striving hard to become world class","https://www.glassdoor.co.in/Reviews/Employee-Review-Hindustan-Aeronautics-RVW14694037.htm","Manager","Current employee","","Great Infrastructure
Ample learning opportunities
World class machinery","Stagnant growth
No respect for individual
Draconian policy","Show more","",""
"5.0","8 Aug 2017","Manager IT","https://www.glassdoor.co.in/Reviews/Employee-Review-Hindustan-Aeronautics-RVW16265761.htm","Anonymous employee","Current employee, more than 10 years","Bengaluru","","","","Good place to learn,Innovative,multi-project environment handling","growth in work place,more projects to handle simultaneously"
"5.0","28 Aug 2018","Internship at HAL","https://www.glassdoor.co.in/Reviews/Employee-Review-Hindustan-Aeronautics-RVW22195693.htm","Anonymous intern","Former intern","","","","","Relaxed and cool working and learning environment","Insufficient coordination/instruction given to the interns."
"3.0","23 Jan 2019","Internship at HAL","https://www.glassdoor.co.in/Reviews/Employee-Review-Hindustan-Aeronautics-RVW24340261.htm","Internship","Former employee, less than 1 year","Bengaluru","Ability to see new aircrafts 
Presence of all equipment","Lethargic working environment
No salary to interns","Show more","",""
"4.0","27 Feb 2019","Good environment to learn work.","https://www.glassdoor.co.in/Reviews/Employee-Review-Hindustan-Aeronautics-RVW24918487.htm","Graduate apprentice trainee","Former intern, more than 1 year","Bengaluru","","","","Good place to gain knowledge","Still they are working on old projects."
"5.0","17 Jun 2019","Internship at hal ,koraput","https://www.glassdoor.co.in/Reviews/Employee-Review-Hindustan-Aeronautics-RVW27446566.htm","Anonymous intern","Current intern","","","","","Amazing atmosphere.intelligent engineers all around","No cons because of great Ratna company."
"4.0","13 Jul 2019","Hal","https://www.glassdoor.co.in/Reviews/Employee-Review-Hindustan-Aeronautics-RVW27976393.htm","Project coordinator","Current employee, more than 10 years","Bengaluru","","","","Vast knowledge  & in depth analysis","No growth & challenges in day to day activities"
"5.0","21 Aug 2019","Currently doing apprenticeship training.","https://www.glassdoor.co.in/Reviews/Employee-Review-Hindustan-Aeronautics-RVW28751700.htm","Anonymous employee","Current employee","","","","","Very proud to work for the country.","No cons. Good work culture."
"4.0","7 Dec 2019","Security","https://www.glassdoor.co.in/Reviews/Employee-Review-Hindustan-Aeronautics-RVW30750005.htm","Anonymous employee","Current employee","","","","","Work balance in the job and good salary","Tough job as it is very secure place"
"4.0","11 Dec 2019","okay company to work","https://www.glassdoor.co.in/Reviews/Employee-Review-Hindustan-Aeronautics-RVW30817683.htm","Dy manager","Former employee, more than 5 years","","","","","good learning great exposure friendly atmosphere","slow and red tapism slow to respond"
"3.0","22 Aug 2020","Decent work environment","https://www.glassdoor.co.in/Reviews/Employee-Review-Hindustan-Aeronautics-RVW35180700.htm","Intern","Former intern, less than 1 year","Bengaluru","Excellent work life balance at HAL","Not very challenging environment at HAL","Show more","",""
"2.0","9 Oct 2020","Awesome company","https://www.glassdoor.co.in/Reviews/Employee-Review-Hindustan-Aeronautics-RVW36932247.htm","Anonymous intern","Former intern","","","","","It is a Navaratna company, good PSU, no work load","There are no cons in this company."
"5.0","26 Dec 2020","Aerospace Company","https://www.glassdoor.co.in/Reviews/Employee-Review-Hindustan-Aeronautics-RVW39811470.htm","Dgm - operations","Current employee, more than 10 years","","","","","Very good company to work","Business and other Policy decision inline to Govt. Directives"
"5.0","24 Mar 2021","Good for gaining technical knowledge","https://www.glassdoor.co.in/Reviews/Employee-Review-Hindustan-Aeronautics-RVW44484999.htm","Anonymous intern","Current intern, less than 1 year","","","","","Good for gaining technical knowledge","Some officers treat trainee as labours"
"4.0","1 Jun 2021","Intern  total","https://www.glassdoor.co.in/Reviews/Employee-Review-Hindustan-Aeronautics-RVW47721904.htm","Anonymous employee","Current employee","Bengaluru","Should work at Hal 
Support","Good ones s supportive staff and good learning experience","Show more","",""
"5.0","4 Jun 2021","Great Company","https://www.glassdoor.co.in/Reviews/Employee-Review-Hindustan-Aeronautics-RVW47892174.htm","Senior manager","Current employee","Bengaluru","","","","Excellent company for a great career,","Many levels of hierarchy to reach the top."
"4.0","16 Jun 2021","Good to work","https://www.glassdoor.co.in/Reviews/Employee-Review-Hindustan-Aeronautics-RVW48410745.htm","Technician","Former employee, more than 1 year","","","","","Good timely pay and great compensation.","Less growth as it is a timely process."
"5.0","15 Jun 2021","Great workplace","https://www.glassdoor.co.in/Reviews/Employee-Review-Hindustan-Aeronautics-RVW48367974.htm","Graduate engineer trainee","Former employee, less than 1 year","Lucknow","Study the advance technology in plane.","Exit permission not allowed by business time.","Show more","",""
"5.0","27 Sept 2021","an aerospace industries","https://www.glassdoor.co.in/Reviews/Employee-Review-Hindustan-Aeronautics-RVW53180572.htm","Intern","Current intern, less than 1 year","New Delhi","","","","nice work culture and people","no cons as as i was an intern"
"5.0","3 Oct 2021","good","https://www.glassdoor.co.in/Reviews/Employee-Review-Hindustan-Aeronautics-RVW53443903.htm","Intern","Current intern","Bengaluru","","","","good environment and learning with highly skilled engineers","far from the city and traffic issues"
"4.0","18 Oct 2021","Awesome","https://www.glassdoor.co.in/Reviews/Employee-Review-Hindustan-Aeronautics-RVW54130882.htm","Anonymous temporary employee","Former temporary employee, less than 1 year","Bengaluru","","","","Flexible working hours and better exposure.","Sometimes workload becomes so little that it feels very boring."
"4.0","8 Nov 2021","NOT ADVISABLE","https://www.glassdoor.co.in/Reviews/Employee-Review-Hindustan-Aeronautics-RVW55045101.htm","Graduate apprentice trainee","Former employee, more than 1 year","Bengaluru","No work pressure
Timings are great
No extra work or regular work","Not a place for Engineers.","Show more","",""
"4.0","19 Nov 2021","Positive review","https://www.glassdoor.co.in/Reviews/Employee-Review-Hindustan-Aeronautics-RVW55581358.htm","Intern","Former intern, less than 1 year","","Working environment good. 
good place to learn .","nothing cons.
nothing to say about that.","Show more","",""
"4.0","1 Aug 2013","Hands on Industry Exposure","https://www.glassdoor.co.in/Reviews/Employee-Review-Hindustan-Aeronautics-RVW2886282.htm","Anonymous intern","Former intern","","","","","Research on Fifth Generation Fighter Aircrafts.","High costs of manufacturing and maintenance."
"5.0","21 Nov 2016","Good company","https://www.glassdoor.co.in/Reviews/Employee-Review-Hindustan-Aeronautics-RVW12741946.htm","Anonymous employee","Current employee","","","","","Great learning experience. Best in aerospace","Salary is moderate as per industry standards"
"4.0","10 Mar 2017","Good aerospace company","https://www.glassdoor.co.in/Reviews/Employee-Review-Hindustan-Aeronautics-RVW14130801.htm","Anonymous employee","Current employee, more than 10 years","","","","","Good infrastructure and production environment","Tedious process, procedures,  bad decisions from management"
"4.0","14 Jun 2017","worked as intern in HAL","https://www.glassdoor.co.in/Reviews/Employee-Review-Hindustan-Aeronautics-RVW15480667.htm","Intern","Former intern, less than 1 year","Bengaluru","","","","environment is good for working","entering is not easy into HAL"
"3.0","3 Nov 2017","Review for HAL","https://www.glassdoor.co.in/Reviews/Employee-Review-Hindustan-Aeronautics-RVW17708369.htm","Software engineer","Former employee, more than 3 years","Bengaluru","Good atmosphere for learning and growing","Low salary
Normal work
less pressure on working condition","Show more","",""
"4.0","21 Jan 2018","Good place to learn","https://www.glassdoor.co.in/Reviews/Employee-Review-Hindustan-Aeronautics-RVW18835062.htm","Anonymous intern","Former intern","","","","","Interesting work and great learning experience","Some people tend to be unprofessional"
"4.0","5 Aug 2018","Nice to work with","https://www.glassdoor.co.in/Reviews/Employee-Review-Hindustan-Aeronautics-RVW21814371.htm","Manager","Current employee, more than 10 years","Bengaluru","","","","Good hands on work on embedded systems","less salary and work location"
"5.0","10 Oct 2018","Good experience","https://www.glassdoor.co.in/Reviews/Employee-Review-Hindustan-Aeronautics-RVW22879955.htm","Anonymous intern","Former intern, more than 1 year","Kānpur, Uttar Pradesh","","","","Got to know the work culture","Monotonous nature of work, less valued work"
"4.0","26 Dec 2018","Nice Management.","https://www.glassdoor.co.in/Reviews/Employee-Review-Hindustan-Aeronautics-RVW23962763.htm","Apprentice","Former intern, less than 1 year","Hyderābād","Superb place to learn and skills growth.","Nothing is bad. Everything is fine.","Show more","",""
"3.0","5 Jan 2019","Not that good","https://www.glassdoor.co.in/Reviews/Employee-Review-Hindustan-Aeronautics-RVW24070469.htm","Anonymous intern","Former intern, less than 1 year","","","","","Good production & assembly line up.","No such innovation involved. Work culture not good."
"4.0","30 Jan 2019","Graduate Apprentice Trainee","https://www.glassdoor.co.in/Reviews/Employee-Review-Hindustan-Aeronautics-RVW24465565.htm","Anonymous employee","Former employee","","","","","Good environment at Factory level","Quality of food should be increased for apprentice"
"4.0","2 Apr 2019","Trainee","https://www.glassdoor.co.in/Reviews/Employee-Review-Hindustan-Aeronautics-RVW25464457.htm","Anonymous intern","Former intern, more than 1 year","Bengaluru","","","","Good place to learn  and implement your ideas.","Nothing, old technologies . Nothing else"
"4.0","14 May 2019","Design engineer","https://www.glassdoor.co.in/Reviews/Employee-Review-Hindustan-Aeronautics-RVW26130009.htm","Anonymous intern","Former intern","","","","","Flexible timeings,no work pressure,inelectuals,best projects","People become lazy,loose ability,less pay,best employees but bad, management"
"5.0","15 May 2019","intern","https://www.glassdoor.co.in/Reviews/Employee-Review-Hindustan-Aeronautics-RVW26151609.htm","Anonymous intern","Former intern","","knowledge at  best of it","punctuality need to be gain","Show more","",""
"5.0","4 Jun 2019","Trainee","https://www.glassdoor.co.in/Reviews/Employee-Review-Hindustan-Aeronautics-RVW26466863.htm","Anonymous intern","Former intern, less than 1 year","Kanpur Nagar","Good Environment, helpful people, great learning.","Not really, everything is good.","Show more","",""
"5.0","7 Jul 2019","A good company to work","https://www.glassdoor.co.in/Reviews/Employee-Review-Hindustan-Aeronautics-RVW27841993.htm","Anonymous intern","Current intern","","Hands on experience
Good Industrial exposure","Too much work for trainees","Show more","",""
"5.0","4 Nov 2019","Good place to learn","https://www.glassdoor.co.in/Reviews/Employee-Review-Hindustan-Aeronautics-RVW30184382.htm","Anonymous intern","Current intern","","","","","Exposure to different ideas in avionics","Less hands on experience here."
"5.0","14 Mar 2020","Dreamland for Engineers","https://www.glassdoor.co.in/Reviews/Employee-Review-Hindustan-Aeronautics-RVW32368956.htm","Systems test intern","Former intern, less than 1 year","Nashik","The latest and finest technology.","There is no space for errors.","Show more","",""
"4.0","2 Jun 2020","Good","https://www.glassdoor.co.in/Reviews/Employee-Review-Hindustan-Aeronautics-RVW33477656.htm","Apprentice","Former contractor, more than 1 year","Bengaluru","","","","Good for apprenticeships. Good balance of work","Same old technology. Old staff. No younger staff"
"5.0","24 Sept 2020","Gained experience","https://www.glassdoor.co.in/Reviews/Employee-Review-Hindustan-Aeronautics-RVW36330357.htm","Freelancer","Former employee","Bengaluru","","","","Environment will tech you the technology","many sectors, not able to allow inside"
"4.0","30 Sept 2020","Internship at HAL","https://www.glassdoor.co.in/Reviews/Employee-Review-Hindustan-Aeronautics-RVW36525401.htm","Intern","Former intern, less than 1 year","Bengaluru","","","","Govt. job and job security","Many people are not doing their job well."
"4.0","23 Oct 2020","Wonderful place","https://www.glassdoor.co.in/Reviews/Employee-Review-Hindustan-Aeronautics-RVW37537275.htm","Anonymous intern","Former intern","","","","","Good Place to work, Lot to learn","Downside is should Travel for longer distance"
"5.0","10 Oct 2020","Internship","https://www.glassdoor.co.in/Reviews/Employee-Review-Hindustan-Aeronautics-RVW36976399.htm","Fresher - data mining | technical recruiter","Current intern","Bengaluru","","","","Great facilities Provided by the company fro Internship","Timings are strict. Far from home"
"4.0","3 Nov 2020","good","https://www.glassdoor.co.in/Reviews/Employee-Review-Hindustan-Aeronautics-RVW37950982.htm","Graduate student","Former intern","Bengaluru","","","","everthing there is good from lunche to dinner","none at least as per my knowledge"
"4.0","24 Feb 2021","Manager","https://www.glassdoor.co.in/Reviews/Employee-Review-Hindustan-Aeronautics-RVW43016121.htm","Plant manager","Current employee","Bengaluru","Well established
Hands on experience
Technology driven
Skilled labour
Aerospace industry","Un desciplined work force
Dependency
Work culture is not good
slow
timings","Show more","",""
"5.0","23 Feb 2021","Great work environment","https://www.glassdoor.co.in/Reviews/Employee-Review-Hindustan-Aeronautics-RVW42938833.htm","Intern","Former intern","","","","","Great place for intern here","no cons can be found during intern"
"5.0","7 May 2021","good","https://www.glassdoor.co.in/Reviews/Employee-Review-Hindustan-Aeronautics-RVW46644429.htm","Mechanical engineer","Former intern","Chennai","helpful environment
competitiveness
great learning
Good Life style and efficient work","rigorous
outdated equipment
Typical government work
 Grumpy Management","Show more","",""
"4.0","30 May 2021","Good","https://www.glassdoor.co.in/Reviews/Employee-Review-Hindustan-Aeronautics-RVW47662878.htm","Senior manager, operations","Current employee, more than 10 years","","Good place to learn aerospace engineering and technology","Rigid and inflexible
HR policies are not dynamic","Show more","",""
"3.0","26 Jul 2021","my experience with HAL","https://www.glassdoor.co.in/Reviews/Employee-Review-Hindustan-Aeronautics-RVW50283967.htm","Senior manager","Current employee","Bengaluru","","","","Exposure to latest technology, Job security, Travelling opportunities","Company timing, conventional hierarchial structure"
"5.0","29 Nov 2021","Good","https://www.glassdoor.co.in/Reviews/Employee-Review-Hindustan-Aeronautics-RVW55960420.htm","Financial analyst","Current employee","Bengaluru","","","","good work place environment, learning","Very confidential area where even mobile phones not allowed"
"3.0","5 Dec 2021","Design Engineer","https://www.glassdoor.co.in/Reviews/Employee-Review-Hindustan-Aeronautics-RVW56242338.htm","Design engineer","Former employee, more than 3 years","Bengaluru","","","","job security and details learning on the aircraft and engine","slow growth and slow growth"
"5.0","6 Dec 2021","Good","https://www.glassdoor.co.in/Reviews/Employee-Review-Hindustan-Aeronautics-RVW56272739.htm","Graduate apprenticeship trainee","Former intern, less than 1 year","","Good work
Good time
Good job 
Strict policy
Mobile not allowed","Good hostel
Free food lunch
Timing
Good experienced peopel","Show more","",""
