"review-details_overallRating__VDxCx","timestamp_reviewDate__wvu2v","review-details_detailsLink__NxIv5","review-details_detailsLink__NxIv5 href","review-details_employee__5iA6v","review-details_employeeDetails__BvAwX","review-details_location__E_Ine","review-details_isCollapsed__Bsg_9","review-details_isCollapsed__Bsg_9 2","expand-button_ExpandButton__FlBlZ","review-details_isExpanded__bLJng","review-details_isExpanded__bLJng 2"
"5.0","22 Nov 2022","Good","https://www.glassdoor.co.in/Reviews/Employee-Review-Hindustan-Aeronautics-RVW71306547.htm","Senior assistant engineer","Former employee, more than 1 year","","","","","Good work culture, great learning curve","Not much funds incoming into the organisation"
"5.0","7 Nov 2022","Experience","https://www.glassdoor.co.in/Reviews/Employee-Review-Hindustan-Aeronautics-RVW70852007.htm","Graduate appreciate trainee","Former intern, more than 1 year","","","","","It was a good experience working there.","Stipend was low but I got very nice people to work with."
"5.0","23 Nov 2022",".","https://www.glassdoor.co.in/Reviews/Employee-Review-Hindustan-Aeronautics-RVW71326821.htm","Embedded systems engineer","Former intern","","","","","Great Work Environment, Big Planes","Big Campus, no phones allowed ig"
"4.0","20 Nov 2022","Manager","https://www.glassdoor.co.in/Reviews/Employee-Review-Hindustan-Aeronautics-RVW71239213.htm","Manager","Current employee, more than 8 years","Bengaluru","","","","Job security and safety throughout your service","Slow growth no definite job profile"
"4.0","18 Oct 2022","Good Experience for aerospace enthusiastics","https://www.glassdoor.co.in/Reviews/Employee-Review-Hindustan-Aeronautics-RVW70257649.htm","Anonymous intern","Former intern, more than 1 year","","","","","Good Experience for freshers who want to enter into aerospace field.","salary is very less compared to the other GET programs."
"5.0","4 Nov 2022","The best indian aerospace company","https://www.glassdoor.co.in/Reviews/Employee-Review-Hindustan-Aeronautics-RVW70784001.htm","Anonymous intern","Former intern, less than 1 year","Bengaluru","","","","Work life balance is well maintained","Very rigid growth structure at organization"
"4.0","5 Nov 2022","great place to learn","https://www.glassdoor.co.in/Reviews/Employee-Review-Hindustan-Aeronautics-RVW70808194.htm","Anonymous intern","Current intern, less than 1 year","","","","","good, fun, great place to learn,","dress code, some might be rude"
"4.0","16 Oct 2022","A good company to start your career","https://www.glassdoor.co.in/Reviews/Employee-Review-Hindustan-Aeronautics-RVW70203139.htm","Manager","Former employee, more than 8 years","New Delhi","Opportunities for the seekers, good learning","Slow career growth and 06 days working","Show more","",""
"5.0","21 Oct 2022","Supervisor","https://www.glassdoor.co.in/Reviews/Employee-Review-Hindustan-Aeronautics-RVW70370167.htm","Supervisor","Current employee, more than 10 years","","One of the best place to work in aviation industry","To start manufacturing passenger aircraft","Show more","",""
"5.0","31 Oct 2022","About work","https://www.glassdoor.co.in/Reviews/Employee-Review-Hindustan-Aeronautics-RVW70662792.htm","Management trainee","Current employee","","","","","I can able to express my feelings freely","Saturated work it doesn't feels good"
"5.0","28 Oct 2022","Best eve experience","https://www.glassdoor.co.in/Reviews/Employee-Review-Hindustan-Aeronautics-RVW70583632.htm","Gat (graduate apprentice trainee)","Former intern, more than 1 year","","Friendly working environment No restriction on Time","Nothing everything is just fine here","Show more","",""
"3.0","10 Oct 2022","Good work, bad management","https://www.glassdoor.co.in/Reviews/Employee-Review-Hindustan-Aeronautics-RVW69964763.htm","Deputy manager","Former employee, more than 3 years","","Good work where you will get opportunity to work on real aircraft","Bad management and bad working environment","Show more","",""
"5.0","23 Oct 2022","Experience","https://www.glassdoor.co.in/Reviews/Employee-Review-Hindustan-Aeronautics-RVW70411598.htm","Intern","Former employee","","","","","Exciting to experience and friendly workspace.","Very less to learn and grow."
"4.0","27 Oct 2022","good","https://www.glassdoor.co.in/Reviews/Employee-Review-Hindustan-Aeronautics-RVW70553732.htm","Aerospace engineer","Current employee","Indi, Karnataka","","","","good life work-life balance good salary","salary increases based on experience"
"3.0","22 Sept 2022","Good company to work for","https://www.glassdoor.co.in/Reviews/Employee-Review-Hindustan-Aeronautics-RVW69339181.htm","Anonymous employee","Current employee","","1. Its an OEM.
2. Competitive technology
3. Good scope to learn","Follows a hierarchical setup. Not flexible in work timing. Will lose leave if late.","Show more","",""
"5.0","11 Oct 2022","Good Aerospace Company","https://www.glassdoor.co.in/Reviews/Employee-Review-Hindustan-Aeronautics-RVW70022434.htm","Graduate apprentice trainee","Former intern, more than 1 year","Bengaluru","","","","Good Working Environment and good people.","Less hoildays and less job opportunity"
"5.0","14 Oct 2022","Good","https://www.glassdoor.co.in/Reviews/Employee-Review-Hindustan-Aeronautics-RVW70166426.htm","Anonymous intern","Current intern, less than 1 year","","They are really knowledgeable, great, fun","Lazy, busy, good, nice, okay","Show more","",""
"4.0","26 Sept 2022","Experience","https://www.glassdoor.co.in/Reviews/Employee-Review-Hindustan-Aeronautics-RVW69445607.htm","Intern","Current intern","","","","","The production process is highly supervised and efficient","The place could’ve been cleaner and it was tough to communicate with others"
"5.0","15 Oct 2022","Good","https://www.glassdoor.co.in/Reviews/Employee-Review-Hindustan-Aeronautics-RVW70183492.htm","Mechanical engineer","Former contractor","","","","","I learned more technical knowledge.","Only one year contract was there."
"3.0","11 Oct 2022","Nice place","https://www.glassdoor.co.in/Reviews/Employee-Review-Hindustan-Aeronautics-RVW70008909.htm","Assisntente juridico","Current intern, less than 1 year","Calcutta","","","","All good and nice place to work","None all was decent and good"
"5.0","23 Sept 2022","about","https://www.glassdoor.co.in/Reviews/Employee-Review-Hindustan-Aeronautics-RVW69367045.htm","Anonymous intern","Former intern","Kanpur Nagar","","","","a very good place to learn.","you will have to push yourself. no one is going to help you there."
"3.0","18 Mar 2022","READ PROS AND CONS AND THEN DECIDE :)","https://www.glassdoor.co.in/Reviews/Employee-Review-Hindustan-Aeronautics-RVW61389887.htm","Graduate apprentice trainee","Former employee","","1. No Work pressure. If you really don't have any opportunities at the moment you can consider going for this apprenticeship.
2. A place to be in if you are preparing for some other competitive examinations.
3. Nice and friendly employees.
4. Hands on exposure and an opportunity to spend time with deadly fighter aircrafts if you are in the right division.
5. Once in  a life time opportunity to visit and explore the facilities available at India's one of the top aerospace companies (OEM)
6.  You can build some really good networks if you wish to choose aerospace sector as your career domain.","1.Typical government office environment. The pace at which employees work here is freaking slow. Sometimes you get pissed off seeing them work at such a slow pace.
2.Nobody will give a damn about your existence you can literally waste your whole day and return home . ( Not true for all divisions but applicable for majority of the divisions ) 
3. Highly discouraging employees as they believe that there are very less opportunities in the core aerospace sector.  BUT THAT IS THE REALLY HARD TO ACCEPT SAD TRUTH :( 
4. Do not waste your one year time for this apprenticeship if you really have some better option in hand.
5.In most of the divisions your are not asked to do any core engineering work. You would merely end up doing some data entry work like log book entry, file management(manual not digital ), part description documentation etc.  
6.Totally NON Competitive environment with average peer group.
7.The CORE technical knowledge that one would be learning is bare minimum. In certain cases you will not gain any technical knowledge at all!   
8. Hence most of the people start looking for some other opportunities and they try to switch,  sometimes even to different fields.","Show more","",""
"2.0","26 Sept 2022","HR policies are not so good","https://www.glassdoor.co.in/Reviews/Employee-Review-Hindustan-Aeronautics-RVW69465844.htm","Anonymous employee","Former employee, more than 5 years","","","","","Job security, good colleagues, training and development","HR policies, canteen, 6 days working, fixed timing,"
"1.0","22 Nov 2022","Best job for students","https://www.glassdoor.co.in/Reviews/Employee-Review-Hindustan-Aeronautics-RVW71321457.htm","Sealer","Current employee","","","","","Fixed salary, local conveyance, incentive","Huge target, no fix incentive, hr language is not well. And there behaviour is very bad."
"4.0","22 Sept 2022","excellent","https://www.glassdoor.co.in/Reviews/Employee-Review-Hindustan-Aeronautics-RVW69330285.htm","Internship","Former intern","","","","","Very good opportunity for students to engage in  Advanced Machine","Poor work culture and no proper guidence"
"4.0","19 Sept 2022","Betteer","https://www.glassdoor.co.in/Reviews/Employee-Review-Hindustan-Aeronautics-RVW69195521.htm","Technician","Former employee","Bhusāwal","Best carrier .knowledge of airospace industries .","Not freedoms. Strick work .not eassy","Show more","",""
"5.0","22 Sept 2022","Best Place to work","https://www.glassdoor.co.in/Reviews/Employee-Review-Hindustan-Aeronautics-RVW69361382.htm","Graduate engineer trainee","Former intern","","New things to learn
Best facilities from company","No Growth for Trainee
Less Salary","Show more","",""
"5.0","23 Sept 2022","Internship","https://www.glassdoor.co.in/Reviews/Employee-Review-Hindustan-Aeronautics-RVW69363979.htm","Intern","Current intern, less than 1 year","Bengaluru","","","","Best organization ever with a good environment","Food is not upto the mark"
"4.0","20 Sept 2022","alh","https://www.glassdoor.co.in/Reviews/Employee-Review-Hindustan-Aeronautics-RVW69272688.htm","Project research","Current intern","","","","","learned about the helicopter and machining","there we no cons in the internship"
"2.0","20 Aug 2022","Good company to learn","https://www.glassdoor.co.in/Reviews/Employee-Review-Hindustan-Aeronautics-RVW68137058.htm","Manager","Current employee, more than 10 years","Bengaluru","very good company to learn","very bad culture, very poor work life balance","Show more","",""
"5.0","2 Sept 2022","Explore knowledge","https://www.glassdoor.co.in/Reviews/Employee-Review-Hindustan-Aeronautics-RVW68639069.htm","Assistant engineer","Former employee, more than 8 years","","Explore Aero technology and Air Defence","No down side about company","Show more","",""
"4.0","9 Sept 2022","Good for learning","https://www.glassdoor.co.in/Reviews/Employee-Review-Hindustan-Aeronautics-RVW68881290.htm","Design trainee","Current employee, less than 1 year","Bengaluru","","","","Lots of projects and fields to learn","Timing and food inside the office"
"4.0","6 Sept 2022","Research and design","https://www.glassdoor.co.in/Reviews/Employee-Review-Hindustan-Aeronautics-RVW68756934.htm","Graduate apperentice trainee","Current intern, less than 1 year","Bengaluru","","","","Nice place to learn and understand aeronautics effectively.","No cons. Nice place to work."
"3.0","19 Jul 2022","good company where you get good exposure total aerospace development lifecycleprocesses","https://www.glassdoor.co.in/Reviews/Employee-Review-Hindustan-Aeronautics-RVW66883976.htm","Senior systems engineer","Former employee, more than 10 years","Hyderābād","good company where you get good exposure to total aerospace development life cycle processes.
higher education sponsorship
medical benefits","less salary
no flexible working salaries
no 5 day /week","Show more","",""
"4.0","10 Aug 2022","Intern review","https://www.glassdoor.co.in/Reviews/Employee-Review-Hindustan-Aeronautics-RVW67758960.htm","Project intern","Former intern, less than 1 year","Bengaluru","Very good exposure
can see all the aircrafrs","Food is OK
officers will be busy
Interns should be paid","Show more","",""
"2.0","16 Jul 2022","Good People but bad Management","https://www.glassdoor.co.in/Reviews/Employee-Review-Hindustan-Aeronautics-RVW66784454.htm","Engineering intern","Current intern, less than 1 year","Bengaluru","Good work culture, facilities and opportunities.","No opportunity for growth, very bad bureaucracy and red taping. Low-level workers are extremely rude, and non-cooperative.","Show more","",""
"5.0","19 Jul 2022","Internship at HAL Nashik","https://www.glassdoor.co.in/Reviews/Employee-Review-Hindustan-Aeronautics-RVW66863659.htm","Design intern","Current intern, less than 1 year","Nashik","","","","Amazing facility, Very friendly people, And has a lot to learn","The working environment is a bit monotonous and some of the employees are extremely demotivated"
"5.0","16 Aug 2022","Good","https://www.glassdoor.co.in/Reviews/Employee-Review-Hindustan-Aeronautics-RVW67953077.htm","Gat(graduate apprenticeship trainee)","Current intern, more than 1 year","Kanpur Nagar","Leeding good company in aviation field","Maintenance only in kanpur hal","Show more","",""
"3.0","31 Jul 2022","Good company","https://www.glassdoor.co.in/Reviews/Employee-Review-Hindustan-Aeronautics-RVW67363069.htm","Program manager","Former employee","","","","","Good company to work for in terms of stability","Psu….it has certain amount of slow progress in career growth"
"5.0","10 Aug 2022","Deputy General Manager","https://www.glassdoor.co.in/Reviews/Employee-Review-Hindustan-Aeronautics-RVW67787067.htm","Facility manager","Former employee","","Good company
work satisfaction 
Good income","slow growth
mechanical work
long working hours","Show more","",""
"5.0","7 Jul 2022","Team Supervise","https://www.glassdoor.co.in/Reviews/Employee-Review-Hindustan-Aeronautics-RVW66442053.htm","Trainee engineer","Current employee","","","","","Planning Production control- Instrument, Control three shop need and complete document work","Company is better for proffesional experiance"
"4.0","13 Jul 2022","Design engineer","https://www.glassdoor.co.in/Reviews/Employee-Review-Hindustan-Aeronautics-RVW66636616.htm","Design engineer","Current employee, more than 1 year","Chennai","","","","Good working environment with nice workspace","Nothing bad in specific. The work flow is well organised"
"4.0","19 Jul 2022","Good","https://www.glassdoor.co.in/Reviews/Employee-Review-Hindustan-Aeronautics-RVW66873771.htm","Anonymous employee","Former employee, more than 8 years","","","","","Learning and development in aerospace","Office Politics and influence on promotions"
"4.0","7 Jul 2022","Good","https://www.glassdoor.co.in/Reviews/Employee-Review-Hindustan-Aeronautics-RVW66417194.htm","Lab techican","Current contractor, less than 1 year","Bengaluru","Good place to learn new thing’s","I have nice & good work time balance","Show more","",""
"4.0","17 Jun 2022","Mechanical Design Engineer","https://www.glassdoor.co.in/Reviews/Employee-Review-Hindustan-Aeronautics-RVW65672850.htm","Aprrentice trainee","Former intern, more than 1 year","Bengaluru","Secured Job.
Better job work life balance.
Punctuality is very important in this organisation.","No mobile phones
Poor quality of work at most places.","Show more","",""
"5.0","23 Jun 2022","Project","https://www.glassdoor.co.in/Reviews/Employee-Review-Hindustan-Aeronautics-RVW65904515.htm","Project manager","Current employee, more than 8 years","","Good learning and experience. Good chance of career growth","Need to be good in multitasking","Show more","",""
"5.0","24 May 2022","Research and Design Department","https://www.glassdoor.co.in/Reviews/Employee-Review-Hindustan-Aeronautics-RVW64632980.htm","Graduate apprentice trainee","Current intern, less than 1 year","Kanpur Nagar","Good learning opportunity in Defence Company and best for fresher who want to explore more in it.","Canteen Food is not upto that level.","Show more","",""
"5.0","21 Jun 2022","Airframe structure","https://www.glassdoor.co.in/Reviews/Employee-Review-Hindustan-Aeronautics-RVW65802872.htm","Power plant engineer","Current intern, less than 1 year","","Engine removal hydraulic pakage removal MGB removal","Helping with engineers landing gear removal","Show more","",""
"4.0","27 May 2022","I worked as intern in HAL","https://www.glassdoor.co.in/Reviews/Employee-Review-Hindustan-Aeronautics-RVW64752589.htm","Intern","Former employee, less than 1 year","","I was good experience and the work environment was very good in HAL","They have all the resources but they lack creativity to use them","Show more","",""
"4.0","11 Jul 2022","yes","https://www.glassdoor.co.in/Reviews/Employee-Review-Hindustan-Aeronautics-RVW66544915.htm","Manager","Current contractor","Bengaluru","","","","Good technical Jobs at work place.","No Cons is available here"
"4.0","24 Jun 2022","Hal design","https://www.glassdoor.co.in/Reviews/Employee-Review-Hindustan-Aeronautics-RVW65954953.htm","Senior manager","Current employee","","","","","Job satisfaction , best work for the core domain","Career growth , hard timings,"
"5.0","30 Jun 2022","Review","https://www.glassdoor.co.in/Reviews/Employee-Review-Hindustan-Aeronautics-RVW66173221.htm","Software engineer fresher","Currently self-employed","","","","","Good work life balance good salry","No growth in the company"
"4.0","3 Jun 2022","Good organization","https://www.glassdoor.co.in/Reviews/Employee-Review-Hindustan-Aeronautics-RVW65058023.htm","Senior manager, design","Current employee, more than 10 years","Kanpur Nagar","Complete exposure to work on aircraft 
Work hard and you will get more work","Hard work dosen't convert in promotion","Show more","",""
"1.0","15 Aug 2022","Promotion Policy","https://www.glassdoor.co.in/Reviews/Employee-Review-Hindustan-Aeronautics-RVW67918551.htm","Senior manager","Current employee, more than 10 years","","Good locations to work at.","bad work culture, not motivating.","Show more","",""
"4.0","10 Jun 2022","Great experience","https://www.glassdoor.co.in/Reviews/Employee-Review-Hindustan-Aeronautics-RVW65361728.htm","Anonymous intern","Former intern, less than 1 year","Bengaluru","Healthy environment. 
Lots to learn and experience","Canteen food is not good","Show more","",""
"3.0","31 May 2022","Apprentice","https://www.glassdoor.co.in/Reviews/Employee-Review-Hindustan-Aeronautics-RVW64895412.htm","Graduate apprentice trainee","Current temporary employee","","","","","Will get industrial exposure and see heavy machinery","We don't get much work to do"
"4.0","16 May 2022","Job at HAL","https://www.glassdoor.co.in/Reviews/Employee-Review-Hindustan-Aeronautics-RVW64195171.htm","Senior manager design","Current employee, more than 10 years","Hyderābād","","","","Very good work for those who want to design core electronics","Less flexible timings, Work culture issues."
"3.0","11 May 2022","TTI is not good","https://www.glassdoor.co.in/Reviews/Employee-Review-Hindustan-Aeronautics-RVW64014407.htm","Anonymous intern","Former intern, more than 1 year","Bengaluru","","","","you can learn many things if you are willing to learn","TTI has worst people especially the HR"
"5.0","25 May 2022","aircraft division","https://www.glassdoor.co.in/Reviews/Employee-Review-Hindustan-Aeronautics-RVW64647800.htm","Summer intern","Former intern, less than 1 year","Bengaluru","good place to learn industrial works","nothing to cons about company","Show more","",""
"4.0","18 May 2022","Good","https://www.glassdoor.co.in/Reviews/Employee-Review-Hindustan-Aeronautics-RVW64302273.htm","Apprentice","Current employee","Bangalore Rural","It was wonderful and great experience","Nothing such because it was a wonderful experience","Show more","",""
"4.0","28 Apr 2022","Good companies  to work","https://www.glassdoor.co.in/Reviews/Employee-Review-Hindustan-Aeronautics-RVW63401375.htm","Associate","Current employee","","Efficient  management 
Good work culture
Canteen facility 
Entry exit on time","Less number of holidays
They have dress code","Show more","",""
"4.0","15 May 2022","Good technical company","https://www.glassdoor.co.in/Reviews/Employee-Review-Hindustan-Aeronautics-RVW64157700.htm","Senior manager","Current employee, more than 10 years","","","","","Technology, Salary, Office hours, medical facility","Long hours , slow career growth"
"5.0","5 May 2022","Industrial trainee","https://www.glassdoor.co.in/Reviews/Employee-Review-Hindustan-Aeronautics-RVW63710533.htm","Industrial trainee","Former temporary employee","","","","","Familiarise various departments and learn new things","It is temporary and valid for academic purposes"
"5.0","19 May 2022","Awesome","https://www.glassdoor.co.in/Reviews/Employee-Review-Hindustan-Aeronautics-RVW64392091.htm","Aircraft maintenance technician","Former employee","","","","","A good place for carrer","I think there is nothing"
"5.0","26 Apr 2022","Have a good time working as Intern.","https://www.glassdoor.co.in/Reviews/Employee-Review-Hindustan-Aeronautics-RVW63281620.htm","Project trainee","Former intern, less than 1 year","","","","","Seniors will guide in every aspect.","I don't think there are any cons."
"2.0","21 Apr 2022","Good company","https://www.glassdoor.co.in/Reviews/Employee-Review-Hindustan-Aeronautics-RVW63073566.htm","Manager","Former employee","","stable and secure job like any other PSU","No challenging; old procedures, rules and regulation kind of company","Show more","",""
"2.0","31 Jan 2022","good overall knowledge about aircraft and its systems","https://www.glassdoor.co.in/Reviews/Employee-Review-Hindustan-Aeronautics-RVW58828980.htm","Senior manager","Current employee, more than 10 years","Bengaluru","JOB security, good exposure to all life cycles of various products","saturday also working, and 10-11 hours working for 6 days.It depends on the department.","Show more","",""
"5.0","31 Mar 2022","Technical Experience","https://www.glassdoor.co.in/Reviews/Employee-Review-Hindustan-Aeronautics-RVW62062763.htm","Chief manager- design","Current employee","","","","","Provides very good design and development projects in the avionics domain for gaining technical expertise.","No flexibility in working hours and less opportunities for growth"
"5.0","18 Mar 2022","it was good and best company to learn as a trainee","https://www.glassdoor.co.in/Reviews/Employee-Review-Hindustan-Aeronautics-RVW61379835.htm","Anonymous intern","Former intern, less than 1 year","Bengaluru","","","","its my passion and as a aeronautical engineer i like HAL","There is no downsides my experience was good at HAL"
"4.0","4 May 2022","good","https://www.glassdoor.co.in/Reviews/Employee-Review-Hindustan-Aeronautics-RVW63639790.htm","Graduate apprentice trainee","Current intern, less than 1 year","Bengaluru","","","","good working atmosphere and nice place","no cons , nice work place"
"4.0","28 Apr 2022","Good opportunity if used wisely","https://www.glassdoor.co.in/Reviews/Employee-Review-Hindustan-Aeronautics-RVW63400827.htm","Graduate apprentice trainee","Current employee, less than 1 year","Bengaluru","","","","Hands on experience in aircraft","Should have drive to learn"
"4.0","9 Mar 2022","Good","https://www.glassdoor.co.in/Reviews/Employee-Review-Hindustan-Aeronautics-RVW60850828.htm","Web developer","Current temporary employee","","Working with HAL is very good and here everybody behaves like a friend and the working environment is very economical.","Nothing to say about that.","Show more","",""
"5.0","23 Jan 2022","Great Experience","https://www.glassdoor.co.in/Reviews/Employee-Review-Hindustan-Aeronautics-RVW58418428.htm","Intern","Former intern, less than 1 year","Bengaluru","Very Helpful minded people. Will have alot of exposure with their projects and will be able to attain lot of knowledge out of course as well. Canteens is also available with cheap and best food.","For engineer graduates one internship is too less time for exposure.","Show more","",""
"5.0","20 Mar 2022","Inspiring Innovations","https://www.glassdoor.co.in/Reviews/Employee-Review-Hindustan-Aeronautics-RVW61480206.htm","Operations coordinator","Former employee","","Dedicated to Quality and Customer satisfaction","Had to slow down in production due to COVID 19","Show more","",""
"5.0","28 Mar 2022","Best place to work","https://www.glassdoor.co.in/Reviews/Employee-Review-Hindustan-Aeronautics-RVW61886531.htm","Anonymous employee","Current employee, more than 8 years","","","","","Proud to be part of cutting edge technology","Time is not flexible strict time in time out"
"4.0","20 Mar 2022","helicopter design","https://www.glassdoor.co.in/Reviews/Employee-Review-Hindustan-Aeronautics-RVW61479721.htm","Senior manager","Current employee, more than 10 years","Bengaluru","low work load and job security","unmanaged, no work clarity and no transparency","Show more","",""
"5.0","18 Mar 2022","Good Company","https://www.glassdoor.co.in/Reviews/Employee-Review-Hindustan-Aeronautics-RVW61402011.htm","Graduate apprentice trainee","Former employee","Nashik","","","","You will learn many things about fighter aircraft like a Mirage - 2000, Sukhoi-30, Mig-27.","Company doesn't continue you after 1 year."
"3.0","22 Apr 2022","Good","https://www.glassdoor.co.in/Reviews/Employee-Review-Hindustan-Aeronautics-RVW63145500.htm","Anonymous intern","Former intern","","","","","Very nice environment for fresher","Long travel time from city"
