"review-details_overallRating__VDxCx","timestamp_reviewDate__wvu2v","review-details_detailsLink__NxIv5","review-details_detailsLink__NxIv5 href","review-details_employee__5iA6v","review-details_employeeDetails__BvAwX","review-details_location__E_Ine","review-details_isCollapsed__Bsg_9","review-details_isCollapsed__Bsg_9 2","expand-button_ExpandButton__FlBlZ","review-details_isExpanded__bLJng","review-details_isExpanded__bLJng 2"
"4.0","23 Mar 2019","Too good","https://www.glassdoor.co.in/Reviews/Employee-Review-Hindustan-Aeronautics-RVW25305367.htm","Graduate engineer","Former employee, more than 1 year","Bengaluru","1.My senior colleagues were best at their work and their talk. 
2.The working environment was too friendly. 
3.The accommodations were very nice.","1.Every single day learning new and innovative things. 
2.Taking various responsibilities makes me even more confident.
3.My role was so appropriate for me to keep my self confident to work at the platform.","Show more","",""
"4.0","16 Dec 2021","Good place to learn","https://www.glassdoor.co.in/Reviews/Employee-Review-Hindustan-Aeronautics-RVW56794844.htm","Contract engineer","Former contractor, more than 1 year","Bengaluru","You will not find another company like this
Great exposure to the technology
State of art manufacturing technology
Highly experienced people","Not a place to work forever as a contract engineer because no growth whatsoever for casual contract employee
It is better if you just work for 1/2 years and hop to a better paying job","Show more","",""
"3.0","29 Apr 2013","present status of the org","https://www.glassdoor.co.in/Reviews/Employee-Review-Hindustan-Aeronautics-RVW2603947.htm","Anonymous employee","Former employee","","Excellent exposure and vast learning resources (specially for mechanical stream)","less salary is the major concern , bad policies and failure of HMA to treat the management trainees and design trainees properly .","Show more","",""
"3.0","1 Feb 2015","Leading Aerospace manufacturing company in India manufacturing fighter, commercial aircraft and helicopters.","https://www.glassdoor.co.in/Reviews/Employee-Review-Hindustan-Aeronautics-RVW5827649.htm","Deputy manager","Former employee","Bengaluru","a lot of learning opportunity exist and you can become master of one or jack of all depending upon  your interest.","Slow moving industry. product development takes 10 to 12 years.","Show more","",""
"4.0","10 Jun 2014","Very good learning experience for Aerospace Engineering loving people","https://www.glassdoor.co.in/Reviews/Employee-Review-Hindustan-Aeronautics-RVW4376614.htm","Anonymous intern","Former intern, less than 1 year","Bengaluru","Abundant man power and resources
State of art equipment and machinery.
Relaxed working hours and good pay","Under utilization of resources.
No time management.
Lazy workforce","Show more","",""
"4.0","4 Aug 2014","Aerospace","https://www.glassdoor.co.in/Reviews/Employee-Review-Hindustan-Aeronautics-RVW4710996.htm","Dy manager","Current employee, more than 5 years","Bengaluru","One of the giant for technology adapting company. Its a vast land of opportunities.","Always great place for working for our country by providing major support to the armed forces.","Show more","",""
"4.0","5 Jul 2014","Good learning opportunity as an intern","https://www.glassdoor.co.in/Reviews/Employee-Review-Hindustan-Aeronautics-RVW4523057.htm","Intern","Former intern, less than 1 year","Bengaluru","As an intern, you have your own flexible timings. You get to learn a lot in the field of aeronautics.","High level security is the only thing that I can think of. As an intern, cell phones and other personal gadgets are not allowed in the premises.","Show more","",""
"5.0","2 Aug 2021","IT Infrastracture","https://www.glassdoor.co.in/Reviews/Employee-Review-Hindustan-Aeronautics-RVW50583288.htm","Internship","Former employee, less than 1 year","Gurgaon, Haryana","Here have cleared doubt about networking. Pratical lab was amazing. Everything was very nice . Guide was also amazing teaching everything nicely. Even management was amazing fully environment.","nothing was wrong there. Everything was very nice . Guide was also amazing teaching everything nicely. Even management was amazing fully environment.","Show more","",""
"4.0","28 Feb 2015","Great place to start the carrier","https://www.glassdoor.co.in/Reviews/Employee-Review-Hindustan-Aeronautics-RVW6015611.htm","Design engineer","Former employee","Bengaluru","Lots of learning in aerospace and avionics. Involved in complete life cycle of the product.","attitude problem, regional favoritism, politics.","Show more","",""
"5.0","8 Mar 2021","HAL is a one of the best company for learning","https://www.glassdoor.co.in/Reviews/Employee-Review-Hindustan-Aeronautics-RVW43683191.htm","Diploma in electronics and communication","Current contractor","Bengaluru","One full time training I have apprenticeship training certificate also","This training will be only one year after completion of training it will be terminated so this is the major cons","Show more","",""
"4.0","8 May 2021","You have a lot of opportunities to learn if you are willing to take them","https://www.glassdoor.co.in/Reviews/Employee-Review-Hindustan-Aeronautics-RVW46660362.htm","Anonymous intern","Former intern, less than 1 year","Nashik","The work environment is quite relaxed, as you would expect from a government sector company.","The fact that the employees are generally apathetic about teaching you, so you really have to take the initiative to ask questions.","Show more","",""
"1.0","17 Mar 2016","Worst Management","https://www.glassdoor.co.in/Reviews/Employee-Review-Hindustan-Aeronautics-RVW9958344.htm","Safety engineer","Current employee, more than 3 years","Bengaluru","No body cares about your performance
U can take enough leaves
4hrs break time out of total 8hrs
Jan-Mar only u have to work","No respect to your skills and area of expertise
No involvement towards safety from top management
No financial benefits compared to other PSUs'
Worst medical facilities
Everybody will speak and act like a politician
Public Money utterly wasted","Show more","",""
"3.0","19 Jul 2017","Engineer(Design)","https://www.glassdoor.co.in/Reviews/Employee-Review-Hindustan-Aeronautics-RVW15967604.htm","Mechanical design engineer","Current employee, more than 3 years","Bengaluru","Best place to start a career.
Can gain knowledge holistically, rather than mere functional.
Can develop people skills, if one need to move up the ladder.","Knowledge transfer is virtually nil. Have to build knowledge by ourselves.
Laid back environment, no job challenges much.","Show more","",""
"5.0","6 May 2021","Good place to learn new things and job security","https://www.glassdoor.co.in/Reviews/Employee-Review-Hindustan-Aeronautics-RVW46553687.htm","Manager","Current employee, more than 10 years","Bengaluru","It is a company where you can learn so many niche technologies under one roof. Feeling of satisfaction to serve nation.","Salary hike is less compared to software companies.","Show more","",""
"4.0","3 May 2018","Great place to begin your career","https://www.glassdoor.co.in/Reviews/Employee-Review-Hindustan-Aeronautics-RVW20429804.htm","Engineer","Current employee","","Great technologies to work with,
 smart people all around, 
constant interaction with outside industry,
 large scale projects, 
Great work life balance","The company should  try to use the workforce in the areas they are interested in order to realize their true potential.","Show more","",""
"4.0","23 Jul 2018","Explore the world of Aeronautics","https://www.glassdoor.co.in/Reviews/Employee-Review-Hindustan-Aeronautics-RVW21616815.htm","Anonymous intern","Former intern, less than 1 year","Bengaluru","I got to see every detail about the helicopter and was very the way i had read it on books ..","As i had been there in the time of production  i could not explore as expected","Show more","",""
"1.0","29 Aug 2018","Enter at your own risk","https://www.glassdoor.co.in/Reviews/Employee-Review-Hindustan-Aeronautics-RVW22214957.htm","Deputy manager","Former employee, more than 3 years","Bengaluru","1. A few outstanding people
2. Rare exposure to aerospace technology in India","For Executives:
1. Horrendous work culture
2. Lack of respect
3.  Emotionally toxic work environment
4.  Lack of incentives 
5. Lethargic decision making
6. Extremely risk averse
7. No work satisfaction
8.  Mind numbing hierarchy and procedures
9.  NO MOTIVATION IN PEERS
10.  NO PUNITIVE ACTIONS FOR LAZINESS
11.  No proper facilities
12. No system implementation
13. Faulty HR policies","Show more","",""
"5.0","16 Sept 2014","Awesome company to get Internship","https://www.glassdoor.co.in/Reviews/Employee-Review-Hindustan-Aeronautics-RVW4978469.htm","Intern","Current employee, less than 1 year","Bengaluru","Breakfast
Lunch 
Dinner
Awesome things to see . 
very friendly atmoshpere .
Got an ATM inside
You will get Ice-creams inside","HR is very irritating
Employees are arrogant 
Employees do not work properly
Some people sleep during the work 
Under performing staff
Caste based employment unions","Show more","",""
"4.0","16 Jan 2015","Interesting Field of work","https://www.glassdoor.co.in/Reviews/Employee-Review-Hindustan-Aeronautics-RVW5715526.htm","Anonymous employee","Former employee","","Good field of work. Aviation and defence sectors are a major growth area. Future looks good - more private sector organizations coming up, and HAL itself is adapting.","Public sector policies. Restrictive. Being a defense industry, there is less flexibility. But nothing specifically negative.","Show more","",""
"4.0","11 Sept 2016","Not a great place to learn","https://www.glassdoor.co.in/Reviews/Employee-Review-Hindustan-Aeronautics-RVW11885662.htm","Trainee structural engineer","Former intern, less than 1 year","Bengaluru","Brand image of the company is the only reason  and for employees gets good compensation","Dress code and the employees gets lazy easily .. the security level is very high","Show more","",""
"3.0","27 Sept 2013","Need more focus on technology than management to soar high","https://www.glassdoor.co.in/Reviews/Employee-Review-Hindustan-Aeronautics-RVW3107339.htm","Anonymous employee","Current employee, more than 10 years","Bengaluru","Great place to learn. Good teams to work with","Lack of focus in top management,salary low, should be lucky to have good mentors","Show more","",""
"3.0","9 Jun 2017","Good company but bad pay structure","https://www.glassdoor.co.in/Reviews/Employee-Review-Hindustan-Aeronautics-RVW15402800.htm","Manager","Current employee, more than 8 years","Kanpur Nagar","Good work in aviation in India.
Big projects in hand, Helpful in carrier growth.
Job stability as HAL is a public sector (PSU).","Bad salery structure compare to other PSUs in India.
Slow moving projects.
Bad handling of big projects, especially by top management.
Less growth opportunities.","Show more","",""
"5.0","21 Mar 2015","Knowledgeable working experience","https://www.glassdoor.co.in/Reviews/Employee-Review-Hindustan-Aeronautics-RVW6165045.htm","Software engineer","Former employee","Bengaluru","Knowledgeable growth curve with positive support. Great work place to start your IT career.","Initial requirement domain trainings are little off and end up getting trained for another to support a different domain project according to requirement.","Show more","",""
"5.0","15 Apr 2016","HAL Experience","https://www.glassdoor.co.in/Reviews/Employee-Review-Hindustan-Aeronautics-RVW10281699.htm","Design engineer","Former employee","Bengaluru","It was a very good learning experience for me. Luckily, I got the best manager I could ever imagine. He is a motivation and inspiration. I could work on latest technologies because of his free hand.","Usual Public Sector Undertaking cons","Show more","",""
"2.0","11 Nov 2016","Perfect for what PSUs are known for in India","https://www.glassdoor.co.in/Reviews/Employee-Review-Hindustan-Aeronautics-RVW12633385.htm","Design engineer","Former employee","","Job Security is the only positive thing","Very Rigid management and its very difficult to make an impact.","Show more","",""
"2.0","20 Nov 2017","Work Environment","https://www.glassdoor.co.in/Reviews/Employee-Review-Hindustan-Aeronautics-RVW17997975.htm","Anonymous contractor","Current contractor, more than 3 years","Bengaluru","Its good environment for the person who can play with the mangament in terms of politics.","There is no scope for talent and the skills one having to related field.","Show more","",""
"4.0","29 Jun 2014","Good","https://www.glassdoor.co.in/Reviews/Employee-Review-Hindustan-Aeronautics-RVW4492817.htm","Anonymous employee","Current employee, more than 10 years","","Satisfied with challenging work in design field","Has to update the challenges faced in worldwide and trend to be followed","Show more","",""
"3.0","30 Oct 2017","Procurement Engineer","https://www.glassdoor.co.in/Reviews/Employee-Review-Hindustan-Aeronautics-RVW17641435.htm","Procurement specialist","Former employee, more than 1 year","Bengaluru","One of the most advanced PSUs in India. The opportunities are endless for people interested in aeronautics.","The salary is on the lower side when compared to other PSUs especially for officers at middle and lower levels.","Show more","",""
"5.0","8 Sept 2017","Working environment at HAL","https://www.glassdoor.co.in/Reviews/Employee-Review-Hindustan-Aeronautics-RVW16736347.htm","Anonymous intern","Former intern, more than 1 year","Lucknow","The staff there at H.A.L is one the best. Every single individual has a specialization in one or the other thing. The environment there is work friendly and supportive.","The campus is excessively large, so finding small places is difficult.","Show more","",""
"3.0","9 Apr 2019","It was a good experience.","https://www.glassdoor.co.in/Reviews/Employee-Review-Hindustan-Aeronautics-RVW25583954.htm","Anonymous employee","Current employee, less than 1 year","Bengaluru","To make it sound cool, I can watch free airshows and understand attack aircrafts and helicopters from a closer angle.","Less production due to politics.","Show more","",""
"4.0","17 May 2013","Balanced Experience In Every Aspects","https://www.glassdoor.co.in/Reviews/Employee-Review-Hindustan-Aeronautics-RVW2656921.htm","Management trainee","Current employee, less than 1 year","Nashik","Best Aircraft manufacturing company in India
Balanced Work Life  
Stable and Big organization
Govt Organization under Ministry Of Defense","Lack of competitiveness is main problem, as there are not many companies play in this field. Agility of company is less.","Show more","",""
"4.0","30 Mar 2014","Internship during final year term","https://www.glassdoor.co.in/Reviews/Employee-Review-Hindustan-Aeronautics-RVW3969113.htm","Quality assurance intern","Former intern, less than 1 year","Hyderābād","Great place to learn for the tech junkies out there. People are ready to teach and comprehend theoretical concepts with real time exposure.","File work. The process to get things done takes time.","Show more","",""
"4.0","26 Aug 2015","Internship at HAL Koraput, Engine division","https://www.glassdoor.co.in/Reviews/Employee-Review-Hindustan-Aeronautics-RVW7725075.htm","Anonymous intern","Former intern, less than 1 year","","So much to learn for mechanical students especially , the new manufacturing processes. So much to learn about aero engine mechanics .","Not much to say anything but common problems as in other industries are present here also","Show more","",""
"4.0","6 Dec 2011","Environment","https://www.glassdoor.co.in/Reviews/Employee-Review-Hindustan-Aeronautics-RVW1228217.htm","Design engineer","Current employee","New Delhi","1. Good technology exposure
2. Responsibility towards work - one has to do all work on there own thus responsible for themselves","1. bureaucracy
2. long learning curve - due to bureaucracy, there are problem regarding your grwth as well as decreasesyour patience","Show more","",""
"4.0","27 Sept 2012","good","https://www.glassdoor.co.in/Reviews/Employee-Review-Hindustan-Aeronautics-RVW1998405.htm","Graduate trainee","Current employee, less than 1 year","Bengaluru","main to gain knowledge and to know much about indian aircrafts, desidn and development of aircraft etc..","nothin much but new version of software at IT is much necessary.","Show more","",""
"4.0","8 Apr 2013","Complete study and analysis of all ongoing operations under all departments.","https://www.glassdoor.co.in/Reviews/Employee-Review-Hindustan-Aeronautics-RVW2541695.htm","Anonymous intern","Former intern, less than 1 year","Bengaluru","A versatile Manufacturing organization helped me to learn huge technical as well as managerial skills.","Don't think so as much as I know.","Show more","",""
"2.0","9 Oct 2014","HAL","https://www.glassdoor.co.in/Reviews/Employee-Review-Hindustan-Aeronautics-RVW5131375.htm","Design engineer","Former employee, more than 1 year","Bengaluru","Very good training and induction program. opportunity to learn, opportunity to interact with top management. leadership training during induction program.","Slow process, lack of clarity , very low compensation, bad quality of food in the campus. bad infrastructure, lack of recognition, monotonous working culture","Show more","",""
"2.0","22 Sept 2016","salary","https://www.glassdoor.co.in/Reviews/Employee-Review-Hindustan-Aeronautics-RVW12043291.htm","It engineer","Current employee","Bengaluru","good to work, lot of things to learn ,  good to visit differnet parts of country even outside india","not easy to grow, too much heirachy, very slow salary increment, seniors are not much knowledgleble, every one has to play role of manager","Show more","",""
"4.0","11 Nov 2019","Perfect company to start as a fresher Mechanical Engineer","https://www.glassdoor.co.in/Reviews/Employee-Review-Hindustan-Aeronautics-RVW30315507.htm","Anonymous intern","Former intern, less than 1 year","Bengaluru","Exposure
Pay
Less workload
Friendly colleagues
Typical govt Job type feeling","Work environment
Nothing to do
Copy and Paste Russian engines
Some employees are very lazy
Typical govt job type feeling","Show more","",""
"5.0","6 Aug 2014","It is an awsome place to work","https://www.glassdoor.co.in/Reviews/Employee-Review-Hindustan-Aeronautics-RVW4732627.htm","Graduate trainee","Current intern, more than 1 year","Bengaluru","One of the leading gov. company, many no of projects, good place to expose our talent, get both practical and theoritical knowledge","Testing on cockpit level, programing based on the rig that we made","Show more","",""
"1.0","24 Jul 2017","Not good for youngsters","https://www.glassdoor.co.in/Reviews/Employee-Review-Hindustan-Aeronautics-RVW16042892.htm","Baburaju","Former employee, more than 8 years","Bengaluru","Salary guaranteed even without doing any work for ever.","People here works hardly for about 4 hours in a day maximum. 
Majority of the staff run-away to hospital early in the morning for simple medical illness. 
EC members and HR Policies are the slow poison for the company.
During shift hours employees will smartly avoid working in-order to get Overtime later.","Show more","",""
"4.0","7 Aug 2020","--","https://www.glassdoor.co.in/Reviews/Employee-Review-Hindustan-Aeronautics-RVW34686626.htm","Apprentice","Former employee","Nashik","a better option to work if you are still not sure about the specialization in your career. And also beneficial for student studying for competitive exams for a side income.","you don't get to choose the shops of your interest","Show more","",""
"5.0","21 Aug 2021","Working in HAL  as a quality engineer","https://www.glassdoor.co.in/Reviews/Employee-Review-Hindustan-Aeronautics-RVW51421935.htm","Quality engineer","Current contractor, more than 1 year","Bengaluru","aero engine high precision  components are manufactured here
Checking parts  as per OEM drawings 
Using high precision equipment s both manual   and cnc","There is a FAIR and FIXED process","Show more","",""
"5.0","18 Sept 2021","Nice place to learn","https://www.glassdoor.co.in/Reviews/Employee-Review-Hindustan-Aeronautics-RVW52758443.htm","Graduate apprenticeship trainee","Former intern, less than 1 year","Bengaluru","In india only one aircraft manufacturer is HAL SO WE CAN LEARN A LOT","No cons in my point of view","Show more","",""
"4.0","13 Apr 2016","Internship on employee relations and welfare management","https://www.glassdoor.co.in/Reviews/Employee-Review-Hindustan-Aeronautics-RVW10255558.htm","Academic projects","Former employee, less than 1 year","Bengaluru","Environment is similar to any government organization. good working environment.","infrastructure for some departments not good, performance appraisal system not upto the mark.","Show more","",""
"2.0","23 Jun 2016","Design Engineer","https://www.glassdoor.co.in/Reviews/Employee-Review-Hindustan-Aeronautics-RVW11013529.htm","Anonymous employee","Former employee","","1. Good Infrastructure
2. Company Accomodation generally available except in Bangalore","1. POOR SALARY
2. Work environment not good. Good performance is not much incentivised
3. 5 year Bond","Show more","",""
"4.0","16 Mar 2017","Broad level exposure","https://www.glassdoor.co.in/Reviews/Employee-Review-Hindustan-Aeronautics-RVW14209052.htm","Anonymous employee","Former employee","","Lot of learning opportunities, Have appetite to learn and explore. Will get less help from others. Be on your own and explore.","No direction of where company is heading, everybody can make their own assumptions
Poor project management","Show more","",""
"4.0","14 Jul 2017","Great company","https://www.glassdoor.co.in/Reviews/Employee-Review-Hindustan-Aeronautics-RVW15905237.htm","Anonymous intern","Former intern","Bengaluru","Working environment is good, people are supportive, salary is very good,many facilities are there for an employee.","Not any downside as per my knowledge and my experience there.","Show more","",""
"3.0","8 Apr 2018","HAL- LCA Tejas Intern","https://www.glassdoor.co.in/Reviews/Employee-Review-Hindustan-Aeronautics-RVW20063904.htm","Anonymous intern","Former intern","","Good exposure to the aircraft development in India
Conducive and well suited to Mechanical Engineers","High levels of security
Poor atmosphere for a young crowd
Growth and learning in terms of real world exposure is less","Show more","",""
"5.0","26 Jun 2012","the best defence company in india to work wth","https://www.glassdoor.co.in/Reviews/Employee-Review-Hindustan-Aeronautics-RVW1653861.htm","Engineer","Current employee, more than 8 years","Bengaluru","talent pool
latest machinery
world class projects
peace of mind
flexibility of work
job security
good career progression","employees are lethargic.officers need to extract work from workers with difficulty","Show more","",""
"2.0","18 Jul 2015","HR Officer","https://www.glassdoor.co.in/Reviews/Employee-Review-Hindustan-Aeronautics-RVW7268105.htm","Anonymous employee","Current employee","","- Good Exposure as an HR Generalist
- Good opportunity to make new interventions in HR
- Large Workforce","- Bureaucratic Work Culture
- Slow Career Progress
- Low Salary","Show more","",""
"5.0","20 Apr 2021","Profit making PSU","https://www.glassdoor.co.in/Reviews/Employee-Review-Hindustan-Aeronautics-RVW45763151.htm","Deputy manager","Current employee","Nashik","Job security and highly technical field I can compliment it with.","Stringent govt policies and excessive govt interference have hampered it's growth..","Show more","",""
"4.0","7 Aug 2021","Great insights into R&D","https://www.glassdoor.co.in/Reviews/Employee-Review-Hindustan-Aeronautics-RVW50806228.htm","Student internship","Former intern, less than 1 year","Bengaluru","The internship at Hal, design and drawing dept is greatly structured and provides insights into structural modelling of aerial vehicles.","The attention towards the intern by the employees could be improved. The internship should be paid.","Show more","",""
"5.0","9 Jun 2017","Senior Manager","https://www.glassdoor.co.in/Reviews/Employee-Review-Hindustan-Aeronautics-RVW15413699.htm","Senior manager","Former employee, more than 10 years","Bengaluru","High Tech Industry manufacturing large number of Aeronautical accessories righ from Engine fuel system,Hydraulic, pneumatic, wheels and brakes and large number of instruments.","Avenues of future growth are limited.","Show more","",""
"4.0","18 Jan 2021","I interned at HAL for a period of 3 months.","https://www.glassdoor.co.in/Reviews/Employee-Review-Hindustan-Aeronautics-RVW40904886.htm","Internship","Former intern, less than 1 year","Bengaluru","good learning experience in the factory and also very good infrastructure.","repetitive work in the factory and the canteen food is not so great","Show more","",""
"5.0","19 Dec 2015","Programmer Analyst","https://www.glassdoor.co.in/Reviews/Employee-Review-Hindustan-Aeronautics-RVW8963314.htm","Programme analyst","Former employee, more than 1 year","Bengaluru","","","","Good Company among the peers in IT Service Industry. Employee friendly to some extent. Pays better than others.","No Work - Life Balance. Extremely demanding work schedule. Compensation not on par with the work demand."
"2.0","1 Sept 2016","Bad Work Culture, Apathetic Management","https://www.glassdoor.co.in/Reviews/Employee-Review-Hindustan-Aeronautics-RVW11762215.htm","Deputy manager","Current employee, more than 5 years","Bengaluru","","","","If you want to get a close feel of mean machines that serve the Indian Air Force, this is the place to be.","Almost Everything Else: Work Culture, Management, Work Timings, Work Life Balance, Rewards"
