"review-details_overallRating__VDxCx","timestamp_reviewDate__wvu2v","review-details_detailsLink__NxIv5","review-details_detailsLink__NxIv5 href","review-details_employee__5iA6v","review-details_employeeDetails__BvAwX","review-details_location__E_Ine","review-details_isExpanded__bLJng","review-details_isExpanded__bLJng 2","review-details_isCollapsed__Bsg_9","review-details_isCollapsed__Bsg_9 2","expand-button_ExpandButton__FlBlZ"
"5.0","30 Jan 2022","Company is good","https://www.glassdoor.co.in/Reviews/Employee-Review-Interglobe-Aviation-RVW58803577.htm","Security officer","Current employee","London, England","","","Team Work,positive attitude,Right decision making,quick reaction and action taking,positive working Environment.","Inadequate training,No truly voluntary,lack of management interest.","Show more"
"4.0","19 Jan 2022","Airport Operations and control centre","https://www.glassdoor.co.in/Reviews/Employee-Review-Interglobe-Aviation-RVW58224370.htm","Airport operations","Former employee","Dubai","","","Worked for the Leading Airline in India
Flight tickets free around the globe
Salary On time
Health & medical benefits(Insurance)","Extreme climate
Irregular shift patterns
Payment less","Show more"
"5.0","21 Jan 2022","Coolest airline","https://www.glassdoor.co.in/Reviews/Employee-Review-Interglobe-Aviation-RVW58343618.htm","Cabin crew","Current employee","New York, NY","One time, customer oriented and Hassel free.","Low budget, less destination ,work load","","",""
"4.0","29 Nov 2021","Excellent","https://www.glassdoor.co.in/Reviews/Employee-Review-Interglobe-Aviation-RVW55979488.htm","Executive security","Current employee","Washington, DC","","","Excellent work place, best careers oppertunity along with knowledge and learning new things on shift","Excellent working experience in interglobe aviation Ltd. Its number one company in india.","Show more"
"4.0","26 Nov 2021","Good","https://www.glassdoor.co.in/Reviews/Employee-Review-Interglobe-Aviation-RVW55888354.htm","Customer service executive","Current employee, more than 1 year","","","","On time salary 
Friendly environment","Rotational shift and extra working hours","Show more"
"5.0","26 Oct 2021","Excellent Company","https://www.glassdoor.co.in/Reviews/Employee-Review-Interglobe-Aviation-RVW54486417.htm","Security supervisor","Current employee","Dubai","Indigo is Great place to Work","Very Good service, growing company","","",""