"review-details_overallRating__VDxCx","timestamp_reviewDate__wvu2v","review-details_detailsLink__NxIv5","review-details_detailsLink__NxIv5 href","review-details_employee__5iA6v","review-details_employeeDetails__BvAwX","review-details_location__E_Ine","review-details_isExpanded__bLJng","review-details_isExpanded__bLJng 2","review-details_isCollapsed__Bsg_9","review-details_isCollapsed__Bsg_9 2","expand-button_ExpandButton__FlBlZ"
"4.0","22 Sept 2017","Refinery division","https://www.glassdoor.co.in/Reviews/Employee-Review-Indian-Oil-RVW16965381.htm","Anonymous employee","Current employee","","Core related  technical work mostly. Good salary.","Remote location, mostly 6 days work in week.","","",""
"4.0","4 Nov 2017","Internship","https://www.glassdoor.co.in/Reviews/Employee-Review-Indian-Oil-RVW17728899.htm","Engineer","Current employee, less than 1 year","Guwahati","","","good salary and nice  perks","no cons are there for ps's","Show more"
"4.0","19 Apr 2018","Pros Cons","https://www.glassdoor.co.in/Reviews/Employee-Review-Indian-Oil-RVW20220569.htm","Anonymous employee","Current employee, more than 5 years","New Delhi","Nice Company to work with. Lot of things to learn","Work Life balance not established well.","","",""
"5.0","18 Aug 2018","Very good job totally awesome","https://www.glassdoor.co.in/Reviews/Employee-Review-Indian-Oil-RVW22034824.htm","Anonymous employee","Current employee, more than 10 years","Haldia, West Bengal","Its worth the labour very satisfying","Not good for eyes and back","","",""
"4.0","21 Aug 2018","General Manager","https://www.glassdoor.co.in/Reviews/Employee-Review-Indian-Oil-RVW22075966.htm","General manager","Current employee, more than 10 years","New Delhi","Great work environment to learn and grow","Some bosses are real pain","","",""
"4.0","10 Sept 2018","Company with best pay package","https://www.glassdoor.co.in/Reviews/Employee-Review-Indian-Oil-RVW22401224.htm","Chief employee relations manager","Current employee, more than 10 years","Mumbai","Benefits are abundant which is best among PSUs","Slow in decision making process","","",""
"3.0","14 Sept 2018","Good company to work  for freshers","https://www.glassdoor.co.in/Reviews/Employee-Review-Indian-Oil-RVW22475191.htm","Intern","Former contractor, more than 1 year","Mumbai","Good Salary, Environment is good.","Some employees are irritating in the company.","","",""
"5.0","1 Oct 2018","review title","https://www.glassdoor.co.in/Reviews/Employee-Review-Indian-Oil-RVW22740267.htm","Industrial trainee","Former intern, more than 1 year","New Delhi","","","Good working Enviroment, supportive Management, Friendly enviroment","i cant say about this point","Show more"
"3.0","27 Feb 2019","PPE,HSE, OCCUPATIONAL HEALTH","https://www.glassdoor.co.in/Reviews/Employee-Review-Indian-Oil-RVW24902159.htm","Ppe hse occupational health hazid","Current employee, more than 1 year","Calicut, Kerala","","","For more experience for future","Safety culture of the company.","Show more"
"5.0","12 Mar 2019","Challenging work","https://www.glassdoor.co.in/Reviews/Employee-Review-Indian-Oil-RVW25118297.htm","Anonymous employee","Current employee","","Challenging work and new experiences. Good learning","Frequent transfers,  work culture, work life balance","","",""
"5.0","4 May 2019","Great Work Experience","https://www.glassdoor.co.in/Reviews/Employee-Review-Indian-Oil-RVW25980426.htm","Graduate apprentice trainee","Former intern, more than 1 year","","The work environment is great so is the team","No Cons as of now","","",""
"5.0","22 Aug 2019","About my company","https://www.glassdoor.co.in/Reviews/Employee-Review-Indian-Oil-RVW28795290.htm","Anonymous employee","Current employee","","","","Best company to work for","Nothing as such to mention here","Show more"
"5.0","26 Aug 2019","Best psu to work in","https://www.glassdoor.co.in/Reviews/Employee-Review-Indian-Oil-RVW28853000.htm","Anonymous intern","Current intern, less than 1 year","Farīdābād, Haryana","Decent work environment, employee supportive.","Busy schedule, remote locations, can be better","","",""
"5.0","17 Sept 2019","Great learning experience","https://www.glassdoor.co.in/Reviews/Employee-Review-Indian-Oil-RVW29293297.htm","Anonymous intern","Former intern","","","","Exposure to various areas. Room for development.","No particular cons known to me.","Show more"
"4.0","15 Jan 2020","Typical Easy PSU  Lazy Internship","https://www.glassdoor.co.in/Reviews/Employee-Review-Indian-Oil-RVW31305377.htm","Anonymous intern","Former intern","","","","Strict 10-6 timings
Easy work 
No pressure","Not challenging
No learning 
No future opportunities","Show more"
"5.0","9 Feb 2020","very good to work with","https://www.glassdoor.co.in/Reviews/Employee-Review-Indian-Oil-RVW31762164.htm","Manager","Current employee, more than 5 years","Chennai","","","Very good company to work with","nothing to mention as cons","Show more"
"4.0","17 Apr 2020","Good place for training purpose","https://www.glassdoor.co.in/Reviews/Employee-Review-Indian-Oil-RVW32766765.htm","Anonymous intern","Former intern","","Benefits and hands on experience","Nothing as such in cons except the culture.","","",""
"5.0","24 Jun 2020","IOCL Excellent Employer","https://www.glassdoor.co.in/Reviews/Employee-Review-Indian-Oil-RVW33880430.htm","Assistant manager","Current employee, more than 3 years","Bengaluru","Excellent exposure, Challenging roles, dynamic environment","Transfer every 3 years not as per choice","","",""
"3.0","23 Sept 2020","Not an organization for ambitious people","https://www.glassdoor.co.in/Reviews/Employee-Review-Indian-Oil-RVW36294344.htm","Officer","Current employee","Mumbai","Good perks. Salary is always on time.","Monotonous work and life. no growth","","",""
"5.0","22 Sept 2020","Excellent","https://www.glassdoor.co.in/Reviews/Employee-Review-Indian-Oil-RVW36219615.htm","Production manager","Former employee","Pānīpat","","","Huge scope for future growth","Less competition with private sector.","Show more"
"5.0","17 Dec 2020","Intern","https://www.glassdoor.co.in/Reviews/Employee-Review-Indian-Oil-RVW39587763.htm","Intern","Former intern","Bāruni","You can see many big machinery parts","There are no cons here all things are good.","","",""
"5.0","6 Feb 2021","Highly skilled employee","https://www.glassdoor.co.in/Reviews/Employee-Review-Indian-Oil-RVW42051118.htm","Operations analyst intern","Former intern, less than 1 year","New Delhi","Cheaper canteen, work-life balance, good mentors","the very formal office has to follow protocalls","","",""
"5.0","19 Mar 2021","Decent Compliance Work","https://www.glassdoor.co.in/Reviews/Employee-Review-Indian-Oil-RVW44248932.htm","Legal intern","Former intern","","","","- Nice timings
- Good guidance 
- Good offices","- No stipend
- Not much work","Show more"
"5.0","20 Mar 2021","IOCL work culture","https://www.glassdoor.co.in/Reviews/Employee-Review-Indian-Oil-RVW44290503.htm","Senior project engineer","Current employee, more than 8 years","Noida","","","Good salary psu job less work","Needless work many a times","Show more"
"4.0","12 Apr 2021","Career Growth","https://www.glassdoor.co.in/Reviews/Employee-Review-Indian-Oil-RVW45419243.htm","Anonymous employee","Current employee, more than 5 years","","High Initial Package for freshers","Very slow growth as compared to your peer in private sectors","","",""
"4.0","16 Apr 2021","Review","https://www.glassdoor.co.in/Reviews/Employee-Review-Indian-Oil-RVW45611066.htm","Manager","Current employee, more than 8 years","Barauni","Pays very well and facilities are good","Place of posting and non ambitious nature and not agile","","",""
"4.0","23 Apr 2021","Indian Oil  Manager grade( Grade C)","https://www.glassdoor.co.in/Reviews/Employee-Review-Indian-Oil-RVW45943030.htm","Anonymous employee","Current employee, more than 8 years","New Delhi","Stable job. Good medical facility.","Increment rate is a bit low","","",""
"4.0","27 Apr 2021","Deputy manager safety and health","https://www.glassdoor.co.in/Reviews/Employee-Review-Indian-Oil-RVW46130982.htm","Deputy manager","Former employee, more than 8 years","Ahmedabad","Job security while working in your job.","Remote locations to offer for postings","","",""
"4.0","1 May 2021","A good place to be a trainee","https://www.glassdoor.co.in/Reviews/Employee-Review-Indian-Oil-RVW46337281.htm","Apprentice","Former employee, more than 1 year","Chirang","exposure to real world problems","Slow working process and low efficient","","",""
"5.0","12 May 2021","NICE WORK CULTURE","https://www.glassdoor.co.in/Reviews/Employee-Review-Indian-Oil-RVW46824758.htm","Assistant manager","Current employee, more than 5 years","Villupuram","Nothing new to say like","Nothing to say as it is a good company","","",""
"5.0","2 Jun 2021","The company provides good salary and benefits","https://www.glassdoor.co.in/Reviews/Employee-Review-Indian-Oil-RVW47782386.htm","Accountant","Current contractor","Bengaluru","","","Good Work Life Balance
Good Pay","Sometimes work can be monotonous","Show more"
"5.0","13 Jun 2021","Best PSU for working","https://www.glassdoor.co.in/Reviews/Employee-Review-Indian-Oil-RVW48297692.htm","Operation officer","Current employee, more than 8 years","Gāndhīdhām","Best work culture, Minimum workload","Some of IOCL plant are in remote areas","","",""
"5.0","30 Jun 2021","BEST company to work for","https://www.glassdoor.co.in/Reviews/Employee-Review-Indian-Oil-RVW49119711.htm","Apprentice engineer","Current employee, more than 1 year","New Delhi","","","Low work load
best in class compensation","Support from the leadership
shortage of manpower","Show more"
"4.0","8 Jul 2021","About iocl","https://www.glassdoor.co.in/Reviews/Employee-Review-Indian-Oil-RVW49493865.htm","Assistant manager","Current employee, more than 8 years","Mumbai","","","Great package
And best services 
And opaque are high","Same type of work 
Not for adventurous people","Show more"
"4.0","3 Aug 2021","Mediocrity at its best","https://www.glassdoor.co.in/Reviews/Employee-Review-Indian-Oil-RVW50611195.htm","Assistant manager","Current employee, more than 3 years","Jamshedpur","","","PSU 
no work
full salary
no resposnitibilty","no growth
top down approach so one listens to juniors","Show more"
"5.0","6 Aug 2021","Very Nice as such I found","https://www.glassdoor.co.in/Reviews/Employee-Review-Indian-Oil-RVW50764812.htm","Graduate engineer trainee","Current employee","Gurgaon, Haryana","Very Nice as such I found","None as such I found","","",""
"4.0","20 Sept 2021","Good experience","https://www.glassdoor.co.in/Reviews/Employee-Review-Indian-Oil-RVW52799615.htm","Anonymous intern","Current intern","","Flexibility, no work load and value of company","Quality of Internship mentoring is not so good.","","",""
"5.0","25 Sept 2021","GOOD AND HELPFUL","https://www.glassdoor.co.in/Reviews/Employee-Review-Indian-Oil-RVW53090725.htm","Anonymous intern","Former intern","","","","Very helpful during internship and great work culture","no nothing
I couldn't see any con","Show more"
"5.0","17 Sept 2021","Good Place to work","https://www.glassdoor.co.in/Reviews/Employee-Review-Indian-Oil-RVW52710491.htm","Software engineer","Current employee, less than 1 year","New Delhi","","","job security
high pay
respected staff
helpful peop;e","------- - - - - - - -","Show more"
"5.0","16 Oct 2021","Work Environment","https://www.glassdoor.co.in/Reviews/Employee-Review-Indian-Oil-RVW54084588.htm","Mechanical engineer","Current employee","Kota, Rajasthan","","","Good Environment to work
machinery and equipment are perfect","Sunday is not off in the IOCL","Show more"
"4.0","6 Dec 2021","Good experience","https://www.glassdoor.co.in/Reviews/Employee-Review-Indian-Oil-RVW56271169.htm","Vocational trainee student","Former intern, less than 1 year","Barauni","Easy environment, easy to work, easy to learn","Harsh weather and physical stress is a lot","","",""
"5.0","26 Nov 2021","Overall Good.","https://www.glassdoor.co.in/Reviews/Employee-Review-Indian-Oil-RVW55882936.htm","Anonymous intern","Former intern","","Indian Oil is one of the biggest PSU of India.","Officers were not that punctual.","","",""
"5.0","19 Dec 2021","Great company to work for","https://www.glassdoor.co.in/Reviews/Employee-Review-Indian-Oil-RVW56883485.htm","Assistant manager","Current employee","Mumbai","Culture, pay, brand value, people, diversity","Nothing really. It's a good company","","",""
"4.0","25 Jun 2012","IOCL work experience","https://www.glassdoor.co.in/Reviews/Employee-Review-Indian-Oil-RVW1646186.htm","Senior mechanical engineer","Current employee, more than 5 years","Pānīpat","","","Good company to work with","Slow career progress
Low compensation and govt. restrictions","Show more"
"5.0","9 Aug 2012","Absolutely Great Atmosphere","https://www.glassdoor.co.in/Reviews/Employee-Review-Indian-Oil-RVW1826119.htm","Vocational trainee","Former intern, less than 1 year","Pānīpat","","","Learning Experience
Good Salary
Benifits & Perks
Job Security","Senior Managment
Job Satisfaction In Only Some Dept","Show more"
"4.0","11 Aug 2013","Great Place to Work","https://www.glassdoor.co.in/Reviews/Employee-Review-Indian-Oil-RVW2920287.htm","General manager","Current employee, more than 10 years","Chennai","","","Excellent working Environment,Reasonable Recognition of work","Procedure Oriented Potential not Fully exploited","Show more"
"5.0","11 Jan 2014","nice working enviornment","https://www.glassdoor.co.in/Reviews/Employee-Review-Indian-Oil-RVW3519717.htm","Anonymous employee","Former employee","","","","people are not very keen to learn","helful and good by nature","Show more"
"4.0","12 Feb 2016","Great place to work","https://www.glassdoor.co.in/Reviews/Employee-Review-Indian-Oil-RVW9548163.htm","Anonymous employee","Current employee","","Good compensation and less pressurised job","Delay in decision making due to hierarchy","","",""
"5.0","8 Mar 2016","iocl","https://www.glassdoor.co.in/Reviews/Employee-Review-Indian-Oil-RVW9850496.htm","Anonymous employee","Former employee","","good staff, nice safety, nice management,psu","good, nothing, not any cons, employees are good, far","","",""
"3.0","8 Jun 2016","Field Officer","https://www.glassdoor.co.in/Reviews/Employee-Review-Indian-Oil-RVW10861411.htm","Assistant manager (retail sales)","Current employee","","","","Flexible Work timing,  Decent Salary","Too Much Work Pressure
Remote location posting","Show more"
"5.0","5 Sept 2016","DGM(F)","https://www.glassdoor.co.in/Reviews/Employee-Review-Indian-Oil-RVW11805865.htm","Anonymous employee","Former employee","Mumbai","Highly Professional company and an excellent company to work with.","Highly bureaucratic in decision making","","",""
"4.0","14 Apr 2017","such company much wow","https://www.glassdoor.co.in/Reviews/Employee-Review-Indian-Oil-RVW14631237.htm","Anonymous intern","Former intern, less than 1 year","Pānīpat","Chill scenes, nothing to do just meme","too much meme bad for health","","",""
"4.0","30 May 2017","JOb","https://www.glassdoor.co.in/Reviews/Employee-Review-Indian-Oil-RVW15263120.htm","Officer","Former employee","Gurgaon, Haryana","","","Its best place to work","its government that's all I can say","Show more"
"4.0","4 Jun 2017","Great benefits, slow growth","https://www.glassdoor.co.in/Reviews/Employee-Review-Indian-Oil-RVW15324023.htm","Operations&maintenance engineer","Former employee, less than 1 year","","Good perks & benefits, good work life balance","Slow growth, monotonicity in work","","",""
"4.0","28 Oct 2017","Interview","https://www.glassdoor.co.in/Reviews/Employee-Review-Indian-Oil-RVW17604116.htm","Anonymous employee","Former employee","","salary is good, career growth and work environment is pretty good","HR management is not good","","",""
"5.0","16 Nov 2017","very good","https://www.glassdoor.co.in/Reviews/Employee-Review-Indian-Oil-RVW17931129.htm","Internship","Former intern, less than 1 year","Mathura, Uttar Pradesh","","","good benefits and perks a very good salary","strict managers and night working","Show more"
"4.0","27 Dec 2017","Sports","https://www.glassdoor.co.in/Reviews/Employee-Review-Indian-Oil-RVW18486432.htm","Anonymous contractor","Former contractor, more than 1 year","","Salary is great and lots of other benefits","Nothing to say its all about you perspective","","",""
"5.0","9 Jan 2018","best for a fresher","https://www.glassdoor.co.in/Reviews/Employee-Review-Indian-Oil-RVW18652128.htm","Anonymous intern","Former intern","","","","balanced work life and supporting colleages.","nothing as such to mention","Show more"
"4.0","13 Jan 2018","Summer intern","https://www.glassdoor.co.in/Reviews/Employee-Review-Indian-Oil-RVW18721218.htm","Anonymous intern","Former intern","","Learnt about distillation and all ok they petroleum engineering process","No accomodation for the interns","","",""
"5.0","14 Jun 2018","Training at alternate energy department","https://www.glassdoor.co.in/Reviews/Employee-Review-Indian-Oil-RVW21040065.htm","Anonymous intern","Former intern","","","","Great working environment.
Nice and helping people.
Discplined.","No accommodation.
No intern ship stipend.","Show more"
"5.0","22 Jun 2018","Good place to intern","https://www.glassdoor.co.in/Reviews/Employee-Review-Indian-Oil-RVW21162447.htm","Anonymous intern","Former intern","","constant learning environment and knowledgeable officers","no cons as it is good","","",""
"5.0","23 Jun 2018","Good","https://www.glassdoor.co.in/Reviews/Employee-Review-Indian-Oil-RVW21181870.htm","Anonymous employee","Current employee","","Good salary good inter personal care","Work load more and some bosses are not good","","",""
"5.0","24 Dec 2018","Atlanduz IT Corporate","https://www.glassdoor.co.in/Reviews/Employee-Review-Indian-Oil-RVW23945327.htm","Administrative assistant","Former employee, more than 1 year","Cochin","Good Ambiance, Nice Senior Management, low Pressure work","according to me no cons.","","",""
"2.0","27 Jan 2019","Not so satisfying","https://www.glassdoor.co.in/Reviews/Employee-Review-Indian-Oil-RVW24401386.htm","Retail sales manager","Current employee, more than 1 year","Warangal","Average salary with additional amount for furniture, mobile, laptops etc","No work life balance at all","","",""
"5.0","21 Jan 2019","engineer","https://www.glassdoor.co.in/Reviews/Employee-Review-Indian-Oil-RVW24303628.htm","Anonymous employee","Current employee","","very big company i love this company","nothing  to worry jus wait for salary","","",""
"4.0","12 Apr 2019","Great","https://www.glassdoor.co.in/Reviews/Employee-Review-Indian-Oil-RVW25644124.htm","Vocational trainee","Current intern, less than 1 year","Vadodara","","","It was Great exposure and many things to learn.","There is probably No cons","Show more"
"5.0","8 Apr 2019","Very good environment and knowledge.","https://www.glassdoor.co.in/Reviews/Employee-Review-Indian-Oil-RVW25569336.htm","Apprentice trainee","Current contractor, more than 1 year","Pānīpat","Work load is very low.","No cons is in the company.","","",""
"5.0","18 Apr 2019","Manager (International Business Development)","https://www.glassdoor.co.in/Reviews/Employee-Review-Indian-Oil-RVW25749943.htm","Anonymous employee","Current employee, more than 8 years","New Delhi","Caring Organization, Well Paying, Job Security","Gradient of growth is too gentle.","","",""
"5.0","22 May 2019","Excellent","https://www.glassdoor.co.in/Reviews/Employee-Review-Indian-Oil-RVW26276538.htm","Junior engineer","Current employee, more than 3 years","Pānīpat","","","India's Largest public sector","Rotating shift
 far from city 
 pollution
Fix income","Show more"
"5.0","4 Jul 2019","Great","https://www.glassdoor.co.in/Reviews/Employee-Review-Indian-Oil-RVW27794815.htm","Anonymous intern","Former intern","","Everything is great about company..","No cons. Everything is good about company and work culture.","","",""
"5.0","31 Jul 2019","About indian oil","https://www.glassdoor.co.in/Reviews/Employee-Review-Indian-Oil-RVW28357570.htm","Production engineer","Former intern, more than 3 years","South","It is a good industry with good safety measures","I didnt find it","","",""
"4.0","7 Sept 2019","Good company","https://www.glassdoor.co.in/Reviews/Employee-Review-Indian-Oil-RVW29091182.htm","Anonymous employee","Current employee, more than 3 years","Pānīpat","Work life balance is great","Promotion policy is not that good","","",""
"3.0","7 Sept 2019","Efficient Management, poor consistency","https://www.glassdoor.co.in/Reviews/Employee-Review-Indian-Oil-RVW29093543.htm","Intern","Former intern, less than 1 year","Chennai","Great training & friendly management","No allowances for interns, lack of cleanliness in plants","","",""
"5.0","6 Sept 2019","Work at IOC","https://www.glassdoor.co.in/Reviews/Employee-Review-Indian-Oil-RVW29071641.htm","Operations officer","Current employee, more than 3 years","Ramagundam","Salary and bonus and fast promotions and perks","Politics  and transfer difficulties","","",""
"4.0","15 Dec 2019","Great company to start with","https://www.glassdoor.co.in/Reviews/Employee-Review-Indian-Oil-RVW30876563.htm","Assistant manager","Current employee, more than 5 years","Jodhpur, Rajasthan","","","Good perks 
PSU 
Good culture
Great exposure","Slow growth 
Slow salary growth","Show more"
"5.0","30 Sept 2019","It's nice learning new things there","https://www.glassdoor.co.in/Reviews/Employee-Review-Indian-Oil-RVW29526812.htm","Internship","Former intern, less than 1 year","Begusarai","It's environment is eco friendly","No cons in that region","","",""
"5.0","2 Aug 2020","Perfect job.","https://www.glassdoor.co.in/Reviews/Employee-Review-Indian-Oil-RVW34567865.htm","Senior civil engineer","Current employee, more than 3 years","Bongaigaon","","","Freedom to work and implement your ideas.","Male employees never expect choice location","Show more"
"5.0","17 Aug 2020","salary having 15 years of experience","https://www.glassdoor.co.in/Reviews/Employee-Review-Indian-Oil-RVW34988515.htm","Procurement manager","Current employee","Mumbai","good company for the work","unjustified decision towards progress growth","","",""
"4.0","16 Sept 2020","Best PSU to work","https://www.glassdoor.co.in/Reviews/Employee-Review-Indian-Oil-RVW36029022.htm","Administration officer","Current employee","Calcutta","Job security and good perks","Transfer in every 3 years, work Life Balance","","",""
"5.0","17 Sept 2020","IOCL summer intern","https://www.glassdoor.co.in/Reviews/Employee-Review-Indian-Oil-RVW36065472.htm","Anonymous intern","Former intern","","Amazing place to learn for core branches","No proper guidance from the employees","","",""
"5.0","13 Oct 2020","Good","https://www.glassdoor.co.in/Reviews/Employee-Review-Indian-Oil-RVW37111085.htm","Anonymous intern","Current intern","","It's one of the beat companies to work","The place is so outside of city","","",""
"5.0","2 Dec 2020","Vocational Summer Intern","https://www.glassdoor.co.in/Reviews/Employee-Review-Indian-Oil-RVW38972380.htm","Internship","Former intern, less than 1 year","Haldia, West Bengal","","","Research and Development skills developed well","no such disadvantage can I think","Show more"
"5.0","6 Dec 2020","Good","https://www.glassdoor.co.in/Reviews/Employee-Review-Indian-Oil-RVW39151369.htm","Accountant","Former contractor","Vadodara","Good environment and people to work with","Nothing as of now it was really nice","","",""
"5.0","7 Dec 2020","nice to work with","https://www.glassdoor.co.in/Reviews/Employee-Review-Indian-Oil-RVW39156900.htm","Research scientist","Current employee","New Delhi","excellent work environment with pay package","nothing to comment upon on cons","","",""
"5.0","18 Dec 2020","Best Public Sector","https://www.glassdoor.co.in/Reviews/Employee-Review-Indian-Oil-RVW39594095.htm","Anonymous employee","Former employee","","Best in all public sector companies in india","job locations can be unfavorable","","",""
"4.0","18 Dec 2020","Nice culture","https://www.glassdoor.co.in/Reviews/Employee-Review-Indian-Oil-RVW39593949.htm","Alternative energy","Former intern, less than 1 year","Farīdābād, Haryana","","","Excellent work life balance
Good exposure to new technologies","No stipend for interns
No accomodation for interns","Show more"
"5.0","30 Dec 2020","Company review","https://www.glassdoor.co.in/Reviews/Employee-Review-Indian-Oil-RVW39929164.htm","Manager","Current employee, more than 5 years","South West","","","Wonderful company to pursue career with.","Promotion is basically time bound.","Show more"
"4.0","30 Jan 2021",".","https://www.glassdoor.co.in/Reviews/Employee-Review-Indian-Oil-RVW41663734.htm","Anonymous intern","Former intern","","Mentioned in the resume, internship was good","Mentioned in the resume, IOCL is a classy organisation.","","",""
"4.0","28 Mar 2021","Good company","https://www.glassdoor.co.in/Reviews/Employee-Review-Indian-Oil-RVW44684062.htm","Manager","Current employee","Nāgpur, Maharashtra","Flexible in working load and good salary","Government like slow working and small town posting","","",""
"5.0","29 Mar 2021","Great","https://www.glassdoor.co.in/Reviews/Employee-Review-Indian-Oil-RVW44710255.htm","Officer","Current employee","Bengaluru","Best companies to work with. I love Indian oil","Everything is great in this company","","",""
"5.0","30 Mar 2021","Best PSU","https://www.glassdoor.co.in/Reviews/Employee-Review-Indian-Oil-RVW44759643.htm","Engineer officer","Former employee, less than 1 year","Haldia, West Bengal","It definitely has one of the best perks!","Sometimes the job requires full commitment.","","",""
