"review-details_overallRating__VDxCx","timestamp_reviewDate__wvu2v","review-details_detailsLink__NxIv5","review-details_detailsLink__NxIv5 href","review-details_employee__5iA6v","review-details_employeeDetails__BvAwX","review-details_location__E_Ine","review-details_isExpanded__bLJng","review-details_isExpanded__bLJng 2","review-details_isCollapsed__Bsg_9","review-details_isCollapsed__Bsg_9 2","expand-button_ExpandButton__FlBlZ"
"3.0","27 Jul 2022","Great Company with Unskilled People","https://www.glassdoor.co.in/Reviews/Employee-Review-Indian-Oil-RVW67203451.htm","Senior manager","Current employee, more than 10 years","","","","Company is Huge 
Good Perks and Benefits
Job security","Merit is not the only criteria to grow
 Lot of Bossism 
Most of the employees are unskilled and don’t fit in the job they handle
Focus is on boss than job efficiency
Zero Work life balance","Show more"
"4.0","30 Sept 2022","intership","https://www.glassdoor.co.in/Reviews/Employee-Review-Indian-Oil-RVW69637713.htm","Vocational trainee","Former intern, less than 1 year","Vadodara","wide range , explore about various unit operations","no stipened, rude behaviour of some employees","","",""
"3.0","27 Aug 2022","Outdated management practices","https://www.glassdoor.co.in/Reviews/Employee-Review-Indian-Oil-RVW68412413.htm","Officer","Current employee, more than 1 year","","","","Medical perks provided are one of the best.","Bad work life balance.
Officers used as rubber stamp.
Huge reduction in salary for recent and future recruits, and may be reduced further.","Show more"
"5.0","24 Sept 2022","Good","https://www.glassdoor.co.in/Reviews/Employee-Review-Indian-Oil-RVW69416226.htm","Project intern","Former intern, less than 1 year","Navi Mumbai","","","Very good organisation with a lot of perks","No cons as such very flexible","Show more"
"5.0","21 Sept 2022","Accountant","https://www.glassdoor.co.in/Reviews/Employee-Review-Indian-Oil-RVW69319493.htm","Apprentice","Current intern, less than 1 year","Mumbai","","","Good working condition and good people","No cons are there in Indian oil corporation limited","Show more"
"4.0","24 Sept 2022","Great organization for starting your career","https://www.glassdoor.co.in/Reviews/Employee-Review-Indian-Oil-RVW69397828.htm","Anonymous employee","Former employee, more than 8 years","","Good salary, health care, growth","Steep learning curve, frequent transfers, bureaucratic setup","","",""
"4.0","24 Aug 2022","A good company to work with","https://www.glassdoor.co.in/Reviews/Employee-Review-Indian-Oil-RVW68321107.htm","Project engineer","Current employee, less than 1 year","Paradip","Good pay when compared to peers of the same industry. Good facilities and perks.","6 days workweek. Extended hours working is the new normal here.","","",""
"5.0","4 Sept 2022","Factors affecting sales of lubes","https://www.glassdoor.co.in/Reviews/Employee-Review-Indian-Oil-RVW68690575.htm","Sales and marketing intern","Former intern, less than 1 year","","very good company to work for , good atmosphere, supporting staff, low work load","None that i could find","","",""
"4.0","21 Aug 2022","P&A","https://www.glassdoor.co.in/Reviews/Employee-Review-Indian-Oil-RVW68174087.htm","Administrative assistant-hr","Current intern, more than 1 year","","Good environment, nice facility, Neet and clean, work and life balnce good amount of pay","higher rank officer behavior, Not many to share Its perfect for jobs in psu","","",""
"1.0","10 Sept 2022","worst company to work","https://www.glassdoor.co.in/Reviews/Employee-Review-Indian-Oil-RVW68912136.htm","Assistant manager - construction","Current employee, more than 5 years","Kanpur Nagar","","","Salary at time of joining","Dictatorship of management, Rat Race, physical and mental harassment of employees, lowest level of job, targeting personal level, work life balance at worst","Show more"
"4.0","15 Aug 2022","Great Opportunities for freshers","https://www.glassdoor.co.in/Reviews/Employee-Review-Indian-Oil-RVW67925224.htm","Assistant manager","Former employee, more than 5 years","Noida","Unparalleled responsibilities and scope of learning at the start of a career","Can be very bureaucratic due to the government nature of the job.","","",""
"5.0","10 Sept 2022","Apprentice trainee","https://www.glassdoor.co.in/Reviews/Employee-Review-Indian-Oil-RVW68914118.htm","Apprentice","Current employee, less than 1 year","Mathura, Uttar Pradesh","Excellent facility ,amazing work enviroment","Every thing is perfect good place for learning","","",""
"5.0","13 Sept 2022","Good place","https://www.glassdoor.co.in/Reviews/Employee-Review-Indian-Oil-RVW68990234.htm","Summer intern","Former intern, less than 1 year","Mathura, Uttar Pradesh","Very good exposure and development opportunity","Locations can be considered a con","","",""
"5.0","8 Sept 2022","Best company for internship.","https://www.glassdoor.co.in/Reviews/Employee-Review-Indian-Oil-RVW68840741.htm","Finance trainee","Former intern, more than 1 year","New Delhi","Knowledge of SAP FICO module","I didn't discover any cons.","","",""
"4.0","16 Sept 2022","Good","https://www.glassdoor.co.in/Reviews/Employee-Review-Indian-Oil-RVW69141261.htm","Technician","Current employee","","Working culture,goverment PSU, oil industry","Salery increment slow,growth slow, ok","","",""
"5.0","29 Aug 2022","Internship","https://www.glassdoor.co.in/Reviews/Employee-Review-Indian-Oil-RVW68491037.htm","Sales intern","Former intern, less than 1 year","New Delhi","","","One of the best places to work.","Don't have any cons to share as such","Show more"
"4.0","7 Sept 2022","Working culture","https://www.glassdoor.co.in/Reviews/Employee-Review-Indian-Oil-RVW68791811.htm","Anonymous employee","Former employee","","Medical benefits, flexibility in terms of posting.","Hierarchy, Less Innovative culture, monotonous working","","",""
"4.0","28 Aug 2022","Good opportunity to witness plant processes in real","https://www.glassdoor.co.in/Reviews/Employee-Review-Indian-Oil-RVW68447653.htm","Anonymous intern","Former intern, less than 1 year","","Good overview of all plant operations","No hands-on project for trainees","","",""
"3.0","7 Sept 2022","IOCL AVIATION","https://www.glassdoor.co.in/Reviews/Employee-Review-Indian-Oil-RVW68800033.htm","Aviation officer","Current employee","","Lot of responsibilities and things to learn.","Work load is more here","","",""
"5.0","22 Aug 2022","Amazing experience","https://www.glassdoor.co.in/Reviews/Employee-Review-Indian-Oil-RVW68196981.htm","Vocational trainee","Current intern, less than 1 year","","","","you will be industry ready","there are as such no cons for me","Show more"
"4.0","26 Aug 2022","A very good pay with comparable workload","https://www.glassdoor.co.in/Reviews/Employee-Review-Indian-Oil-RVW68382353.htm","Senior software engineer","Current employee, more than 8 years","New Delhi","","","-good working environment 
-Co-operative perks","Heavy workloads at times but manageable","Show more"
"3.0","29 Aug 2022","Typical government emplyee","https://www.glassdoor.co.in/Reviews/Employee-Review-Indian-Oil-RVW68464086.htm","Senior project engineer","Current employee, more than 3 years","Guwahati","Good if security is your priority","Bad if you want to make a difference","","",""
"5.0","4 Aug 2022","good","https://www.glassdoor.co.in/Reviews/Employee-Review-Indian-Oil-RVW67566225.htm","Anonymous contractor","Former contractor","Mumbai","","","good, better, best, outstanding, super. Nice place to work. Bank canteen facilities available.

it is good place to work 
good people
helpful","nothing nothing nothing no comments","Show more"
"5.0","15 Aug 2022","Excellent company","https://www.glassdoor.co.in/Reviews/Employee-Review-Indian-Oil-RVW67951155.htm","Manager","Former employee, more than 10 years","Mumbai","","","Excellent work environment. Transperant review system","None. Great company to work with.","Show more"
"5.0","2 Sept 2022","Excellent","https://www.glassdoor.co.in/Reviews/Employee-Review-Indian-Oil-RVW68650737.htm","Senior manager","Current employee","","Positive Work Environment & Culture","Public Perception and understanding of PSU","","",""
"2.0","30 Jul 2022","PSU are full of pressure","https://www.glassdoor.co.in/Reviews/Employee-Review-Indian-Oil-RVW67352180.htm","Assistant manager","Current employee, more than 3 years","South Goa","","","not at all not a single","All that exist happens here","Show more"
"4.0","10 Aug 2022","Fiance Intern","https://www.glassdoor.co.in/Reviews/Employee-Review-Indian-Oil-RVW67760631.htm","Finance intern","Current intern","Noida","All the employees are CA and you would find great mentors there.","Not much work to do in the finance department.","","",""
"5.0","23 Aug 2022","Apprenticeship Review","https://www.glassdoor.co.in/Reviews/Employee-Review-Indian-Oil-RVW68227497.htm","Secretarial assistant","Former intern, more than 1 year","","Understanding mentors, fixed work hours","Not a platform to learn much for non-technical apprenticeship","","",""
"4.0","23 Aug 2022","I was intern in IOCL","https://www.glassdoor.co.in/Reviews/Employee-Review-Indian-Oil-RVW68226646.htm","Anonymous intern","Former intern, less than 1 year","","Nicely visited plant and their functions","haven't done much practical like projects","","",""
"5.0","18 Aug 2022","Overall good company","https://www.glassdoor.co.in/Reviews/Employee-Review-Indian-Oil-RVW68077306.htm","Engineering officer","Current employee, more than 1 year","Chennai","Allowances and perks are good","Monotonous work which might become boring over time","","",""
"4.0","28 Aug 2022","Hi","https://www.glassdoor.co.in/Reviews/Employee-Review-Indian-Oil-RVW68444645.htm","Intern - hourly","Former intern, less than 1 year","","","","Good work culture to work","Hectic life..less time fo fun","Show more"
"4.0","13 Aug 2022","Handsom salery and benefit","https://www.glassdoor.co.in/Reviews/Employee-Review-Indian-Oil-RVW67883194.htm","Junior engineer","Current employee, less than 1 year","Barauni","Good medical benefits and salery. Good work life balance","Poor function of finance department","","",""
"4.0","29 Jul 2022","Exp in Indian Oil","https://www.glassdoor.co.in/Reviews/Employee-Review-Indian-Oil-RVW67297787.htm","Anonymous employee","Current employee, more than 8 years","Gurgaon, Haryana","","","Good Compensation though lesser than market standards
Direct interaction with Govt agencies related to subjects","Politics and promotion Policy
Work Life balance","Show more"
"5.0","31 Jul 2022","na","https://www.glassdoor.co.in/Reviews/Employee-Review-Indian-Oil-RVW67353723.htm","Software developer","Current employee, more than 3 years","New Delhi","","","Public sector benefits.Medical benefits,Good salary,bonus.","Bad appraisal system,,Remote posting ,Tranferable job.Difficult to manage if both are working at different locations","Show more"
"4.0","23 Jul 2022","Great place to work","https://www.glassdoor.co.in/Reviews/Employee-Review-Indian-Oil-RVW67063950.htm","Senior engineer","Former employee, more than 5 years","Vadodara","","","Can learn a lot
Pays well
Good career growth opportunities","Highly bureaucratic.
Some level of corruption exists
No technical career path","Show more"
"5.0","13 May 2022","Great PSU nad great people to work with","https://www.glassdoor.co.in/Reviews/Employee-Review-Indian-Oil-RVW64081294.htm","Administrative assistant/accounting clerk","Former temporary employee","","","","Have learnt SAP, BILLS MAKING, M.S.OFFICE useful for office work","Even though all the recruitment process was just like permenant govt employees they recruited us as an Apprentice and not a permenant employee.","Show more"
"3.0","8 Aug 2022","One of the major PSU in India","https://www.glassdoor.co.in/Reviews/Employee-Review-Indian-Oil-RVW67674668.htm","Assistant manager retail sales","Former employee, more than 3 years","","Good job security and perks","Work life balance is difficult to maintain","","",""
"4.0","22 Jul 2022","Work place is great with the excellent people","https://www.glassdoor.co.in/Reviews/Employee-Review-Indian-Oil-RVW67014717.htm","Anonymous intern","Former intern","","People are good, behaviour of staff is great","Working conditions are not much better, cleanliness are lacking","","",""
"5.0","27 Jul 2022","Best PSU to work for CSE Graduate","https://www.glassdoor.co.in/Reviews/Employee-Review-Indian-Oil-RVW67211044.htm","Assistant manager","Current employee, more than 5 years","Gurgaon, Haryana","Autonomy, Perks, Social Status ,Place of posting","Less Salary in comparison to IT industry","","",""
"5.0","13 Aug 2022","Hi class!!","https://www.glassdoor.co.in/Reviews/Employee-Review-Indian-Oil-RVW67867966.htm","Senior project manager","Current employee","","Work life balance, growth, development","Culture, atmosphere, frequent re organisation","","",""
"4.0","27 Jun 2022","I worked as intern in electrical department for 1 month. It was a decent experience , i worked on cable scheduling.","https://www.glassdoor.co.in/Reviews/Employee-Review-Indian-Oil-RVW66017821.htm","Anonymous intern","Former intern, less than 1 year","","1. flexible time and good canteen","1. no stipend and bad management","","",""
"4.0","23 Apr 2022","Lots of potential. Limited by an uninterested staff.","https://www.glassdoor.co.in/Reviews/Employee-Review-Indian-Oil-RVW63178372.htm","Gdmo","Current contractor","","","","If you're preparing for your higher studies, I think this is the place to be, draw a salary and study.","Not much learning. You're basically sitting and prescribing as per the patient's request / paracetamol as usual. The patients want to be referred despite you having the knowledge to treat the disease.","Show more"
"4.0","7 Aug 2022","training on various","https://www.glassdoor.co.in/Reviews/Employee-Review-Indian-Oil-RVW67629252.htm","Anonymous intern","Current intern, less than 1 year","","","","good environment
hikes and pay are good","work pressure time management result","Show more"
"5.0","4 Aug 2022","Tech Advantage","https://www.glassdoor.co.in/Reviews/Employee-Review-Indian-Oil-RVW67565303.htm","Systems administrator","Former employee, more than 1 year","New Delhi","Lots of opportunity to learn","Not up to date with latest technology","","",""
"4.0","19 Jul 2022","Handling all matters across India","https://www.glassdoor.co.in/Reviews/Employee-Review-Indian-Oil-RVW66910494.htm","Anonymous employee","Former employee, more than 3 years","New Delhi","Beat company with understanding people","I wanted to grow and now looking forward to serve good companies","","",""
"5.0","4 Aug 2022","energising india","https://www.glassdoor.co.in/Reviews/Employee-Review-Indian-Oil-RVW67523667.htm","Research manager","Current employee, more than 10 years","","takes care of its employees","govt. policies should not hamper the business","","",""
"5.0","30 Jun 2022","Very satisfied","https://www.glassdoor.co.in/Reviews/Employee-Review-Indian-Oil-RVW66131686.htm","Senior engineering assistant","Current employee, more than 8 years","","","","Friendly management and work life balance","Time taken progress.This not good for who want higher salary and quick promotion to management level","Show more"
"5.0","3 Aug 2022","Working","https://www.glassdoor.co.in/Reviews/Employee-Review-Indian-Oil-RVW67516191.htm","Dgm - operations","Current employee, more than 10 years","","Good working environment and work culture","No negative points about company","","",""
"5.0","11 Jul 2022","Working advantages","https://www.glassdoor.co.in/Reviews/Employee-Review-Indian-Oil-RVW66533913.htm","Officer","Former employee, more than 3 years","Vijayawāda","","","Reputed, best government undertaking organization in India.","U will never regret for working in Iocl","Show more"
"2.0","29 Jul 2022","bad choice for enthusiastic engineers.","https://www.glassdoor.co.in/Reviews/Employee-Review-Indian-Oil-RVW67306789.htm","Mechanical engineer","Former employee","","Good initial salary and initial stay","politics, poor work culture, unprofessional behaviour","","",""
"5.0","8 Jul 2022","best PSU","https://www.glassdoor.co.in/Reviews/Employee-Review-Indian-Oil-RVW66480456.htm","Engineer","Current employee, more than 5 years","","Salary and Benifits/ Promotion on time/Good Exposure","No Technical work / Only Manegerial Work/ Hectic Schedule/S/D time 12 Hours duty/Work coulture","","",""
"5.0","27 Jul 2022","Amazing company","https://www.glassdoor.co.in/Reviews/Employee-Review-Indian-Oil-RVW67205805.htm","Research intern","Former intern, less than 1 year","New Delhi","","","mentors help you along the way.
perfect work-life balance","no cons from my side","Show more"
"4.0","12 Jun 2022","friendly staff but monotonous working hours","https://www.glassdoor.co.in/Reviews/Employee-Review-Indian-Oil-RVW65429080.htm","Safety coordinator","Former intern, less than 1 year","New Delhi","I liked the fact that the instructor and other people at the company were quite friendly.","The work can become monotonous at times and can bore one out.","","",""
"5.0","26 Jul 2022","Intenship","https://www.glassdoor.co.in/Reviews/Employee-Review-Indian-Oil-RVW67196231.htm","Quality control engineer","Current intern, less than 1 year","","Good work culture and good environment.","Must work in shifts and location.","","",""
"5.0","19 May 2022","Opinion","https://www.glassdoor.co.in/Reviews/Employee-Review-Indian-Oil-RVW64379888.htm","Assistant manager","Current employee, more than 5 years","Mumbai","","","One of the best companies in the world to work in Oil and Gas sector.","Transfers.
For some people it may be a problem but for some it is an opportunity to experience India which is famously known for Unity in diversity.","Show more"
"5.0","21 Jul 2022","Good","https://www.glassdoor.co.in/Reviews/Employee-Review-Indian-Oil-RVW66975991.htm","Internship","Former intern, less than 1 year","","Everything is good at the company","Nothing is bad at the company","","",""
"5.0","15 Jul 2022","Good Behaviour","https://www.glassdoor.co.in/Reviews/Employee-Review-Indian-Oil-RVW66723874.htm","Driver","Current employee, more than 5 years","Kurukshetra","","","Good Behaviour any Officer's and
Other workers","Nothing it's not cons iocl","Show more"
"5.0","16 Jul 2022","Nice platform","https://www.glassdoor.co.in/Reviews/Employee-Review-Indian-Oil-RVW66774453.htm","Junior assistant engineer","Former intern","","I have learnt so much from company.","company should give more job opportunities.","","",""
"5.0","2 Jul 2022","Analysis of product flow under WBSO","https://www.glassdoor.co.in/Reviews/Employee-Review-Indian-Oil-RVW66231256.htm","Marketing intern","Current intern, less than 1 year","Calcutta","Maharatna company, ONGC, comfortable environment, great learning experience","hierarchy, politics, nothing else to say","","",""
"5.0","9 Jul 2022","Decent company to work","https://www.glassdoor.co.in/Reviews/Employee-Review-Indian-Oil-RVW66484954.htm","Production engineer","Current employee","Barauni","Good pay, township and facilities","Overtimes, slow growth, non cooperative staff","","",""
"4.0","17 Jul 2022","Good","https://www.glassdoor.co.in/Reviews/Employee-Review-Indian-Oil-RVW66789694.htm","Safety officer","Current employee, more than 3 years","","Good work enviroment in this company","Salary is low as expected","","",""
"3.0","12 Jul 2022","Bureaucracy and nothing","https://www.glassdoor.co.in/Reviews/Employee-Review-Indian-Oil-RVW66584027.htm","Engineer","Former employee, more than 1 year","","Learning, earning, little work pressure","Too much bureaucracy , not supportive managers","","",""
"5.0","17 May 2022","12 years of petroleum refinery operation experience","https://www.glassdoor.co.in/Reviews/Employee-Review-Indian-Oil-RVW64289805.htm","Industrial production manager","Current employee","","","","Public Limited Company and the top petroleum refinery in India.","Delayed promotion system and ancient infrastructure at the technical level.","Show more"
"5.0","9 Jul 2022","Great Company","https://www.glassdoor.co.in/Reviews/Employee-Review-Indian-Oil-RVW66492599.htm","Saco","Current employee, more than 1 year","","Work-life balance, Great work culture","Limited growth opportunities for CAs","","",""
"5.0","15 Jun 2022","most valuable job","https://www.glassdoor.co.in/Reviews/Employee-Review-Indian-Oil-RVW65554452.htm","Junior executive assistant","Former employee, more than 5 years","Paradip","","","you will be under public sector organisation.
full of facilities
overtimes pay","remote location from main city 120 km","Show more"
"5.0","24 Jun 2022","Best for learning","https://www.glassdoor.co.in/Reviews/Employee-Review-Indian-Oil-RVW65940911.htm","Mechanical technician apprentice","Former intern, less than 1 year","Pune","Good salary, good staff, supportive staff","It totally depend on your mentor or guide","","",""
"4.0","15 Jun 2022","Comfortable but not for ambitious people","https://www.glassdoor.co.in/Reviews/Employee-Review-Indian-Oil-RVW65555746.htm","Assistant manager - business development","Current employee, more than 5 years","Pune","","","Good salary
Good perks
Multiple location
Lots of travel and networking","Minimal Personal growth 
Recognition for work
Lot of redtaping","Show more"
"1.0","17 Sept 2022","Hii","https://www.glassdoor.co.in/Reviews/Employee-Review-Indian-Oil-RVW69158701.htm","Anonymous employee","Former employee, more than 10 years","","Good salary, good place for experience","Slow growth, internal politics and privatisation","","",""
"4.0","22 Jun 2022","Manager for pipeline project execution","https://www.glassdoor.co.in/Reviews/Employee-Review-Indian-Oil-RVW65870921.htm","Project manager","Current employee, more than 8 years","","Better facilities, Learning Scope,Direct involvement in execution","More expectations, no work life balance","","",""
"4.0","7 Jul 2022","How","https://www.glassdoor.co.in/Reviews/Employee-Review-Indian-Oil-RVW66408643.htm","Engineer","Current employee","","Good job and good salary","Work cultures and others good","","",""
"4.0","26 Jun 2022","Fun and healthy workplace","https://www.glassdoor.co.in/Reviews/Employee-Review-Indian-Oil-RVW65980439.htm","Anonymous intern","Former intern, more than 1 year","","Excellent mentors who guide you every time","extremely fast-paced environment for interns","","",""
"5.0","30 Jun 2022","IOCL","https://www.glassdoor.co.in/Reviews/Employee-Review-Indian-Oil-RVW66129850.htm","Assistant manager","Current employee","","Great place to work for","Extra work hours beyond routine assignment","","",""
"5.0","2 Jul 2022","Salary","https://www.glassdoor.co.in/Reviews/Employee-Review-Indian-Oil-RVW66212718.htm","Project manager","Current employee, more than 10 years","Calcutta","Compensation, Bonus, salary, Timing, Medical","Work culture, Training, self development","","",""
"3.0","29 May 2022","Internship at IOCL","https://www.glassdoor.co.in/Reviews/Employee-Review-Indian-Oil-RVW64826194.htm","Anonymous intern","Former intern","","","","- brand name
- less pressure","- lack of communication
- lack of intention to cordinate
- not fit for learning new skills and information","Show more"
"3.0","16 May 2022","Superannuated","https://www.glassdoor.co.in/Reviews/Employee-Review-Indian-Oil-RVW64236154.htm","Anonymous freelancer","Current freelancer, more than 10 years","","","","Excellent work life balance and medical facility","Casteism, Regionalism predominant while writing APA. Sycophancy is at the peak","Show more"
"5.0","13 Jun 2022","Employee friendly policies","https://www.glassdoor.co.in/Reviews/Employee-Review-Indian-Oil-RVW65498297.htm","Assistant manager","Current employee","Bīkāner, Rajasthan","Good peers to work with","Slow growth in career. Promotions take 3-4 years","","",""
"4.0","17 Jun 2022","Ert","https://www.glassdoor.co.in/Reviews/Employee-Review-Indian-Oil-RVW65674900.htm","Manager","Current employee","","Job security is great at iocl","HR department needs vast improvement","","",""
"5.0","24 May 2022","I am good working all fillds","https://www.glassdoor.co.in/Reviews/Employee-Review-Indian-Oil-RVW64589452.htm","Technician","Former employee, more than 1 year","Mathura, Uttar Pradesh","","","Handal some under people.
I good knowledge his work.","Same as responsibility work and other work","Show more"
"4.0","25 May 2022","feedback","https://www.glassdoor.co.in/Reviews/Employee-Review-Indian-Oil-RVW64697596.htm","Anonymous employee","Former employee","Mumbai","Secure job, reasonable pay and different work opportunities","Individuality takes a backseat. Lot of transfers possible. Conformist mindset","","",""
"4.0","1 Jun 2022","Welder","https://www.glassdoor.co.in/Reviews/Employee-Review-Indian-Oil-RVW64962194.htm","Welder","Former employee","","","","This company is verry fantastic","Nice job provide and earn full company","Show more"
"5.0","17 May 2022","Best PSU of the country","https://www.glassdoor.co.in/Reviews/Employee-Review-Indian-Oil-RVW64298775.htm","Manager","Current employee, more than 10 years","Gurgaon, Haryana","Highly employee centric organization, best benefits (medical) and others","Bureaucratic culture, slow decision making, frequent transfer","","",""
"5.0","29 Apr 2022","Great Place to work","https://www.glassdoor.co.in/Reviews/Employee-Review-Indian-Oil-RVW63471774.htm","Assistant manager","Current employee, more than 8 years","","Great Public Sector to work in India","Sometime remote postings are there , but its a work requirement, and corporation give full fledge facilities","","",""
"4.0","29 May 2022","Ok","https://www.glassdoor.co.in/Reviews/Employee-Review-Indian-Oil-RVW64821549.htm","Assistant manager - maintenance","Current employee, more than 5 years","Calicut, Kerala","","","Good company to work for","No work life balance which adversely affects the life","Show more"
