"review-details_overallRating__VDxCx","timestamp_reviewDate__wvu2v","review-details_detailsLink__NxIv5","review-details_detailsLink__NxIv5 href","review-details_employee__5iA6v","review-details_employeeDetails__BvAwX","review-details_location__E_Ine","review-details_isExpanded__bLJng","review-details_isExpanded__bLJng 2","review-details_isCollapsed__Bsg_9","review-details_isCollapsed__Bsg_9 2","expand-button_ExpandButton__FlBlZ"
"1.0","2 Oct 2020","Worst Company to work for","https://www.glassdoor.co.in/Reviews/Employee-Review-Tata-Power-RVW36638543.htm","Lead engineer","Former employee, more than 3 years","Mumbai","","","None that i can think of","There are tons:
1. Worst payer
2. Company is filled with politics
3. No matter how much they vent but they dont care for their employees
4. Boot lickers in top and middle management
5. No career growth. People dont get promoted even in 7 years
6. No learning. They dont work on any new technology. Its an old company run by old people.

One senior once shared in a Training at Tata Power:
""As an employee of Tata Power, if you want to grow in your career you will have to leave the organization""

Attrition rate is really high. 65 people joined with me as GETs and 60 of them left the company in a couple of years. 

Dont make any mistake of joining this pathetic organization.","Show more"
"3.0","5 Aug 2021","Tata power","https://www.glassdoor.co.in/Reviews/Employee-Review-Tata-Power-RVW50758805.htm","Assistant manager","Former employee, more than 8 years","Noida","","","Company leased accommodation and facilities provided by the company are good and mostly this is the holding point for employees.","GETs are treated third rate and no separate growth or progression track for them. These are lowest paid employees. The company HR is unethical and cut the salary of employees in the name of uniform compensation structure. This is unheard in the Tata group but it happened here","Show more"
"4.0","3 Dec 2015","Work","https://www.glassdoor.co.in/Reviews/Employee-Review-Tata-Power-RVW8809872.htm","Anonymous employee","Current employee, more than 10 years","Mumbai","","","This is a good and long term company to work with and provides a caring and nourishing environment that takes care of all its people while providing a meaning ful job and career prospects","This can be a difficult place in terms of collaboration and people sensitivities as there are multiple goals and targets that people seem to be pursuing at one time","Show more"
"3.0","8 Oct 2014","A PSU like company trying to become professional","https://www.glassdoor.co.in/Reviews/Employee-Review-Tata-Power-RVW5121348.htm","Assistant manager","Current employee, less than 1 year","Mumbai","","","Employees are treated very well, facilities provided by the company are unparalleled in the city also the ethical values are quite ardently followed.","The veterans behave as if they own the company. Growth is almost stagnant and the compensation offered is probably the lowest in the sector. Distribution of projects is quite haphazard and the decision making process is extremely sluggish.","Show more"
"3.0","4 Aug 2016","From a employee oriented to a customer oriented transition","https://www.glassdoor.co.in/Reviews/Employee-Review-Tata-Power-RVW11453532.htm","Asstt manager","Current employee, more than 5 years","Mumbai","","","1. Great work environment.  
2. Flexible work timing and not much pressure from management 
3. Great technical expertise and support","1. Lack of growth opportunities
2. Employee welfare has taken a back seat and become more customer centric.  
3. Lack of senior management support due to financial constraints","Show more"
"1.0","28 Aug 2021","Good company to work with if you want to bid adieu to your Mental Health","https://www.glassdoor.co.in/Reviews/Employee-Review-Tata-Power-RVW51761414.htm","Management trainee","Current employee, less than 1 year","","","","High learning curve
Facility of accomodation","1. Slow Growth
2. Zero work life balance
3. Manager will FORCE you to do overtime and might threaten you about firing you from the job if you refuse to come to office on Sunday
4. Officially Saturdays are a holiday but unofficially you will have to come to office and slog for 10 hours. Yes even on a Saturday.
5. Pay is also very less considering the amount of work that they will burden you with.","Show more"
"5.0","6 Aug 2013","I learned a lot from this organization.I got an excellent knowledge from my field and other field as well.","https://www.glassdoor.co.in/Reviews/Employee-Review-Tata-Power-RVW2902216.htm","Project engineer","Former employee, more than 3 years","Mundra, Gujarat","","","Transparency and relations with the employees.Trust,integrity and honesty these are the core values of this organization and I am very satisfied with this as an employee.","Everything is well mannered in this organization.I am feeling really proud to be an employee of this organization.","Show more"
"3.0","14 Sept 2014","Career growth","https://www.glassdoor.co.in/Reviews/Employee-Review-Tata-Power-RVW4967239.htm","Lead engineer","Former employee, more than 1 year","Mumbai","","","1. Treats employees equally
2. Its the best company to work for above mid management level. In work level getting promotion is challenging
3. Lots of training and personal development","1. faster career growth largely depends on which division you are posted, be it a project site or corporate office
2. In some plants its already saturated so slow career growth","Show more"
"2.0","4 Apr 2018","Wasted Time in Tata Power","https://www.glassdoor.co.in/Reviews/Employee-Review-Tata-Power-RVW20021467.htm","Anonymous employee","Current employee","","","","The work load in Tata Power is not very high especially in the operation department. Hence if you are working in the operation department you do get some amount of free time.","If you working in the maintenance department, your life is like hell. You have to work more than 8 hours  a day. Most of the Power plants of the company are located in remote areas. Hence if you looking to join the company, be prepared to work in these kinds of locations.","Show more"
"5.0","10 Aug 2012","It is the best plateform to utilize Ur knowledge and skills.","https://www.glassdoor.co.in/Reviews/Employee-Review-Tata-Power-RVW1831670.htm","Zonal shift officer","Current employee, more than 3 years","New Delhi","","","there are lots of field to enhance Ur skills for organizational and self growt. better healthy and working environment.It also provide opportunities to grow  its employees by providing varios training to utilize modern technology in working area.","Táta power have no down word......its a core value of TATA group.","Show more"
"2.0","17 Sept 2021","You will be called all Saturday and non-working hours","https://www.glassdoor.co.in/Reviews/Employee-Review-Tata-Power-RVW52699827.htm","Procurement","Former employee, more than 3 years","","","","Name and trust of TATA","You will have to work almost every Saturday, public holiday, and non-working hours. They won’t pay you any extra or no comp-off time for all this. Forget your personal time.
Some top managers don’t have any personal life so they would make sure other employees should not have as well.","Show more"
"4.0","10 Mar 2015","Worked as a lead engineer @Tata power distribution automation for a period of 1 Year.","https://www.glassdoor.co.in/Reviews/Employee-Review-Tata-Power-RVW6089435.htm","Lead engineer","Former employee","Mumbai","","","A good place to learn, and work. Supportive peers, and good work life balance. Projects and challenges require attention to detail and consistent effort. A good place to begin in Power system area, amongst other companies","salary scale, internal cross talk, rigid and routine work(if stuck with the wrong profile).","Show more"
"4.0","20 Aug 2016","Contracts & Procurement Professional","https://www.glassdoor.co.in/Reviews/Employee-Review-Tata-Power-RVW11628120.htm","Anonymous employee","Current employee, more than 5 years","Mumbai","","","Brand image, Good work culture,Few very good Employee friendly policies  (especially company leased accommodation in city like Mumbai) , Work ethics  & it is one of the best companies in power sector in India","Limited opportunities for high potential youngsters to grow, salary discrepancies , Slow organization overall and not exciting enough for youngsters","Show more"
"4.0","31 Aug 2012","Good company to work in Power generation sector with growth opportunities","https://www.glassdoor.co.in/Reviews/Employee-Review-Tata-Power-RVW1908094.htm","Engineer","Former employee, less than 1 year","Mumbai","","","Wide network in power generation in thermal, hydel, and gas based as well as presence in distribution in delhi.  Good facilities provided to employees ranging from accommodation to medical benefits","In Trombay unit, some Union employees have a feeling of being superior as compared to management employees.
In group, more  emphasis is required towards coordination and conditioning of lateral recruits.","Show more"
"3.0","16 Nov 2010","Tata Power Specific to SED Review","https://www.glassdoor.co.in/Reviews/Employee-Review-Tata-Power-RVW716747.htm","Applications engineer","Current employee","Mumbai","","","i like Work culture,ambiance of Tata Power.
in Tata Power there is Freedom of work, no pressure from top managment.","Less Salary as compare to industrial standerd 
Slow growth rates and No value of software engineers. 
Dont have to much project for future.","Show more"
"4.0","24 Feb 2014","It is all about fit","https://www.glassdoor.co.in/Reviews/Employee-Review-Tata-Power-RVW3754719.htm","Assistant manager","Former employee, more than 5 years","Bhubaneshwar","","","Excellent Training Provided, Secure Job, Freedom to learn more and more about the Job, Network within the company can help you like anything, diversified opportunities within the company, good top leadership, Unbelievable focus on Safety","HR fumbles in its job but corrected by the top management from time to time, Huge Bureaucracy to get something approved","Show more"
"2.0","23 Aug 2016","Redefine and implementations of Present and practical needs","https://www.glassdoor.co.in/Reviews/Employee-Review-Tata-Power-RVW11659754.htm","Senior executive","Former employee","Haldia, West Bengal","","","1. Define SOP
2. Job Stability
3. Brand Images","1. Many of the times it requires to come out from define perimeter to execute at extra miles but define mindset is a major stumbling blocks.

2. Wage discripencies

3. Slow and orthodox management style

4. Confusions about SOP down the line and lack of communications

5. Timid management to conqure out of the box challanges","Show more"
"2.0","5 Aug 2011","It's a Boring, slow place; Isn't even a bit like the 'high of working in the defence field' mentioned in the website.","https://www.glassdoor.co.in/Reviews/Employee-Review-Tata-Power-RVW1050821.htm","Engineer","Former employee","Mumbai","","","Respect and fair to women
Largely a good working environ & culture
Some sensible and practical managers
Employee benefits
Trainings","Neoptism
hidden politics & revenge mentality
Boring projects
Low salary
Cold, insecure, unhelpful managers
Job insecurity
Poor communication from management","Show more"
"5.0","9 Aug 2012","Organisation nutruirng ethical values ,empowering people to Innovate and grow  .","https://www.glassdoor.co.in/Reviews/Employee-Review-Tata-Power-RVW1827122.htm","Senior manager","Current employee, more than 1 year","Mumbai","","","Company with a Vision and road map for the future.
Company caring for its employees and its customers .
Company encouraging its employee to ""Dare to Try"" .i.e Innovate.
Company helping its employees to strike the Work Life Balance.","There could be no Cons in the enviornment that I have worked in .","Show more"
"4.0","21 Oct 2021","Regulatory Affairs","https://www.glassdoor.co.in/Reviews/Employee-Review-Tata-Power-RVW54324445.htm","Group head","Former employee, more than 10 years","","","","1. Sound Balance sheet
2. Secure Work Culture
3. Appreciate Talent","1. Lobbying
2. Policies change too frequently and sometimes to suit individuals
3. Investment returns are sometimes not tracked diligently","Show more"
"4.0","20 Sept 2012","It is enjoyable working here.","https://www.glassdoor.co.in/Reviews/Employee-Review-Tata-Power-RVW1973978.htm","Electrical maintenance","Current employee, more than 3 years","New Delhi","","","Since it is a Tata Group so we have got good working culture and clean work processes which aspires to become truly world class.","At Tata Power Delhi Distribution Ltd. is a joint venture company with Delhi Govt. so there is a difference in working attitude of pure Tata Employees & Delhi Govt. employees.","Show more"
"4.0","27 Oct 2021","Legacy company on the path to transformation through a high growth oriented culture","https://www.glassdoor.co.in/Reviews/Employee-Review-Tata-Power-RVW54561578.htm","Management trainee","Current employee, less than 1 year","Mumbai","","","Stable and secure environment
Access to standard benefits and policies of Tata Group
Accommodation facility as applicable in specific locations
Exposure to multiple facets of business","Work life balance can be an issue, especially in newer departments
Growth and pay may be little below industry standards","Show more"
"5.0","2 May 2012","Orgsnisation with high Ethical values & opportunity to learn & grow","https://www.glassdoor.co.in/Reviews/Employee-Review-Tata-Power-RVW1483584.htm","Manager o&m","Current employee","Mumbai","","","Ethical dealings in all its projects
Values laid by the organisation
Good Workplace
Opportunity to grow along with organisation
Transperancy
Safety & health Policy
Good Leadership","N o t  a p p l i c a b l e f o r T A T A P O W E R","Show more"
"4.0","28 Jul 2012","Laid back work culture","https://www.glassdoor.co.in/Reviews/Employee-Review-Tata-Power-RVW1781847.htm","Executive","Former employee, more than 1 year","Mumbai","","","Best part is that they provide free accommodation and its not included in the CTC. Workload is light and give plenty  of time to beginners.","Department allocation is not transparent. You may miss out on your choice to someone you deem less worthy. Management save each others back. Had bad experience about it.","Show more"
"3.0","17 Feb 2014","Good Company if you are interested in a techno-commercial sector with strong application of courses during engineering","https://www.glassdoor.co.in/Reviews/Employee-Review-Tata-Power-RVW3715487.htm","Assistant manager trainee","Current employee, more than 1 year","Mumbai","","","Work life balance, Work ethics, Caring","Low Pay, Slow Career growth","Show more"
"4.0","20 Oct 2012","Excilent","https://www.glassdoor.co.in/Reviews/Employee-Review-Tata-Power-RVW2067100.htm","Field engineer operations","Current employee, more than 1 year","Dhanbād","","","Working environment is very good and also career growth education culture these are the main features to join tata power.","Lateral entry employee not feel too void here because tata hr policy only support their GET and DETs.","Show more"
"4.0","19 Sept 2015","Good place to work","https://www.glassdoor.co.in/Reviews/Employee-Review-Tata-Power-RVW8004249.htm","Anonymous employee","Former employee","","","","Tata Ethics Valued in true sense. Co-operative work culture, descent pay and respectful duty.  Good work life balance.","Growth is slowing down slowly. HR policies need to be re-structured in accordance with the current scenario","Show more"
"4.0","13 May 2019","Good Company, Needs Growth impetus","https://www.glassdoor.co.in/Reviews/Employee-Review-Tata-Power-RVW26110293.htm","Anonymous employee","Current employee, more than 10 years","","","","Brand, Culture, People, Growth Opportunities for talent people, benefit schemes, employee friendly, process driven organization","Industry is under stress, not enough opportunities except in Renewable. Thus not enough new business growth opportunities, leading limited growth opportunities for employees. Once market opens up, things should be much better.","Show more"
"4.0","18 Oct 2019","Very good company in the Power sector","https://www.glassdoor.co.in/Reviews/Employee-Review-Tata-Power-RVW29898655.htm","Operations and maintenance engineer","Current employee, more than 3 years","Jājpur","","","Helpful and supportive culture 
Strong work ethics
Lots of hands-on learning
Great start for undergraduate engineers","Talent retention is poor
Career progression is extremely slow","Show more"
"5.0","2 Jul 2012","Trust in what they do...!","https://www.glassdoor.co.in/Reviews/Employee-Review-Tata-Power-RVW1680998.htm","Manager - communications","Current employee, more than 1 year","Mumbai","","","This is a company that cares for the employees. It is a family within and across generations.","Not really much, except what we all need to understand is - Do it slow but do it right...!","Show more"
"5.0","19 Aug 2012","Simply  Superb...... Way  to a  real sucess in life........","https://www.glassdoor.co.in/Reviews/Employee-Review-Tata-Power-RVW1861989.htm","Project management","Current employee, more than 3 years","Dhanbād","","","Cares both  Professional as well as Personal Life.............","Growth is just like a Gov sector but  one can have a  steady  flow  life.","Show more"
"3.0","28 Oct 2012","Company should adopt Newer practices","https://www.glassdoor.co.in/Reviews/Employee-Review-Tata-Power-RVW2089966.htm","Group head it","Current employee, more than 1 year","Noida","","","Good company for beginer to learn the power business. Gets ample opportunity for learning. Job security is the the key in this company.","Old employees are too strong & are very proud of their practices. Do not want to learn or improve.","Show more"
"4.0","30 Jun 2014","Very good working experience","https://www.glassdoor.co.in/Reviews/Employee-Review-Tata-Power-RVW4499591.htm","Group head","Current employee, more than 3 years","Mundra, Gujarat","","","Employee friendly organisation,  provides ample opportunity for personal growth,  good rewards, process driven organisation","Some of the work processes need to be smoothened and simlified for faster decision making.","Show more"
"3.0","4 Sept 2019","Average Company","https://www.glassdoor.co.in/Reviews/Employee-Review-Tata-Power-RVW29019645.htm","Anonymous employee","Former employee, more than 10 years","","","","Great work life balance, have human touch in everything, good housing policy, medical policy","Salary growth is very slow, no intention to grow, slow decision making, non-cooperation between departments, lacks vision. Too bureaucratic. Middle management just passes time and forward emails.","Show more"
"3.0","20 Feb 2017","Very laid back culture. Intelligent people.","https://www.glassdoor.co.in/Reviews/Employee-Review-Tata-Power-RVW13859415.htm","Intern","Former employee, less than 1 year","Noida","","","The International sales team is highly talented.They have people from IIM's + TAS officers.
Free lavish buffet (with 3 days non-veg)","Recruitment is frozen. Interns are not hired even after exemplary performance.","Show more"
"5.0","26 Feb 2021","Electrical Distribution &operation &maintenance.","https://www.glassdoor.co.in/Reviews/Employee-Review-Tata-Power-RVW43140305.htm","Epc director of projects","Former employee, more than 10 years","Mayurbhanj","","","Due to I have experience in this field &With hobbies in this sector.","Yes I got apperacition  certificate from in RGGVY projects by company Vice president","Show more"
"1.0","1 Oct 2021","salary problem","https://www.glassdoor.co.in/Reviews/Employee-Review-Tata-Power-RVW53414807.htm","Data entry specialist","Current employee, less than 1 year","Āīzawl","","","i was working in tata a few days back but after completing task they didn't give me salary it has been one week when i call they told me i will get a call from finance regarding my salary till now no ph calls nor salary and no updates at all i'm very dissatisfied in this company","may be i'm not sure","Show more"
"4.0","27 Jun 2012","Care and Excellence","https://www.glassdoor.co.in/Reviews/Employee-Review-Tata-Power-RVW1658689.htm","Executive - corporate administration","Current employee, more than 1 year","Mumbai","","","The environment at Tata Power is the most employee friendly, the workload is comparatively less. There exist checks and balances, a highly process driven system","There are very restricted decision making powers with individuals","Show more"
"2.0","18 May 2015","Old school","https://www.glassdoor.co.in/Reviews/Employee-Review-Tata-Power-RVW6632409.htm","Lead culture initiatives","Current employee, more than 1 year","Mumbai","","","Work life balance, employee benefits, solid processes, stability. it never fires anyone unless they are accused of malpractice on the job.","extremely old school culture, people still refer to the seniors as sir and mam. salaries quite low as per industry standards","Show more"
"4.0","8 Aug 2015","A Good Company to work with","https://www.glassdoor.co.in/Reviews/Employee-Review-Tata-Power-RVW7508683.htm","Assistant manager","Current employee, more than 3 years","Noida","","","1) 5/5 on Work life Balance","1) Low growth opportunities 
2) Middle management not skillful enough
3) Low salary for junior employees
4) Discrimination between contract and permanent employees","Show more"
"4.0","10 Mar 2017","I had 6 months of experience in Shalivahana green energy limited. It consists of 6.oMW.","https://www.glassdoor.co.in/Reviews/Employee-Review-Tata-Power-RVW14130743.htm","Anonymous employee","Former employee, more than 1 year","Hyderābād","","","It is the one of best choice Because Tata is the MNC.","It is good experience in the future and when I discuss about my job I can feel proud.","Show more"
"5.0","16 Dec 2017","Good Company to start and settle-down in Career","https://www.glassdoor.co.in/Reviews/Employee-Review-Tata-Power-RVW18372929.htm","Anonymous employee","Former employee","","","","Good (Best) work culture
The good work environment for employees ""it is an employee-oriented company"".
Awesome opportunities to learn
Superb Infrastructure and facilities.
It is best-reputed brand to work for.","I haven't faced such negative things which are considerable.","Show more"
"5.0","8 Jan 2019","Eagerly waiting to work at tata power company","https://www.glassdoor.co.in/Reviews/Employee-Review-Tata-Power-RVW24109642.htm","Data entry","Current employee, less than 1 year","Bengaluru","","","Tata power is the largest power generation company in India aimed at providing uninterrupted powersupply.","Challenges faced by industry,policy changes required,compensatory tarrif issue etc.","Show more"
"5.0","11 Mar 2019","Proud to be part of the great TATA group","https://www.glassdoor.co.in/Reviews/Employee-Review-Tata-Power-RVW25113688.htm","Anonymous employee","Former employee","","","","Beautiful work culture
Very free to express opinions 
Different types of power generation sources like thermal, solar, and wind, transmission distribution. 
Great learning experience 
Great Policies for housing in metro cities","Salary is ok but could be higher !!","Show more"
"3.0","13 Jul 2013","“No growth”","https://www.glassdoor.co.in/Reviews/Employee-Review-Tata-Power-RVW2819454.htm","Executive engineer","Current employee, more than 3 years","Mundra, Gujarat","","","Good brand name, Job security, Normal workload,Good values and culture","Inefficient HR's,No transparency on appraisal,Low salary,Slow growth rates of company,slow career growth of employee,Lots of low grade jobs are done by 0-4 yrs experienced engineers only.","Show more"
"4.0","4 Oct 2013","A good place to work as a fresher in power sector due to its presence in generation,transmission & distribution....","https://www.glassdoor.co.in/Reviews/Employee-Review-Tata-Power-RVW3137287.htm","Control desk engineer","Current employee, more than 3 years","Dhanbād","","","*Gud learning environment.* Stable and secured job.*Not excessive work pressure.","Chances of getting posted to different regions as per requirement.","Show more"
"3.0","18 Oct 2013","A lethargic company with very few good mentors driving it through!","https://www.glassdoor.co.in/Reviews/Employee-Review-Tata-Power-RVW3198736.htm","Assistant manager","Current employee, more than 1 year","Noida","","","1) Steady job with no wrinkles guarantee
2) Employee care!","1) Laid back attitude of people making a sad culture!
2) Unproductive politics","Show more"
"3.0","17 Oct 2018","Renowned Company in power Sector","https://www.glassdoor.co.in/Reviews/Employee-Review-Tata-Power-RVW23004029.htm","Lead engineer","Current employee, more than 5 years","Mumbai","","","Safe Working environment, Can get various opportunities within company","Frequent policy change, slow career growth, Shady Increment/promotion policy, Availing a policy can be a big task.","Show more"
"3.0","13 May 2019","Tata Power "" Is it actually like other TATA industries""","https://www.glassdoor.co.in/Reviews/Employee-Review-Tata-Power-RVW26126297.htm","Lead engineer","Current employee, more than 3 years","Ajmer","","","If you are working in your home town,  you should definitely go for it.","If you are looking for quick growth opportunities,  think twice.","Show more"
