"review-details_overallRating__VDxCx","timestamp_reviewDate__wvu2v","review-details_detailsLink__NxIv5","review-details_detailsLink__NxIv5 href","review-details_employee__5iA6v","review-details_employeeDetails__BvAwX","review-details_location__E_Ine","review-details_isExpanded__bLJng","review-details_isExpanded__bLJng 2","review-details_isCollapsed__Bsg_9","review-details_isCollapsed__Bsg_9 2","expand-button_ExpandButton__FlBlZ"
"4.0","19 Aug 2018","Good work environment","https://www.glassdoor.co.in/Reviews/Employee-Review-Tata-Power-RVW22045090.htm","Lead analytics and iot","Current employee, more than 10 years","Mumbai","","","Very caring for employees and friendly.","Not much growth for old employee","Show more"
"5.0","12 Nov 2018","Looking goods","https://www.glassdoor.co.in/Reviews/Employee-Review-Tata-Power-RVW23385143.htm","Cashier","Current employee, more than 3 years","Bengaluru","","","I like the job then I love this company","Love and then like this job","Show more"
"3.0","31 Aug 2019","Good organization","https://www.glassdoor.co.in/Reviews/Employee-Review-Tata-Power-RVW28960504.htm","Anonymous employee","Current employee, more than 8 years","","Very stable job and very good work ethics. Very good additional benefits.","Slow career growth and less pay structure.","","",""
"3.0","12 Dec 2019","Great working culture but growth is slow","https://www.glassdoor.co.in/Reviews/Employee-Review-Tata-Power-RVW30828810.htm","Anonymous employee","Current employee","","","","Good working culture
Good brand 
Work life balance","Low salary
Politics
Low growth
Role flexibility is less","Show more"
"5.0","27 Jul 2020","Excellent","https://www.glassdoor.co.in/Reviews/Employee-Review-Tata-Power-RVW34471910.htm","Junior engineer","Current employee, more than 10 years","Pune City","","","Good management staff good clean","Challenge for presentation in Electrical","Show more"
"5.0","12 Aug 2020","Great Place to work, learn and grow","https://www.glassdoor.co.in/Reviews/Employee-Review-Tata-Power-RVW34837739.htm","Dgm - operations","Current employee","Mumbai","","","Employee care
Empowerment
Good training mechanism
Good canteen
Medical facilities","Slow raises and not very agile","Show more"
"5.0","23 Aug 2020","Tata Power has a strong brand in India","https://www.glassdoor.co.in/Reviews/Employee-Review-Tata-Power-RVW35191549.htm","Regional manager","Current employee, more than 3 years","New Delhi","Brand Value, Work life balance","Bureaucratic system, Cumbersome process, Slow growth","","",""
"5.0","22 Sept 2020","HR Administration executive for recrutment","https://www.glassdoor.co.in/Reviews/Employee-Review-Tata-Power-RVW36229027.htm","Hr-executive","Current employee, more than 10 years","Mumbai","For Better opportunity in multinational company","Better work environment and safe working with safety","","",""
"5.0","14 Jan 2021","Best Company to work for","https://www.glassdoor.co.in/Reviews/Employee-Review-Tata-Power-RVW40684401.htm","Lead analyst","Current employee, more than 5 years","Mumbai","Excellent Learning, Ethical Company, Trust, Good work Culture","Less Salary hike than industry standards","","",""
"4.0","15 Mar 2021","Good","https://www.glassdoor.co.in/Reviews/Employee-Review-Tata-Power-RVW43994583.htm","Project engineer - electrical","Current employee, less than 1 year","Cochin","Exposure to large scale works.","Payment is low compared to other companies in the field","","",""
"5.0","16 May 2021","very good company","https://www.glassdoor.co.in/Reviews/Employee-Review-Tata-Power-RVW47000722.htm","Intenship","Former employee, less than 1 year","Mumbai","working culture is good ......we will get to learn more","its near city .....pollution is more","","",""
"5.0","23 May 2021","Lead associate","https://www.glassdoor.co.in/Reviews/Employee-Review-Tata-Power-RVW47354146.htm","Lead associate - marketing","Current employee, more than 1 year","Mumbai","Good work environment, Great culture, values and ethics","None. Tata is a great place to work at.","","",""
"5.0","25 Sept 2021","ELECTRICAL DISTRIBUTION ENGINEER","https://www.glassdoor.co.in/Reviews/Employee-Review-Tata-Power-RVW53096626.htm","Electrical distribution engineer","Current employee","Bhubaneshwar","Good to learn new thing, Opportunities to work with experienced person.","Two reporting managers create confusion.","","",""
"4.0","26 Oct 2021","Ok","https://www.glassdoor.co.in/Reviews/Employee-Review-Tata-Power-RVW54510415.htm","Lead engineer","Current employee, more than 10 years","","","","Job security and work life balnce","Politics, low pay and.perk and management pressure","Show more"
"3.0","22 Jul 2012","good company to start career","https://www.glassdoor.co.in/Reviews/Employee-Review-Tata-Power-RVW1759348.htm","Software engineer","Former employee, more than 1 year","Mumbai","","","lots of high technical stuff.","govt like working style and growth.","Show more"
"3.0","7 Jul 2013","Good","https://www.glassdoor.co.in/Reviews/Employee-Review-Tata-Power-RVW2798654.htm","Anonymous employee","Current employee","","","","Job Culture of Tatas need to like patent for others to follow.
Code of Conduct","Middle Management Handling the Company.","Show more"
"4.0","25 Aug 2019","Lead Electrical Engineer","https://www.glassdoor.co.in/Reviews/Employee-Review-Tata-Power-RVW28837675.htm","Lead electrical engineer","Current employee, more than 1 year","Ajmer","Good ethical and profetional environment","less increment provided and poor financial condition","","",""
"5.0","3 Oct 2019","Safety purpose","https://www.glassdoor.co.in/Reviews/Employee-Review-Tata-Power-RVW29595583.htm","Safety officer","Former employee, more than 3 years","Mundra, Gujarat","Awesome distribution of trainings for workers.","Management slow during shutdown duration.","","",""
"3.0","17 Feb 2020","work at tatapower","https://www.glassdoor.co.in/Reviews/Employee-Review-Tata-Power-RVW31908821.htm","Lead engineer","Current employee, more than 1 year","Mumbai","","","foe setlment this company is good
give too many facilities","career growth is very slow
management is not good","Show more"
"5.0","4 Jul 2020","Awesome experience","https://www.glassdoor.co.in/Reviews/Employee-Review-Tata-Power-RVW34051623.htm","Human resources manager","Current employee","","","","Good ethics, employee friendly , very helping","No cons awesome company to work with","Show more"
"4.0","18 Jan 2021","Good ethical workplace","https://www.glassdoor.co.in/Reviews/Employee-Review-Tata-Power-RVW40933313.htm","Anonymous employee","Current employee","","Good facilities, decent salary, good work life balance","No transparency in job location postings, low growth","","",""
"3.0","4 Apr 2021","stagnant career","https://www.glassdoor.co.in/Reviews/Employee-Review-Tata-Power-RVW44995879.htm","Business development manager","Current employee, more than 1 year","Mumbai","nothing as such better life work balance thats it","A lot of it career damping is one major","","",""
"4.0","3 Jun 2021","Low salary according to experience","https://www.glassdoor.co.in/Reviews/Employee-Review-Tata-Power-RVW47851522.htm","Lead engineer - billing","Current employee, less than 1 year","","Good employee safety balanced work life","Low salary, sluggish growth, less in hand salary","","",""
"4.0","18 Jul 2021","Less in hand salary","https://www.glassdoor.co.in/Reviews/Employee-Review-Tata-Power-RVW49919848.htm","Lead engineer","Current employee, more than 3 years","Mumbai","Hidden perks are available which helps","Less in fixed income earned","","",""
"4.0","25 Dec 2021","Support staff and much more to learn","https://www.glassdoor.co.in/Reviews/Employee-Review-Tata-Power-RVW57071870.htm","Lead engineer","Current employee, less than 1 year","","Good work culture , Supportive staff,","Not found anything yet to share","","",""
"3.0","15 Sept 2015","Tata Power review","https://www.glassdoor.co.in/Reviews/Employee-Review-Tata-Power-RVW7952414.htm","Anonymous employee","Former employee, more than 3 years","","","","Less workload in tpcl company","Less career growth in tpcl","Show more"
"5.0","5 May 2018","Admin","https://www.glassdoor.co.in/Reviews/Employee-Review-Tata-Power-RVW20445188.htm","Administrative assistant","Current employee, more than 3 years","Jāmnagar","","","Good work culture and support staff","Long hour to work to 15 to 16 hour","Show more"
"5.0","7 May 2018","good work culture.","https://www.glassdoor.co.in/Reviews/Employee-Review-Tata-Power-RVW20464436.htm","Anonymous employee","Current employee, more than 8 years","","","","good work culture and work life balance.","no major cones know to me","Show more"
"4.0","30 May 2018","Manager","https://www.glassdoor.co.in/Reviews/Employee-Review-Tata-Power-RVW20812139.htm","Anonymous employee","Former employee, more than 3 years","Mumbai","Good benefits. Work- life balance  for people in most functions.","Management communication is contradictory many times.","","",""
"5.0","19 Aug 2018","Group Head","https://www.glassdoor.co.in/Reviews/Employee-Review-Tata-Power-RVW22045009.htm","Group head","Current employee, more than 10 years","Purbi Singhbhum","","","Good Company to work and perform","There are no prons at this company","Show more"
"3.0","16 Jan 2019","ok ok in terms of learning","https://www.glassdoor.co.in/Reviews/Employee-Review-Tata-Power-RVW24248235.htm","Anonymous employee","Former employee, less than 1 year","Trombay","","","you will get maximum learning experience","no cons to the amangement","Show more"
"5.0","19 Sept 2019","Good","https://www.glassdoor.co.in/Reviews/Employee-Review-Tata-Power-RVW29327596.htm","Anonymous employee","Current employee","","","","Good Ethical equal opportunity for all","Good company to work with","Show more"
"3.0","8 Nov 2019","Lead","https://www.glassdoor.co.in/Reviews/Employee-Review-Tata-Power-RVW30283704.htm","Anonymous employee","Current employee, more than 5 years","","Great work culture, process driven organization, ethical model, supportive.","Power sector in transition and turbulent markets, moderate pay","","",""
"5.0","24 Jan 2020","Company Review","https://www.glassdoor.co.in/Reviews/Employee-Review-Tata-Power-RVW31485641.htm","Anonymous employee","Current employee","","The company has a very good work culture.","Job location might be at Remote Location.","","",""
"4.0","11 Mar 2020","Looking after Electrical Maintenance & SAP PM","https://www.glassdoor.co.in/Reviews/Employee-Review-Tata-Power-RVW32314049.htm","Anonymous employee","Current employee, more than 8 years","Jamshedpur","Good work culture,Care for women,Safety","Less increment,Monotonous job,Less fun at work","","",""
"5.0","17 Apr 2020","Work life Balance","https://www.glassdoor.co.in/Reviews/Employee-Review-Tata-Power-RVW32766309.htm","Lead","Current employee, more than 8 years","Mumbai","","","Ethical
Safety
Transparent Communication
Lot to learn
Exposure to different functions","Salary is less according to market standards","Show more"
"4.0","7 Feb 2021","Good workplace","https://www.glassdoor.co.in/Reviews/Employee-Review-Tata-Power-RVW42111056.htm","Anonymous employee","Current employee","","Quality of work, Benefits and Care","Slight old world mindset will take time to go away","","",""
"3.0","25 Feb 2021","Okayish company","https://www.glassdoor.co.in/Reviews/Employee-Review-Tata-Power-RVW43128028.htm","Engineer","Former employee","Mumbai","","","Tata culture is the only good thing","Low pay
Long working hours
HR is incompetent","Show more"
"4.0","12 Apr 2021","Good","https://www.glassdoor.co.in/Reviews/Employee-Review-Tata-Power-RVW45366341.htm","Sales manager","Current employee, more than 3 years","New Delhi","","","Good company for opportunities for growth","No cons Except a little hectic","Show more"
"4.0","12 May 2021","Good","https://www.glassdoor.co.in/Reviews/Employee-Review-Tata-Power-RVW46830124.htm","Dy manager","Former employee, more than 5 years","","Work culture is very good and excellent","Growth is a challenge. Due to less presence in india.","","",""
"5.0","20 Oct 2021","Good work","https://www.glassdoor.co.in/Reviews/Employee-Review-Tata-Power-RVW54244457.htm","Ui\ux designer","Current employee","","Good and ethical working condition. Good Pay and respect","Not a very big design team.","","",""
"4.0","22 Dec 2013","Good Company in Long Run","https://www.glassdoor.co.in/Reviews/Employee-Review-Tata-Power-RVW3448140.htm","Assistant manager","Former employee, more than 5 years","New Delhi","","","Good Work Life Balance
Better Place to Work","Slow and Steady Growth
Less Salaries","Show more"
"5.0","3 Sept 2015","Asset manager","https://www.glassdoor.co.in/Reviews/Employee-Review-Tata-Power-RVW7830729.htm","Asset manager","Former employee","Mumbai","strict followers of ethics, safety, long history","time taken for decisions are too long,","","",""
"4.0","18 Aug 2018","Job with stability","https://www.glassdoor.co.in/Reviews/Employee-Review-Tata-Power-RVW22031025.htm","Lead engineer","Current employee, more than 5 years","Mumbai","","","Stability in job good work culture","Salary not par with industry standards","Show more"
"4.0","21 Sept 2018","Tata power","https://www.glassdoor.co.in/Reviews/Employee-Review-Tata-Power-RVW22592732.htm","Dr executive","Former employee, more than 1 year","New Delhi","","","Less work load, work culture","Growth is slow, hard location","Show more"
"4.0","18 Oct 2018","good company","https://www.glassdoor.co.in/Reviews/Employee-Review-Tata-Power-RVW23009207.htm","Anonymous employee","Current employee, less than 1 year","Mumbai","","","good working environment ,Good people,","increment Percentage are very less","Show more"
"4.0","18 Dec 2018","Good organisation","https://www.glassdoor.co.in/Reviews/Employee-Review-Tata-Power-RVW23888941.htm","Group head recruitment","Former employee, more than 3 years","Mumbai","","","Caring & nurturing. Work life balance.","Less growth prospects. Adverse to change.","Show more"
"5.0","31 Mar 2019","Nice place to work and grow","https://www.glassdoor.co.in/Reviews/Employee-Review-Tata-Power-RVW25441622.htm","Senior manager","Current employee","","","","Challenging jobs
Nurturing Environment
Work Life Balance","Slow Promotion
Decision Making Process Slow","Show more"
"5.0","10 Jun 2019","Work","https://www.glassdoor.co.in/Reviews/Employee-Review-Tata-Power-RVW26564845.htm","Anonymous employee","Current employee","","","","Work Culture
Work Life Balance
Facilities
Ethical Nature","I can't find any problem expect a slow growth rate.","Show more"
"5.0","26 Jul 2019","Mechanical Engineer","https://www.glassdoor.co.in/Reviews/Employee-Review-Tata-Power-RVW28272948.htm","Mechanical engineer","Former employee, more than 1 year","Indore","","","International company and india largest business","I am large challenges in office work.","Show more"
"5.0","11 Sept 2019","Excellent work culture","https://www.glassdoor.co.in/Reviews/Employee-Review-Tata-Power-RVW29161769.htm","Operations engineer","Former employee, more than 1 year","Mumbai","People are very nice and accommodative.","The growth rate at company is low.","","",""
"4.0","24 Feb 2020","Computer science grad @ Tata Power","https://www.glassdoor.co.in/Reviews/Employee-Review-Tata-Power-RVW32036555.htm","Graduate engineer trainee","Current employee","","Flexible work hours, good HR.","Lack of growth in the organisation.","","",""
"4.0","27 May 2020","Employee friendly","https://www.glassdoor.co.in/Reviews/Employee-Review-Tata-Power-RVW33377920.htm","Lead engineer","Current employee","Mundra, Gujarat","","","Good work life balance
Minimum work pressure
Excellent job security","Salary structure imbalance on different level
Learning limited","Show more"
"5.0","1 Oct 2020","Best of All","https://www.glassdoor.co.in/Reviews/Employee-Review-Tata-Power-RVW36596120.htm","Manager","Former employee","","","","Best of all. Opportunities and opportunities","No cons were observed during tenure.","Show more"
"3.0","29 Dec 2020","Okay","https://www.glassdoor.co.in/Reviews/Employee-Review-Tata-Power-RVW39888962.htm","Assistant officer trainee","Current employee, less than 1 year","New Delhi","","","Leaves and atmosphere are good.","Salary should be a little better","Show more"
"4.0","16 Jan 2021","Company culture good","https://www.glassdoor.co.in/Reviews/Employee-Review-Tata-Power-RVW40853340.htm","Anonymous employee","Former employee, more than 3 years","","Grt place to work, helpful peers, good learning","Slower growth and lot of bureaucracy","","",""
"5.0","3 Mar 2021","Good Company","https://www.glassdoor.co.in/Reviews/Employee-Review-Tata-Power-RVW43402163.htm","Anonymous employee","Current employee, more than 3 years","","Awesome Tata Culture,Safety,women security they provide.They care for employees.","Etherything is good only...No cons","","",""
"5.0","8 Apr 2021","Great Place to Work","https://www.glassdoor.co.in/Reviews/Employee-Review-Tata-Power-RVW45201129.htm","Anonymous employee","Former employee","","Great Leadership with great vision","Its a very good place to work.","","",""
"5.0","18 May 2021","Best","https://www.glassdoor.co.in/Reviews/Employee-Review-Tata-Power-RVW47094199.htm","Electrical engineering","Current employee","Bhubaneshwar","TATA POWER is a best company in India","Good salary scale. best environment for learning.","","",""
"4.0","12 Jun 2021","Work Life balance","https://www.glassdoor.co.in/Reviews/Employee-Review-Tata-Power-RVW48245977.htm","Sap basis consultant","Current employee","Noida","Employee oriented company, Good HR Policies, Good Business Model","Environment is not so good","","",""
"3.0","15 Jul 2021","Overall had a good experience","https://www.glassdoor.co.in/Reviews/Employee-Review-Tata-Power-RVW49844475.htm","Lead engineer","Former employee, more than 1 year","","work life balance , good township","remote locations , less salary & growth","","",""
"4.0","20 Nov 2021","People centric and process driven","https://www.glassdoor.co.in/Reviews/Employee-Review-Tata-Power-RVW55636361.htm","Assistant manager","Former employee, more than 5 years","Noida","Great learning opportunities across all domains","No cons as such . .","","",""
"5.0","15 Dec 2021","Good overall experience","https://www.glassdoor.co.in/Reviews/Employee-Review-Tata-Power-RVW56707532.htm","Engineering manager","Current employee, more than 1 year","Bengaluru","","","Ethical, No termination, Good exposure, Good HR policies.","Employee grade
Grade wise salary
Higher Mpanagement","Show more"
"4.0","31 Jul 2014","Good","https://www.glassdoor.co.in/Reviews/Employee-Review-Tata-Power-RVW4687906.htm","Executive engineer","Current employee, more than 3 years","New Delhi","","","Stable, good culture, work life balance","public dealing, Low or OK salary,","Show more"
"5.0","14 Dec 2013","very good","https://www.glassdoor.co.in/Reviews/Employee-Review-Tata-Power-RVW3422338.htm","Anonymous employee","Current employee","","safe job with full of enriching development","not a better place for innovation","","",""
"4.0","18 Sept 2015","Executive","https://www.glassdoor.co.in/Reviews/Employee-Review-Tata-Power-RVW7994866.htm","Executive","Current employee, more than 3 years","New Delhi","","","Cool Life
Proper developed Process
Highly Qualified and Experienced Colleagues","Less Growth Opportunity
Average Compensation than Similar MNCs","Show more"
"3.0","3 Jan 2017","Tata power","https://www.glassdoor.co.in/Reviews/Employee-Review-Tata-Power-RVW13173719.htm","Anonymous employee","Current employee, less than 1 year","Mumbai","","","Good senior management
Good learning opportunity","Slow career growth
low salaries
Less transfers","Show more"
"4.0","10 Jan 2017","Good working place","https://www.glassdoor.co.in/Reviews/Employee-Review-Tata-Power-RVW13268493.htm","Business human resources","Former employee","Mumbai","Good Learning opportunities, Good Team","Lesser Increments, Need improvements in the appraisal process","","",""
"3.0","11 Sept 2017","Culture, Ethics","https://www.glassdoor.co.in/Reviews/Employee-Review-Tata-Power-RVW16761090.htm","Anonymous employee","Current employee","","Excellent culture and ethics. Work life balance","Job execution could be improved","","",""
"3.0","23 Oct 2017","Good but stagnant","https://www.glassdoor.co.in/Reviews/Employee-Review-Tata-Power-RVW17515734.htm","Anonymous employee","Current employee","","Good ,less working hours , less work pressure","Not very competitive ,stagnant, less salary","","",""
"4.0","22 Nov 2017","Excellent Company to work for","https://www.glassdoor.co.in/Reviews/Employee-Review-Tata-Power-RVW18019699.htm","Anonymous employee","Current employee","","Great teams, amazing processes, agile employees","More of lateral thinking required","","",""
"4.0","21 Mar 2018","Assistant Manager Instrumentation","https://www.glassdoor.co.in/Reviews/Employee-Review-Tata-Power-RVW19809134.htm","Anonymous employee","Former employee","","Great Work Culture Learning Curve Ethics","Salary is low , locations are odd","","",""
"4.0","9 May 2018","employee friendly company","https://www.glassdoor.co.in/Reviews/Employee-Review-Tata-Power-RVW20504399.htm","Anonymous employee","Former employee","","","","employee friendly and good culture","slow moving and less increments","Show more"
"2.0","8 Mar 2019","senior executive","https://www.glassdoor.co.in/Reviews/Employee-Review-Tata-Power-RVW25060540.htm","Senior executive","Current employee","North West","","","new technology, opportunity to learn","no professionalism,     no flexibility","Show more"
"4.0","2 May 2019","Good Company to work...","https://www.glassdoor.co.in/Reviews/Employee-Review-Tata-Power-RVW25945680.htm","Anonymous employee","Current employee, more than 5 years","","work life balance is good","Nothing much to discuss  about cons","","",""
"4.0","15 Aug 2020","NA","https://www.glassdoor.co.in/Reviews/Employee-Review-Tata-Power-RVW34938908.htm","It shared services","Current employee","Mumbai","Lots of opportunities to learn","No growth within the organization for persons having IT skills","","",""
"4.0","14 Sept 2020","Good","https://www.glassdoor.co.in/Reviews/Employee-Review-Tata-Power-RVW35920096.htm","Project manager","Current employee","","","","Job security 
Benefits
Seniors are supportive","Slow organization , salary structure and less increments and promotions","Show more"
"5.0","6 Feb 2021","Good Company","https://www.glassdoor.co.in/Reviews/Employee-Review-Tata-Power-RVW42059133.htm","Manager","Current employee, more than 10 years","New Delhi","Policy, Employee benefits and work culture","Decision Making, Pay hikes and job rotation","","",""
"5.0","15 Feb 2021","Okay","https://www.glassdoor.co.in/Reviews/Employee-Review-Tata-Power-RVW42501758.htm","Technical service associate","Current employee, more than 3 years","Surat","Good culture,bad management, need support from management","Join and leave after one two years","","",""
"4.0","25 Feb 2021","Good company","https://www.glassdoor.co.in/Reviews/Employee-Review-Tata-Power-RVW43129174.htm","Anonymous employee","Current employee","","Good progress and good learning","Less salary and HR is not upto the mark","","",""
"3.0","21 Apr 2021","It good company","https://www.glassdoor.co.in/Reviews/Employee-Review-Tata-Power-RVW45840349.htm","Manager","Current employee, more than 5 years","Mumbai","","","Work life balance to work in organisation","Not good for long term","Show more"
"4.0","19 May 2021","Good place to work","https://www.glassdoor.co.in/Reviews/Employee-Review-Tata-Power-RVW47155851.htm","Project manager","Former employee, more than 1 year","Mumbai","Good people , accommodation support, medical facility","Career development opportunities are limited.","","",""
"5.0","25 Jun 2021","Good","https://www.glassdoor.co.in/Reviews/Employee-Review-Tata-Power-RVW48851385.htm","Anonymous employee","Current employee","","Good, nice, brilliant, fantastic, tremendous","Bad, not nice, not good, not fantastic, not tremendous","","",""
"4.0","8 Jul 2021","Good place to work","https://www.glassdoor.co.in/Reviews/Employee-Review-Tata-Power-RVW49518993.htm","Anonymous employee","Current employee, more than 8 years","","Lots of opportunities, flat structure, colloborative environment","Slow promotions, below market pay","","",""
"4.0","20 Jul 2021","Tata power","https://www.glassdoor.co.in/Reviews/Employee-Review-Tata-Power-RVW50009578.htm","Graduate engineering trainee get","Current employee","Mumbai","Nothing nothing else matters of account very","Nothing's gonna be a good time to","","",""
"5.0","22 Aug 2021","Very good","https://www.glassdoor.co.in/Reviews/Employee-Review-Tata-Power-RVW51447153.htm","Engineer","Current employee","Mundra, Gujarat","","","Very good experience in professional career","No any cons in professional career","Show more"
"3.0","18 Sept 2021","Position","https://www.glassdoor.co.in/Reviews/Employee-Review-Tata-Power-RVW52742511.htm","Security lead","Current employee","Mundra, Gujarat","Satisfactory for survival who opt private job","Offers unsuitable position and growth is very very slow.","","",""
"3.0","11 Oct 2021","Low salary","https://www.glassdoor.co.in/Reviews/Employee-Review-Tata-Power-RVW53807014.htm","Graduate engineer trainee","Current employee, less than 1 year","Mumbai","","","Work life balance
Employee centric company","Low salary as per industry standards
No growth","Show more"
"5.0","7 Nov 2021","Good environment","https://www.glassdoor.co.in/Reviews/Employee-Review-Tata-Power-RVW55033744.htm","Anonymous employee","Current employee, more than 1 year","","Very supportive and positive work environment","Salary may be less compared to others","","",""
