"review-details_overallRating__VDxCx","timestamp_reviewDate__wvu2v","review-details_detailsLink__NxIv5","review-details_detailsLink__NxIv5 href","review-details_employee__5iA6v","review-details_employeeDetails__BvAwX","review-details_location__E_Ine","review-details_isExpanded__bLJng","review-details_isExpanded__bLJng 2","review-details_isCollapsed__Bsg_9","review-details_isCollapsed__Bsg_9 2","expand-button_ExpandButton__FlBlZ"
"4.0","11 Jan 2024","Good to work","https://www.glassdoor.co.in/Reviews/Employee-Review-Tata-Consumer-Products-RVW83290243.htm","Architect","Current employee, more than 3 years","Bangalore Rural","Good place to work on this org","i did not find any such issue","","",""
"5.0","6 Oct 2023","Internship Experience","https://www.glassdoor.co.in/Reviews/Employee-Review-Tata-Consumer-Products-RVW80716196.htm","Sales and marketing intern","Current intern, more than 1 year","","","","The internship experience at TCPL was very amazing. People at TCPL were very cooperative with us whenever we needed help with them in our projects. My manager and guide gave me enough flexibility to explore other domains and work on those projects, independently. I really liked the culture at TCPL and during my internship I got enough opportunity to connect with the leadership. There is a lot of opportunity for growth at TCPL","As such, there are no downsides.","Show more"
"3.0","3 Jan 2024","Good company","https://www.glassdoor.co.in/Reviews/Employee-Review-Tata-Consumer-Products-RVW83027334.htm","Business development manager","Current employee, less than 1 year","","","","Good company to work good facilities","Nothing bad in company just","Show more"
"3.0","17 Dec 2023","Decent Job for a Fresher","https://www.glassdoor.co.in/Reviews/Employee-Review-Tata-Consumer-Products-RVW82662703.htm","Gen ai engineer","Current employee, more than 1 year","Bengaluru","Multiple active projects which helps new developers to grow","Scope of promotion or benefits based on performance is low","","",""
"5.0","26 Nov 2023","Opportunity to learn and grow","https://www.glassdoor.co.in/Reviews/Employee-Review-Tata-Consumer-Products-RVW82106321.htm","Anonymous contractor","Current contractor, more than 1 year","","","","Ownership of projects assigned to you.
Your suggestions are taken into consideration
You feel heard and seen","Nothing. No downside associating with the company","Show more"
"3.0","2 Dec 2023","Working culture","https://www.glassdoor.co.in/Reviews/Employee-Review-Tata-Consumer-Products-RVW82266597.htm","Manager","Current employee","Chennai","","","Learning opportunities and travel and accommodation is good.","need to clarity job and responsibility","Show more"
"3.0","5 Dec 2023",".","https://www.glassdoor.co.in/Reviews/Employee-Review-Tata-Consumer-Products-RVW82327962.htm","Associate manager-procurement","Current employee, more than 1 year","Mumbai","really great place to work","very fast and unpredictable work environment","","",""
"5.0","18 Nov 2023","Amazing people to work with.","https://www.glassdoor.co.in/Reviews/Employee-Review-Tata-Consumer-Products-RVW81928801.htm","Anonymous intern","Former intern, less than 1 year","Mumbai","Autonomous culture, friendly environment, supportive team, flexibility","Lacking Accountability, Group-think, none, none","","",""
"4.0","4 Oct 2023","Amazing place to work at!","https://www.glassdoor.co.in/Reviews/Employee-Review-Tata-Consumer-Products-RVW80658111.htm","Research and development executive","Former employee, more than 1 year","Mumbai","","","It will certainly help you grow. It lets you totally take control of your projects and believes in a growth trajectory of both business and the individual.","There’s no downside to working at TCPL.","Show more"
"5.0","30 Oct 2023","TCPL","https://www.glassdoor.co.in/Reviews/Employee-Review-Tata-Consumer-Products-RVW81379525.htm","Finance intern","Current intern","Mumbai","Company has good work culture","So many verticals of products to work upon","","",""
"4.0","26 Sept 2023","Learning","https://www.glassdoor.co.in/Reviews/Employee-Review-Tata-Consumer-Products-RVW80421977.htm","Area sales executive","Current employee, more than 8 years","Calcutta","","","Great learning experience for an employee and top level managers always interact with all the subordinates","Working hour is stretched most of the days since high involvement is required in business on a daily basis.","Show more"
"5.0","9 Oct 2023","Salary of sales Trainee","https://www.glassdoor.co.in/Reviews/Employee-Review-Tata-Consumer-Products-RVW80779106.htm","Sales trainee","Current employee, less than 1 year","Durgapur, West Bengal","","","The Brand itself ""TATA"". Gives one time to learn.","Haven't found any yet. Work pressure is there in every company","Show more"
"3.0","12 Oct 2023","Overall fine","https://www.glassdoor.co.in/Reviews/Employee-Review-Tata-Consumer-Products-RVW80876402.htm","Associate manager","Former employee, more than 3 years","Bengaluru","The team is great. Learning opportunities are there.","Pay needs to be better specially for employees who have been loyal for a long time.","","",""
"3.0","8 Oct 2023","N/A","https://www.glassdoor.co.in/Reviews/Employee-Review-Tata-Consumer-Products-RVW80759487.htm","Senior executive","Former contractor","","Good Learning opportunities are provided","Extended working hours on a frequent basis","","",""
"4.0","6 Aug 2023","TCPL Family","https://www.glassdoor.co.in/Reviews/Employee-Review-Tata-Consumer-Products-RVW78910597.htm","Sourcing officer","Current employee, more than 5 years","Mumbai","","","Good employee welfare and working environment is good. Work Freedom.","I worked more than 7 years with Tata. I never seen any downsides.","Show more"
"4.0","13 Jul 2023","Summer Internship Experience","https://www.glassdoor.co.in/Reviews/Employee-Review-Tata-Consumer-Products-RVW78215195.htm","Summer intern","Current intern, less than 1 year","Mumbai","","","Company is high on implementation of the values they strive for. Evaluators understand case-to-case differences while performing evaluation. Very open culture, high on transparency","Internship structure could've been more compact so as to improve the depth of the final analysis","Show more"
"1.0","13 Jun 2023","Worst place to work","https://www.glassdoor.co.in/Reviews/Employee-Review-Tata-Consumer-Products-RVW77353708.htm","Associate director","Former employee, more than 1 year","Mumbai","","","None. You join assuming they're the 'Tata' company so there's a certain standard but you'll be disappointed in a month.","Micromanagement from leaders. Fear to do anything new. Doesn't let people with specialist roles do what they're hired for. Favoritism and partiality. For young people who have aspirations, this is the worst place to be. People will play politics and block you from growth. Lack of clarity on roles and company plans.","Show more"
"3.0","22 Aug 2023","Good Company","https://www.glassdoor.co.in/Reviews/Employee-Review-Tata-Consumer-Products-RVW79374988.htm","Product owner (po)","Current employee, more than 1 year","Bengaluru","","","Good Company to work with multiple oppurtunities","Culture is not that good","Show more"
"2.0","28 Jun 2023","You are not appreciated","https://www.glassdoor.co.in/Reviews/Employee-Review-Tata-Consumer-Products-RVW77813753.htm","Senior manager","Current employee","","","","It's a growing company so a lot of activity happening all the time","Almost no trickle down of the success of the company to employees. Top executives take massive pay raises and most employees don't even get inflation beating raises.","Show more"
"5.0","26 Jul 2023","Excellent place to work","https://www.glassdoor.co.in/Reviews/Employee-Review-Tata-Consumer-Products-RVW78612966.htm","Senior manager","Current employee","Bengaluru","Great place to work Good work life balance Ample opportunities","Agility in decisions at its peak","","",""
"5.0","25 Jul 2023","Work Culture","https://www.glassdoor.co.in/Reviews/Employee-Review-Tata-Consumer-Products-RVW78549601.htm","Assistant manager - hr","Current employee","","","","The culture is very good, employee-friendly. Good Leave policy","Compensation can be at par with the market standards.","Show more"
"4.0","11 Jul 2023","Great experience","https://www.glassdoor.co.in/Reviews/Employee-Review-Tata-Consumer-Products-RVW78143693.htm","Management trainee","Current employee, less than 1 year","Mumbai","","","Real world experiences with huge impact projects.","Since it's a huge company, one struggles to find the right people initially.","Show more"
"4.0","24 Jul 2023","Review","https://www.glassdoor.co.in/Reviews/Employee-Review-Tata-Consumer-Products-RVW78519600.htm","Senior software engineer","Current employee","Chennai","Ok good culture and facilities","More working hours need to look into it","","",""
"5.0","11 Jul 2023","Extremely Streamlined and efficient process.","https://www.glassdoor.co.in/Reviews/Employee-Review-Tata-Consumer-Products-RVW78151493.htm","Anonymous employee","Current employee","","The entire process of recruitment is extremely streamlined.","None that I can recall.","","",""
"5.0","15 May 2023","If you are an agile personality and want to work in great cultures, then TCPL is the only organisation","https://www.glassdoor.co.in/Reviews/Employee-Review-Tata-Consumer-Products-RVW76425887.htm","Sr. tse","Current employee, more than 1 year","New Delhi","","","1. Open environment 2. Lots of opportunity 3. Growing mindset 4. Great HR policies 5. Best salary structure","For me there are none.","Show more"
"5.0","30 Jun 2023","Good Company","https://www.glassdoor.co.in/Reviews/Employee-Review-Tata-Consumer-Products-RVW77854645.htm","Assistant manager","Current employee, more than 3 years","Gurgaon, Haryana","Good Culture and good company to work","Nothin bad about this company","","",""
"3.0","11 May 2023","Tata Products review","https://www.glassdoor.co.in/Reviews/Employee-Review-Tata-Consumer-Products-RVW76355119.htm","Territory sales executive","Current employee","","","","Launching New Innovative Products Giving Good incentives and benefits to Employees","One way communication from Management. Regularly changing policies regarding Channel partners, Which is creating distrust in Market.","Show more"
"4.0","27 May 2023","Overall good company to work with","https://www.glassdoor.co.in/Reviews/Employee-Review-Tata-Consumer-Products-RVW76832055.htm","Management trainee","Former employee, less than 1 year","Bengaluru","Good learning opportunity, good work culture and work life balance","slow growth, too much hierarchy in organisation","","",""
"2.0","16 Jun 2023","Salary","https://www.glassdoor.co.in/Reviews/Employee-Review-Tata-Consumer-Products-RVW77434619.htm","Executive","Current contractor, less than 1 year","Mumbai","Flexible working hours Work times Weekend off","Environment not that good Work","","",""
"4.0","1 Jun 2023","Professional Culture","https://www.glassdoor.co.in/Reviews/Employee-Review-Tata-Consumer-Products-RVW76979360.htm","Company secretary","Current employee","","Big brand, professional and ethical culture","Growth opportunity, remuneration, lack of opportunity to get into adjacent roles,","","",""
"5.0","15 Mar 2023","A Great Place to Learn & Grow","https://www.glassdoor.co.in/Reviews/Employee-Review-Tata-Consumer-Products-RVW74564717.htm","Senior manager","Current employee, more than 3 years","","","","- Great culture and camaraderie - Strong execution focus and practical ways of working - Focus on building internal talent - Robust future plans","- High quantum of work - Limited budgets - Stretch timelines","Show more"
"5.0","17 May 2023","Best place to start your career.","https://www.glassdoor.co.in/Reviews/Employee-Review-Tata-Consumer-Products-RVW76514743.htm","Hr intern","Current intern, less than 1 year","Mumbai","Free communication, freedom to take decisions, supportive environment and exciting projects.","Everything is fine no cons as such.","","",""
"5.0","23 Mar 2023","Smooth Interview process","https://www.glassdoor.co.in/Reviews/Employee-Review-Tata-Consumer-Products-RVW74796178.htm","Internship","Current intern, less than 1 year","","","","My internship selection process with TCPL was extremely smooth. The panel was humble and motivating and guided me during the entire process. I am highly grateful to be a part of the organization and look forward to working with the team.","The company does not really have a downside.","Show more"
"5.0","25 Nov 2022","TCPL - Care for Culture","https://www.glassdoor.co.in/Reviews/Employee-Review-Tata-Consumer-Products-RVW71394071.htm","Senior area sales manager","Current employee, more than 3 years","Calcutta","","","Rich Culture, Brands, Policies, Consumer trust, Market share & Freedom of Taking initiatives.","Ignorance of some range of products, Strategically Media coverage on few brands/products only, Lack of Advance system and processes, Silent New Launches, more initiative require on specific states to improve Market Share of Tea.","Show more"
"5.0","22 Mar 2023","Review about the interview process","https://www.glassdoor.co.in/Reviews/Employee-Review-Tata-Consumer-Products-RVW74794613.htm","Sales and marketing intern","Current intern, less than 1 year","Mumbai","","","My interview at TCPL was one of the best interviews ever. It was a proper mix of both technical and non-technical, testing our calibre and our mindset towards work.","There are no cons as such","Show more"
"5.0","7 Apr 2023","Employee Friendly, very fair and well structured selection process","https://www.glassdoor.co.in/Reviews/Employee-Review-Tata-Consumer-Products-RVW75300931.htm","Emerging leaders program: operations","Current intern, less than 1 year","Bengaluru","","","Well structured job role and deliverables, employee friendly culture with a positive employer brand image. There are ample opportunities for growth.","Only Pros. No cons identified","Show more"
"5.0","27 Apr 2023","Worth to work","https://www.glassdoor.co.in/Reviews/Employee-Review-Tata-Consumer-Products-RVW75917846.htm","Manager","Current employee, more than 3 years","Bengaluru","Good place to work, good culture","You will get growth in your professional life","","",""
"4.0","13 Feb 2023","Very good growth oriented multi products organisation","https://www.glassdoor.co.in/Reviews/Employee-Review-Tata-Consumer-Products-RVW73569176.htm","Asm (area sales manager)","Current employee, more than 10 years","","","","Very pront HR , lots of learning , digitlisation and transformation are two important things which any one can learnt here .","Work life balance may be a challenge","Show more"
"3.0","3 May 2023","Good","https://www.glassdoor.co.in/Reviews/Employee-Review-Tata-Consumer-Products-RVW76075091.htm","Sales officer","Current employee","Bangalore Rural","Good company to work and","Worst manager in bangalore and","","",""
"5.0","24 Mar 2023","Intern at Tata Consumer Products Limited","https://www.glassdoor.co.in/Reviews/Employee-Review-Tata-Consumer-Products-RVW74862796.htm","Intern","Current intern, less than 1 year","Bengaluru","","","Budding company in FMCG domain, innovation, good work and job culture, good environment, excellent opportunities","Not much to be honest","Show more"
"5.0","15 Mar 2023","Best companies to work for","https://www.glassdoor.co.in/Reviews/Employee-Review-Tata-Consumer-Products-RVW74567606.htm","Internship","Current temporary employee","","Best Work Culture Supportive Peers Work-Life Balance","None as such but the job sometimes might requires putting in extra time and effort.","","",""
"5.0","23 Mar 2023","Reviewing interview process","https://www.glassdoor.co.in/Reviews/Employee-Review-Tata-Consumer-Products-RVW74807885.htm","Sales and marketing","Current intern, less than 1 year","","Great interactive experience so far","Would like to have more informative and engaging sessions which can help in skill building","","",""
"2.0","13 Apr 2023","No worklife balance","https://www.glassdoor.co.in/Reviews/Employee-Review-Tata-Consumer-Products-RVW75450235.htm","Asst officer","Current employee","Bidadi","Brand value of tata is good","Long working hours Poor management","","",""
"5.0","15 Mar 2023","Great culture with flexible working hours","https://www.glassdoor.co.in/Reviews/Employee-Review-Tata-Consumer-Products-RVW74531115.htm","Hr-intern","Current intern, less than 1 year","Mumbai","The people are super helpful and welcoming. Flexible working hours. Open and clear communication.","None that I can think of.","","",""
"4.0","14 Mar 2023","Response Sales and marketing team work","https://www.glassdoor.co.in/Reviews/Employee-Review-Tata-Consumer-Products-RVW74487848.htm","Senior manager","Current employee, less than 1 year","North","","","Teams handling with motivation new product launch","No support senior parson parson","Show more"
"5.0","22 Mar 2023","Sales Intern","https://www.glassdoor.co.in/Reviews/Employee-Review-Tata-Consumer-Products-RVW74794518.htm","Summer elp intern","Current intern, less than 1 year","Mumbai","Great work culture at TCPL","There are no Cons of working at TCPL","","",""
"2.0","6 Mar 2023","Salary expectations","https://www.glassdoor.co.in/Reviews/Employee-Review-Tata-Consumer-Products-RVW74228962.htm","Territory sales representative","Former employee, more than 1 year","New Delhi","","","FMCG experience adds a lot more to your CV","The toxic work culture and working environment","Show more"
"5.0","22 Mar 2023","Work Culture","https://www.glassdoor.co.in/Reviews/Employee-Review-Tata-Consumer-Products-RVW74793998.htm","Sales and marketing intern","Current intern, less than 1 year","","Great work culture, supportive colleagues.","No cons as such for cons","","",""
"4.0","17 Feb 2023","Good Tata culture","https://www.glassdoor.co.in/Reviews/Employee-Review-Tata-Consumer-Products-RVW73720337.htm","Associate director of operations","Former employee, more than 10 years","Bengaluru","","","Good working environment. Nice people policies. Learning culture encouraged. Good medical insurance cover","Company is becoming very cost competitive. Removing older employees regularly","Show more"
"4.0","16 Mar 2023","NA","https://www.glassdoor.co.in/Reviews/Employee-Review-Tata-Consumer-Products-RVW74570824.htm","Assistant manager","Current employee, more than 1 year","New Delhi","","","Supportive team members & seniors.","Scope is there to improve policies.","Show more"
"5.0","15 Feb 2023","Great enviroment for work","https://www.glassdoor.co.in/Reviews/Employee-Review-Tata-Consumer-Products-RVW73655505.htm","Officer","Current employee, more than 5 years","","Company recognize the talent and appriciate, and also provide opportunities to grow and learn","Nothing to say, everything is good","","",""
"4.0","24 Nov 2022","good place to learn and grow","https://www.glassdoor.co.in/Reviews/Employee-Review-Tata-Consumer-Products-RVW71374299.htm","Anonymous employee","Former employee, less than 1 year","Andheri East","","","Good People Flexi Culture Good Growth prospects Dynamic environment - lots to learn","They are yet building, so protocols are a bit out of place","Show more"
"5.0","6 Jan 2023","Great Organization to work for","https://www.glassdoor.co.in/Reviews/Employee-Review-Tata-Consumer-Products-RVW72372032.htm","Associate manager","Current employee, less than 1 year","Mumbai","","","- Employee friendly policies (ex : flex working hours, unlimited sick leave etc) - Transparent management -Fair treatment towards all employees","No cons as of now ..","Show more"
"5.0","3 Jan 2023","Culture","https://www.glassdoor.co.in/Reviews/Employee-Review-Tata-Consumer-Products-RVW72298971.htm","Anonymous intern","Former intern, less than 1 year","Mumbai","","","There is a culture of openess in tcpl. I had a great learning experience since the team was supportive amd helpful. I recommend tcpl as a good place to learn and grow.","No first hand experience of concerns.","Show more"
"5.0","5 Jan 2023","One of the leading organisation in F&B space","https://www.glassdoor.co.in/Reviews/Employee-Review-Tata-Consumer-Products-RVW72368444.htm","Associate manager human resources","Current employee, less than 1 year","Mumbai","Cultural excellence organization, high on value system","No cons to work with highly engaging organization. It gives lot of opportunity for an employee to grow.","","",""
"5.0","1 Feb 2023","Amazing","https://www.glassdoor.co.in/Reviews/Employee-Review-Tata-Consumer-Products-RVW73209544.htm","Associate manager","Current employee, more than 3 years","Bengaluru","Growth and learning along with work life balance","Does not take for offsite","","",""
"5.0","23 Jan 2023","Great Company","https://www.glassdoor.co.in/Reviews/Employee-Review-Tata-Consumer-Products-RVW72899517.htm","Senior brand manager","Current employee, more than 5 years","Bangalore Rural","Great work..maximum learning..apetite to take risks","Poor work life balance...projects needs lot of alignment","","",""
"5.0","3 Jan 2023","A great learning experience","https://www.glassdoor.co.in/Reviews/Employee-Review-Tata-Consumer-Products-RVW72299217.htm","Intern","Former intern, less than 1 year","Mumbai","Privilege to work at such a prestigious organization and learn about the organization and work","The short period of internship","","",""
"5.0","25 Nov 2022","Best Organization","https://www.glassdoor.co.in/Reviews/Employee-Review-Tata-Consumer-Products-RVW71376348.htm","Management trainee","Current employee, less than 1 year","Mumbai","","","Really good Organization to work with. Warm hearted people. Work life balance is good. Trainings are effective and Admin Team puts in lot of effort to arrange events.","Not Applicable (No Suggestions as of now)","Show more"
"4.0","17 Jan 2023","Good","https://www.glassdoor.co.in/Reviews/Employee-Review-Tata-Consumer-Products-RVW72700187.htm","Territory sales manager","Current employee, more than 1 year","","Good to workin the company","Update the system with the new tech","","",""
"3.0","11 Jan 2023","Place of Work","https://www.glassdoor.co.in/Reviews/Employee-Review-Tata-Consumer-Products-RVW72548828.htm","Associate director","Current employee, more than 10 years","","","","Great Vision on the Digital transformation","Only Digital and no one else.","Show more"
"5.0","3 Jan 2023","TCPL review","https://www.glassdoor.co.in/Reviews/Employee-Review-Tata-Consumer-Products-RVW72300318.htm","Learning and development consultant","Current contractor, less than 1 year","Mumbai","Flexible timing, culture, learning opportunities","No con as of yet","","",""
"5.0","10 Dec 2022","Data Analyst Intern Review","https://www.glassdoor.co.in/Reviews/Employee-Review-Tata-Consumer-Products-RVW71765802.htm","Data analyst intern","Former intern, less than 1 year","Bengaluru","","","Good Culture Good Work Good Teams and learning","Few additional benefits for employees","Show more"
"3.0","17 Nov 2022","Confused company","https://www.glassdoor.co.in/Reviews/Employee-Review-Tata-Consumer-Products-RVW71165259.htm","Operations manager","Former employee, more than 8 years","Bengaluru","Good culture till 2018 , good work life balance, nice people","Since 2019 typical fmcg culture , no team work , the old Tata ethics and culture not prevalent","","",""
"5.0","25 Nov 2022","Great place to work","https://www.glassdoor.co.in/Reviews/Employee-Review-Tata-Consumer-Products-RVW71377891.htm","Hr- management trainee","Current employee, less than 1 year","Bengaluru","Work life balance job security Pays and benefits are great Culture Management","1 - None 2 - Too many verticals","","",""
"3.0","4 Nov 2022","Changes Management","https://www.glassdoor.co.in/Reviews/Employee-Review-Tata-Consumer-Products-RVW70787144.htm","Business finance manager","Former employee, more than 1 year","Lucknow","","","An normal Tata company to work.","Too much politics, No value ro experience since we went from Tata Chemicals due to merger of fmcg business","Show more"
"5.0","18 Apr 2022","Innovative work culture and a great place to learn","https://www.glassdoor.co.in/Reviews/Employee-Review-Tata-Consumer-Products-RVW62948972.htm","Internal audit","Current employee, more than 1 year","Bengaluru","","","Extremely happy to work in an award winning team

 - Team is very collaborative and open to ideas from all employees regardless of their position in the organization. 

- IA Audit Head drives innovative ideas and approach due to which the team is able to quickly adopt new technologies 

- Senior management team is readily available to help employees grow in the organization. Managers are readily available for mentorship for both current and former employees","Bureaucracy and discouragement in the middle level manager in IA Risk which was immediately addressed by the IA lead but not supported by the other admin functions. Other teams are less collaborative.","Show more"
"3.0","19 Nov 2022","Good place to work","https://www.glassdoor.co.in/Reviews/Employee-Review-Tata-Consumer-Products-RVW71225843.htm","Manager","Former employee","","Brand name Work ethics Empowerment HR policies","No work life balance Decision making is slow","","",""
"4.0","1 Nov 2022","Territory Sales Executive","https://www.glassdoor.co.in/Reviews/Employee-Review-Tata-Consumer-Products-RVW70667313.htm","Territory sales executive","Current employee","","1) Work Personal Life Balance 2) Market Respect 3) Working Ethics","1) Lots of Politics 2) Partiality","","",""
"5.0","28 Oct 2022","Best","https://www.glassdoor.co.in/Reviews/Employee-Review-Tata-Consumer-Products-RVW70601550.htm","Tse ii","Current employee, more than 1 year","Mumbai","Good salary with a good company","Working culture is not so good","","",""
