"review-details_overallRating__VDxCx","timestamp_reviewDate__wvu2v","review-details_detailsLink__NxIv5","review-details_detailsLink__NxIv5 href","review-details_employee__5iA6v","review-details_employeeDetails__BvAwX","review-details_location__E_Ine","review-details_isExpanded__bLJng","review-details_isExpanded__bLJng 2","review-details_isCollapsed__Bsg_9","review-details_isCollapsed__Bsg_9 2","expand-button_ExpandButton__FlBlZ"
"4.0","13 Oct 2022","Good Place to Learn and Earn","https://www.glassdoor.co.in/Reviews/Employee-Review-Tata-Consumer-Products-RVW70116678.htm","Teritory sales executive","Current employee, more than 1 year","Grant No 11","","","Most of the things are good in this company. You have friendly environment.","Sometimes business number become stressful.","Show more"
"5.0","27 Oct 2022","Superb","https://www.glassdoor.co.in/Reviews/Employee-Review-Tata-Consumer-Products-RVW70541223.htm","Regional sales manager","Current employee, more than 3 years","","","","Superb company, with work ethic","No cons seems to be yet","Show more"
"5.0","23 Aug 2022","The finest FMCG companies to start your career","https://www.glassdoor.co.in/Reviews/Employee-Review-Tata-Consumer-Products-RVW68227490.htm","Management trainee","Current employee, less than 1 year","","","","- Ample creative freedom
- Unparalleled learning experience
- Highly experienced industry leaders
- aggressive growth plan
- Ethical and very good work culture","No cons as such. If you are looking to work in FMCG industry this is the place.","Show more"
"5.0","26 Oct 2022","Good Place to work","https://www.glassdoor.co.in/Reviews/Employee-Review-Tata-Consumer-Products-RVW70505636.htm","Manager","Current employee","","Aggressive company. Good working environment","Takes some times to get approval","","",""
"5.0","20 Oct 2022","Great place to work","https://www.glassdoor.co.in/Reviews/Employee-Review-Tata-Consumer-Products-RVW70342845.htm","Logistics manager","Current employee, more than 3 years","Bengaluru","Supporting staff Flexi timing on time salary","No such everything is in place","","",""
"5.0","5 Oct 2022","Great place to work with manable work life balance","https://www.glassdoor.co.in/Reviews/Employee-Review-Tata-Consumer-Products-RVW69822759.htm","Anonymous contractor","Current contractor, less than 1 year","Mumbai","Excellent work culture, lot of learning opportunities.","nothing as such as of now","","",""
"4.0","5 Oct 2022","Growth Driven Organization","https://www.glassdoor.co.in/Reviews/Employee-Review-Tata-Consumer-Products-RVW69822697.htm","Anonymous employee","Current employee, less than 1 year","Mumbai","Good HR team and TATA values. Software in place","lack of systems & process - needs better Hardware","","",""
"5.0","22 Aug 2022","Overall Culture","https://www.glassdoor.co.in/Reviews/Employee-Review-Tata-Consumer-Products-RVW68188518.htm","Tse ii","Current employee, more than 1 year","Calcutta","","","Care for Culture in TCPL means a lot.. Happy to associated from last 2 years","System Training Required, since we are handling multiple categories","Show more"
"2.0","28 Sept 2022","Poor work life balance","https://www.glassdoor.co.in/Reviews/Employee-Review-Tata-Consumer-Products-RVW69573737.htm","Anonymous employee","Current employee, less than 1 year","","Still figuring out. As on time none","Poor work life balance and lake of trust","","",""
"5.0","23 Aug 2022","Engaging Culture","https://www.glassdoor.co.in/Reviews/Employee-Review-Tata-Consumer-Products-RVW68228190.htm","Anonymous employee","Current employee","","","","Based on my experience, the open culture and mutual respect across the organization has led to an engaging culture driving the growth.","The benefits far surpasses any con that exists","Show more"
"5.0","30 Sept 2022","wonderful","https://www.glassdoor.co.in/Reviews/Employee-Review-Tata-Consumer-Products-RVW69644512.htm","Management trainee","Former employee, less than 1 year","Bengaluru","","","best culture
good work life balance","slow growth after a first few months","Show more"
"5.0","22 Aug 2022","Great organization to work, many people undervalue organizational culture but TCPL works holistically for employees.","https://www.glassdoor.co.in/Reviews/Employee-Review-Tata-Consumer-Products-RVW68221874.htm","Anonymous employee","Current employee, more than 1 year","","","","Great Management
Good Leadership and good feedback process
Career opportunities","Stagnant supply chain if your are in Sales","Show more"
"5.0","7 Jul 2022","High impact opportunity. Truly believes in providing career opportunities to internal employees.","https://www.glassdoor.co.in/Reviews/Employee-Review-Tata-Consumer-Products-RVW66403648.htm","Anonymous employee","Current employee, more than 3 years","Mumbai","","","Focused on growth. Encourages initiative. Good place to make a career","Work life balance can be a challenge at times. Very lean structure and resources are stretched.","Show more"
"3.0","29 Sept 2022","Enriching","https://www.glassdoor.co.in/Reviews/Employee-Review-Tata-Consumer-Products-RVW69601780.htm","Sales and marketing intern","Former temporary employee","","Provides great opportunity for learning","Should focus more on interns.","","",""
"5.0","23 Aug 2022","Well balanced work life","https://www.glassdoor.co.in/Reviews/Employee-Review-Tata-Consumer-Products-RVW68228480.htm","Summer intern","Former intern, less than 1 year","Bengaluru","","","- Good value adding projects 
- Collaborative and helpful people
- Great platform to experiment yourself","- Initial stages of digital transformation","Show more"
"2.0","8 Feb 2022","All that glitters is not gold . Do not fall for the big name which almost everyone fall and the regret","https://www.glassdoor.co.in/Reviews/Employee-Review-Tata-Consumer-Products-RVW59295126.htm","Manager","Former employee, more than 1 year","Bengaluru","","","Very dynamic , in expansion mode , so lot of opportunities to set systems from scratch but focuses more on speed.

Please check the function under which your offered and from a business point of view if that function is critical . Do not fall for the brand name . Probe as much as you can on team size , nature of work , who you handle ,deliverables etc. Get that in a mail . Because functions or verticals that are not critical hardly have exposure or growth.","I understand every company is a package and you can't have a perfect company but you can select a company which has lesser negatives atleast that is not a bad deal. 

1. It is like a start up in the FMCG space, systems and processes are not in place . If you are from a major like HUL or an other bigger brand you woukd feel depressed .
 2.Extremely focuses cost as a priority over culture and process. Purely relies of third party manufacturers for over 90 percent of its supply hence not much scope and focus on value addition , process enhancement etc.
3. Recruitment process lacks transparency hence they would promise many things but after you join don't be suprised if u don't have a team or even don't have the same profile . In a tcpl scenario it's normal . So be ready for a suprise in this sense 
4. They as a company have moved from plantation model , British raj type of culture and to a large extent despite what they claim they still have it to a large extent . Senior leadership is to a large extent autocratic and do what I say mode . This culture translates downwards also . Very less openness towards a new way or idea 
5. Factories or own factories being less not much of a career place for those with a strong supply chain background 
6..Due to the old and archaic way of working and lack of openness on many occasions you will find the functions are reactive than proactive . 
7. There is a complete lack of alignment within departments on many occasions resulting in suprises more often .
8. Often focus is on cost and immediate share price increase through showing profit rather than long term culture
9. Empathy mentioned on the site as a value is purely restricted to the website. Do not expect to see an ounce of that within the management.
10. Job security is depending on what the senior management feels when they awake every morning. Sudden suprises and shock are a norm. 
11. Opportunities to set systems from scratch exist but the focus is on speed hence almost very often these systems are like a tick mark . Long term focus is hardly there .its more of a tick mark culture and focus is on speed without substance
12. For a company of this size the medical policy is way below par . Again the cost cutting part is of focus .
13 . Hardly any clarity on what your next role is and very little preperation on that angle
14. They recruit people without proper data on internal compensation offered and if you happen to be on the higher side on CTC in comparison to market when the annual increments come be ready to get suprised again . This again is a post facto thought, ideally if your CTC is higher than internal incumbents they should not have taken you but since they are reactive as always they willl take a candidate and then toy with his life .","Show more"
"3.0","16 Jul 2022","Good for Mediocre Performance","https://www.glassdoor.co.in/Reviews/Employee-Review-Tata-Consumer-Products-RVW66771933.htm","It director","Current employee, more than 3 years","Bengaluru","","","Work life balance 
Travel policies
Tata Name !","Top Management is not at all inspiring. Some 4-5 leaders are great though.","Show more"
"4.0","7 Jun 2022","Great workplace if you have the right team and connections","https://www.glassdoor.co.in/Reviews/Employee-Review-Tata-Consumer-Products-RVW65237012.htm","Associate manager","Former employee, more than 8 years","","","","Respectful culture, good exposure and largely a fast growing, mission aligned business","Fairly bureaucratic - the better connections you have the faster your growth

Those in the lower levels like JMS rarely see promotions and contract employees are not treated fairly/ they're overburdened etc","Show more"
"4.0","23 Aug 2022","Experience during Internship","https://www.glassdoor.co.in/Reviews/Employee-Review-Tata-Consumer-Products-RVW68228018.htm","Summer intern","Former intern, less than 1 year","","A new company, so lots of learning and lot of opportunities","Decision making takes time sometimes","","",""
"3.0","25 Aug 2022","Goverment like culture","https://www.glassdoor.co.in/Reviews/Employee-Review-Tata-Consumer-Products-RVW68343409.htm","Commercial finance manager","Former employee, less than 1 year","","Work life balance, work from home allowed","South Indians are given more preference over north Indians","","",""
"5.0","6 Jun 2022","One of the most exciting Tata companies to work for","https://www.glassdoor.co.in/Reviews/Employee-Review-Tata-Consumer-Products-RVW65182169.htm","Senior vice president talent & learning","Current employee","","","","Provides exceptional career opportunities, very involved CEO, promotes speak up culture there by enabling a feedback mechanism back to the mgmt. Good HR policies and provides flexibility where needed","Agile organization leading to constant pressure to deliver more","Show more"
"5.0","23 Aug 2022","Summer Internship","https://www.glassdoor.co.in/Reviews/Employee-Review-Tata-Consumer-Products-RVW68227550.htm","Summer intern","Current employee","","","","Becoming Process Oriented
High Emphasis on Sustainability","More focused or attentive towards employees","Show more"
"4.0","19 Aug 2022","Work Culture","https://www.glassdoor.co.in/Reviews/Employee-Review-Tata-Consumer-Products-RVW68107479.htm","Principal cloud architect","Current employee, more than 8 years","Guna","The work Culture is very good. and very supportive","I did not see much","","",""
"4.0","9 Aug 2022","Good company","https://www.glassdoor.co.in/Reviews/Employee-Review-Tata-Consumer-Products-RVW67733540.htm","Quality supervisor","Current contractor, more than 1 year","","Good work environment within the company and supportive seniors.","low salary and job security issues","","",""
"5.0","7 Aug 2022","Good company to work with","https://www.glassdoor.co.in/Reviews/Employee-Review-Tata-Consumer-Products-RVW67632442.htm","Senior manager, operations","Current employee, more than 3 years","New Delhi","Employee friendly and relatively stable","Slow upward growth in career","","",""
"5.0","26 Jun 2022","Media forward","https://www.glassdoor.co.in/Reviews/Employee-Review-Tata-Consumer-Products-RVW65979143.htm","Media lead","Former employee, more than 1 year","Bengaluru","","","Openness to ideas
Management support 
Positive work life balance","Hierarchical org structure 
Approval delays
Agency ecosystem not agile","Show more"
"3.0","13 Jul 2022","Sales manager at Tata consumer","https://www.glassdoor.co.in/Reviews/Employee-Review-Tata-Consumer-Products-RVW66658105.htm","Regional sales director","Former employee, more than 3 years","Bengaluru","Hunger for expansion. Will add many categories.","Lacks modern processes. Some old ways of working will pose challenges","","",""
"5.0","18 Jul 2022","Exp","https://www.glassdoor.co.in/Reviews/Employee-Review-Tata-Consumer-Products-RVW66815269.htm","Brand manager","Current employee","","Good Culture, Opportunities to explore new functions, Decent Work life balance","Scope for innovation is slightly backdated","","",""
"5.0","14 Jul 2022","Good","https://www.glassdoor.co.in/Reviews/Employee-Review-Tata-Consumer-Products-RVW66679900.htm","National key account manager","Current employee, more than 1 year","New Delhi","Good. They trust and care for people.","Nothing as such. Things are fine at all level.","","",""
"5.0","24 Jun 2022","Great Place to Work Indeed!","https://www.glassdoor.co.in/Reviews/Employee-Review-Tata-Consumer-Products-RVW65937705.htm","Manager","Current employee","","","","Career Movement Opportunities
Supportive Team
Transparent Culture","Work life balance sometimes becomes a challenge","Show more"
"5.0","30 May 2022","Superb company to work","https://www.glassdoor.co.in/Reviews/Employee-Review-Tata-Consumer-Products-RVW64848756.htm","Territory sales representative","Current employee, more than 3 years","Bengaluru","","","Much more growth opportunity is there","Lots of brands are getting added, which is making less focus on the main brands","Show more"
"5.0","12 Jun 2022","V Good","https://www.glassdoor.co.in/Reviews/Employee-Review-Tata-Consumer-Products-RVW65425266.htm","Anonymous employee","Former employee","","Very nice work culture present","Company in the growth phase had exhausting amount of work.","","",""
"4.0","21 May 2022","Good company to learn, Bad company to earn","https://www.glassdoor.co.in/Reviews/Employee-Review-Tata-Consumer-Products-RVW64480599.htm","Anonymous employee","Current employee, more than 3 years","Bengaluru","","","Flexible working hours.
Very friendly people","HR is very very bad.","Show more"
"5.0","10 Jun 2022","Intern","https://www.glassdoor.co.in/Reviews/Employee-Review-Tata-Consumer-Products-RVW65363199.htm","Intern","Current intern, less than 1 year","Bengaluru","","","Good working environment and culture","None that I can think of","Show more"
"5.0","3 Jun 2022","Good company to work","https://www.glassdoor.co.in/Reviews/Employee-Review-Tata-Consumer-Products-RVW65063861.htm","Anonymous employee","Current employee, less than 1 year","","Good Work culture and ethics","Lower pay compared to other fmcg","","",""
"4.0","17 May 2022","Tata consumer products","https://www.glassdoor.co.in/Reviews/Employee-Review-Tata-Consumer-Products-RVW64253320.htm","Management trainee","Current employee, less than 1 year","Mumbai","A lot of benefits and good work culture","pay very less compared to industry standards","","",""
"4.0","12 May 2022","A good firm to start with","https://www.glassdoor.co.in/Reviews/Employee-Review-Tata-Consumer-Products-RVW64028071.htm","Management trainee","Current employee","Mumbai","Great learning curve, freedom to do stints","Very less pay compared to industry standards","","",""
"4.0","22 Mar 2022","Overall employee freindly, Pay scale is low","https://www.glassdoor.co.in/Reviews/Employee-Review-Tata-Consumer-Products-RVW61559800.htm","Manager finance","Current employee, more than 3 years","Bengaluru","","","Good HR policies
Work Life balance","Lower Pay scale 
No Job rotation","Show more"
"4.0","19 Feb 2022","High standrds in terms of etical issues.","https://www.glassdoor.co.in/Reviews/Employee-Review-Tata-Consumer-Products-RVW59949124.htm","Factory manager","Current employee, more than 8 years","","","","Freedom to work is the best.","Decision making takes time in TCPL","Show more"
"5.0","9 Mar 2022","Good Company Culture","https://www.glassdoor.co.in/Reviews/Employee-Review-Tata-Consumer-Products-RVW60898260.htm","Human resources","Current contractor, less than 1 year","","","","Dynamic organisation, people are good, supportive","nothing as such , everything is good","Show more"
"5.0","23 Mar 2022","Good","https://www.glassdoor.co.in/Reviews/Employee-Review-Tata-Consumer-Products-RVW61622037.htm","Jr. executive","Current employee","","Plant with modern technology machine .","Location dry and very humid","","",""
"4.0","2 Feb 2022","Good company","https://www.glassdoor.co.in/Reviews/Employee-Review-Tata-Consumer-Products-RVW59006005.htm","Senior manager","Former employee, more than 1 year","Mumbai","","","Good management, work life balance is good, Transparent work culture","Sometimes things move slowly, certain policies and ways of working are little outdated, career growth can be slow","Show more"
"4.0","1 Mar 2022","Good Organisation To Grow","https://www.glassdoor.co.in/Reviews/Employee-Review-Tata-Consumer-Products-RVW60461507.htm","Executive","Current employee, more than 3 years","Tada","Good Employee culture. Good Plant Infrastructure.","Long term vision is not clear with Organisation","","",""
"2.0","14 Feb 2022","Not upto tata standards","https://www.glassdoor.co.in/Reviews/Employee-Review-Tata-Consumer-Products-RVW59659438.htm","Finance executive","Current employee, more than 1 year","Hebbal","Very less chances for learning and growing","As tata are new into this segment benefits /work culture not upto the mark..","","",""
"4.0","19 Jan 2022","Good place to work if the concerned leaders play their role appropriately.","https://www.glassdoor.co.in/Reviews/Employee-Review-Tata-Consumer-Products-RVW58228838.htm","Territory sales executive","Former employee","Surat","Dynamic working environment, team management, active learning experience.","Regional leadership not upto the mark. No guidance over planning of business.","","",""
"5.0","1 Feb 2022","Great Company","https://www.glassdoor.co.in/Reviews/Employee-Review-Tata-Consumer-Products-RVW58888928.htm","Manager","Current employee","","","","1. Work life balance 
2. Open door policy
3. Good Management","Nonee none none none none","Show more"
"1.0","24 Mar 2022","Not great","https://www.glassdoor.co.in/Reviews/Employee-Review-Tata-Consumer-Products-RVW61701205.htm","Assistant manager","Current employee","","","","Pay is good in this company","Work cuture is not good. Not a good atmosphere to work.","Show more"
"4.0","23 Jan 2022","Operation","https://www.glassdoor.co.in/Reviews/Employee-Review-Tata-Consumer-Products-RVW58414488.htm","Anonymous employee","Current employee, more than 1 year","","","","Gud place to work. management also treating well","Work life balance
No work from home","Show more"
"3.0","11 Jan 2022","Numer","https://www.glassdoor.co.in/Reviews/Employee-Review-Tata-Consumer-Products-RVW57752328.htm","Tse iii","Former employee, more than 3 years","","","","While working recognition u
Is their","After integration culture changed, very difficult","Show more"
"2.0","10 Jan 2022","TCPL","https://www.glassdoor.co.in/Reviews/Employee-Review-Tata-Consumer-Products-RVW57666851.htm","Territory sales executive","Current employee","Aurangābād, Maharashtra","TCPL is a good company for employees policy","TA and DA is very low as per industry","","",""
"1.0","21 Jan 2022","Team is pathetic","https://www.glassdoor.co.in/Reviews/Employee-Review-Tata-Consumer-Products-RVW58343296.htm","Territory sales","Current employee, more than 5 years","","","","Good brand value and customer pull","Useless team 
Nowork life balance","Show more"
"3.0","16 May 2020","Good company but mediocre remuneration","https://www.glassdoor.co.in/Reviews/Employee-Review-Tata-Consumer-Products-RVW33210555.htm","Sales development officer","Former employee, more than 3 years","Ludhiana","","","Most respected business house
Most ethical company 
Flexibility in work
Market leader in tea and salt segment
HR department is very good
Easy to sell products 
Job security,  I mean I have seen employees retiring after 58 years which is quite strange in private sector.","New management dont listen to subordinates
TATA is now not tata of sir JRD or sir ratan tata
Most of time consumed in manual data collection 
ASM or ASE compel SO to do all the work 
Salary structure is very awkward and strange, mean may be your junior is getting more salary than you but company will not listen to you.
Company dont try to understand why people left","Show more"
"3.0","8 Jun 2021","TCPL review","https://www.glassdoor.co.in/Reviews/Employee-Review-Tata-Consumer-Products-RVW48038325.htm","Asm (area sales manager)","Former employee, more than 10 years","Hyderābād","","","Tata Group company well established","Since two years respect for seniors going down, now they do not want seniority as co changing in to so called professionally managed co. Now It has become like other FMCG co Top management has been changed and lot of experience people left the co. At present no respect to seniority. Growth prospect is meagre.","Show more"
"5.0","27 Feb 2020","Excellent workplace - Forefront in audit innovation","https://www.glassdoor.co.in/Reviews/Employee-Review-Tata-Consumer-Products-RVW32091235.htm","Internal audit","Former employee, more than 3 years","Bengaluru","","","The work atmosphere was excellent.  I myself have worked hands-on in new age audits using data analytics, cyber security, social media etc., The Internal audit department has won many awards both in the national and international forums (e.g. CNBC, UBS, Tata innovista) etc.,  The IA leadership is very much appreciated at the Group level and they value IA recommendations. I personally don't agree with the other person's negative feedback about IA which I feel was done to malign and destabilize the IA department's reputation.","Nothing I know. I left TCP for a personal reason.","Show more"
"4.0","16 Apr 2015","TATA Global Beverages - A Great organization to work with","https://www.glassdoor.co.in/Reviews/Employee-Review-Tata-Consumer-Products-RVW6365244.htm","Function manager","Former employee, more than 3 years","Bengaluru","","","So Many - 

1- Good HR Policies
2- Good Senior Management
3- Good Employee Benefits
4- Strong cultural values
5 - People around are very friendly
6 - Good Salary package 
7- TGBL stands with you in every need
8 - People friendly CIO/CEO","Very Few but majorly - 
1- Sometimes promotions and benefits stuck because of your line manager.
2- Few managers/employees are absolute Incompetent","Show more"
"1.0","31 Mar 2019","Internal Audit","https://www.glassdoor.co.in/Reviews/Employee-Review-Tata-Consumer-Products-RVW25441951.htm","Anonymous employee","Former employee, more than 1 year","Bengaluru","","","Still seems to be a people oriented company","-Very old age thought process
-high bureaucratic and political working environment
-very people oriented work culture
-people only talk about processes but hardly follow
-Hardly any salary increase, if you need high raise you have to be boss's favorite
-Bosses only think about their thoughts, no value of subordinates. Some of them really treat them as their s****s

If you are 50-55 years old and want to spend rest of your life in peace join the company. Below that you are taking a high risk of stagnating you career","Show more"
"3.0","4 Oct 2021","Tata Group Company eagerly wanting to transform into a true blue MNC.","https://www.glassdoor.co.in/Reviews/Employee-Review-Tata-Consumer-Products-RVW53518067.htm","Vice president quality","Current employee","Bengaluru","","","Good Group, stable businesses, good work ethics, Honest, peaceful for performers who have the right connections.","Slow movers, getting to defensive, bureaucracy, Compartmentalised, very low risk taking ability, getting streamlined, Personality driven biased departments","Show more"
"2.0","18 Aug 2021","Pathetic leadership and work culture","https://www.glassdoor.co.in/Reviews/Employee-Review-Tata-Consumer-Products-RVW51304673.htm","Regional sales director","Current employee, more than 3 years","Chennai","","","Leave policy, Tata corporate brand name, leaders in salt and tea category","Pay is very less, increments are in low single digits, pathetic work culture, directionless leadership, none of the NPD's are successful, no major category except salt and tea, not good for channel partners and employees, low career advancement","Show more"
"4.0","13 Apr 2018","Global Master data Lead - Senior Manager","https://www.glassdoor.co.in/Reviews/Employee-Review-Tata-Consumer-Products-RVW20150768.htm","Global master data lead - senior manager","Current employee, more than 5 years","Bengaluru","","","Tatas culture and the Brand name, ethics  and values is what gives an edge to work for this company","off late Culture is changing and the org change and major changes across Tata group is not matching to the ethics of Tata","Show more"
